ticket_id,created_at_unix,event_id,perf_date,perf_time,venue,ticket_type,name_type,delivery_method,seller_name,seller_rating,order_num,ticket_tags,first_observed_at,last_observed_at,sold_at,status,quantity,price,raw_description,details_fetched,year_month
z4zjuwzkz9,1781487874998,acees-arena-tour-v,2026-08-30,17:30,Asueアリーナ大阪,electronic,female,同行,さ,5.0,,同行,2026-06-15 01:44:34,2026-06-26 23:01:20,,deleted,1,65000,"2連中の1枚(同行)/重複すり替え無し/初期当選/該当名義(変更ボタンあり)/有効期限内/下3桁提示可
当方那須担になりますので担当を気にされる方は購入をお控えください。
公演日当日、こちらの指定する時間に会場付近にてお待ち合わせをお願いいたします。
詳細は購入後メッセージボードにてお伝えいたします。
同時入場後当方の選ばなかった座席をお渡しさせていただきます。
連番内での座席選択権はございませんのでご了承をお願いいたします。
チケット受け取り後は速やかに受け取り完了連絡をお願いいたします。
座席に関するクレームは一切お受けいたしかねます。
交通の乱れやランダムエラー等、公演中止以外での返金はいたしかねます。
公演中止のみ手数料を差し引いた金額を返金いたします。
トラブル防止のため日本語の話せる日本人女性のみご購入をお願いいたします。",True,2026-06
eeu1qt6rl4,1781744488548,acees-arena-tour-v,2026-08-30,17:30,Asueアリーナ大阪,electronic,female,公演日1日前までにログイン情報お伝え,あ,4.9,,QR,2026-06-18 01:01:28,2026-06-26 23:01:20,,deleted,2,65000,"QRごと/該当名義/変更ボタンあり/初期当選/有効期限内/下3桁提示可能/発送物戻りなし/すりかえなし/着ブロ希望なし/Pay-easy決済
・公演前日までにログインに必要な情報をお伝えいたします。
・同行者登録は買い手様にてお願いいたします。
・入場後は速やかにログアウトと受取連絡をお願いいたします。
・座席に関するクレームは一切受け付けません。
・本人確認対応不可。
・公演中止以外返金対応いたしかねます。ランダムエラーや出演者変更、体調不良、本人確認等その他いかなる理由でも返金対応はできません。
・出演者変更や本人確認等いかなる理由での買い手様からのキャンセルもお伺いできません。
・トラブル防止のため代理購入はお控えください。必ず来場される方が購入ください。
上記内容にご理解いただける日本人女性の方のみご購入ください。外国人の方と見受けられる方は購入されましても受取連絡していただきます。",True,2026-06
etyqbpxnz1,1781141579780,acees-arena-tour-v,2026-08-30,17:30,Asueアリーナ大阪,electronic,female,同行,な,5.0,,番手,2026-06-11 01:32:59,2026-06-26 19:01:16,,deleted,2,55000,"3名義中2番手／該当名義／変更ボタンあり／初期当選／有効期限内／すり替えなし
・2連優先ですが、お譲り先が見つからなかった場合は単番でのお譲りも検討いたします。
・公演当日は当方と同時または端末貸し出しで入場していただきます。
・公共交通機関の遅延等、いかなる理由であっても集合時間に遅れた場合は、先に入場させていただきます。
・チケット発券時、QRコードの表示や発券作業にご協力いただく場合がございます。
・入場後、一度チケットを回収させていただきます。当方にて座席選択後、チケットをお渡しいたします。なお、買い手様による座席の選択はできません。
・座席確認のため、お渡しまでにお時間をいただく場合がございますが、必ず開演前までにお渡しいたします。
・座席や待ち時間に関するクレームは一切お受けできませんのでご了承ください。
・チケットお渡し後、その場で受取連絡をお願いいたします。
・公演中止以外（遅刻、ランダムエラー、検温、メンバー欠席等）いかなる理由でも返金・キャンセルはいたしかねます。受取連絡は必ず行っていただきますので、あらかじめご了承ください。
・公演中止の場合のみ、手数料を差し引いた金額を返金いたします。
・成人済みの日本人女性の方のみお願いいたします。
・ご希望があれば下3桁の提示が可能です。
・トラブル防止のため、代理購入はご遠慮ください。
・他サイトでも出品中ですので予めご了承ください。",True,2026-06
1ehlg1ggqz,1781028342949,acees-arena-tour-v,2026-08-30,17:30,Asueアリーナ大阪,electronic,female,同行,3,5.0,,番手,2026-06-09 18:05:42,2026-06-26 23:01:20,,deleted,2,62000,"2名義中2番手
該当名義 下3桁提示可 有効期限内 初期当選
公演中止以外のキャンセル不可",True,2026-06
sold_1780409586641,1780409586641,acees-arena-tour-v,2026-08-30,17:30,Asueアリーナ大阪,electronic,female,7名義中7番手,,,,,2026-06-02 14:13:06,2026-06-26 23:01:20,2026-06-20 16:01:09,sold,2,37000,"7名義中7番手 
初期当選 全て該当 有効期限内 変更ボタン有 下3桁提示可能

同時入場後、7名義中7番目の座席をお渡しいたします。

・当日会場付近にて集合...",False,2026-06
sold_1781586769220,1781586769220,acees-arena-tour-v,2026-08-30,17:30,Asueアリーナ大阪,electronic,female,同行,,,,,2026-06-16 05:12:49,2026-06-26 23:01:20,2026-06-20 16:01:09,sold,1,55000,"座席未定 情報局先行 2名義中2番手でのお渡し 全て該当名義 有効期限内 変更ボタンあり 初期当選 下3桁提示可能 すり替えなし 深田担不可

公演当日こちらの...",False,2026-06
etht7tpwod,1781528873573,acees-arena-tour-v,2026-08-30,17:30,Asueアリーナ大阪,electronic,female,同行,m,5.0,,同行,2026-06-15 13:07:53,2026-06-24 14:01:23,,deleted,1,70000,"初期当選/座席未定/重複すり替えなし同行/該当名義/下3桁提示可
深田担購入不可
・購入希望の方は、プライベート出品にさせていただきますのでメッセージお願いいたします。一部手渡しに変更可
・公演当日は開場10〜15分前を目安に開場付近で集合し、当方と同時入場していただきます。詳しい時間や場所に関しましては前日までにご連絡させていただきます。
・こちらが座席選択後にチケットをお渡しいたします。必ずその場で受け取り評価をお願いいたします。座席に関するクレームは一切お受けいたしませんのでご了承ください。
・買い手様のご都合や公共交通機関の乱れ等、如何なる場合でも遅刻された際は先に入場させていただきます。その場合も受け取り評価はしていただきます。
・体調不良やランダムエラー等で万が一入場できなかった場合でも返金は一切致しません。公演中止以外(交通機関の遅延、メンバー欠席、本人確認等)での返金は一切不可とさせていただきます。公演中止の場合のみ、手数料を差し引いた金額を返金いたします。
・日本語でスムーズにやりとりができ、当日入場されるご本人さまのみご購入ください。トラブル防止のため代理購入お断りいたします。
・ご購入後のキャンセルは一切お受けできませんのでご了承ください。質問等ございましたら購入前にお願いいたします。
・ご購入いただいた時点で、上記内容全て同意したものとみなします。",True,2026-06
gfe5ixl2n2,1781703572884,acees-arena-tour-v,2026-08-30,17:30,Asueアリーナ大阪,electronic,female,4名義中4番手,J,5.0,,番手,2026-06-17 13:39:32,2026-06-26 23:01:20,2026-06-23 14:01:21,sold,2,40000,"4名義中4番手
プラベル通し可能です。
全て初期当選/該当名義/有効期限内/すり替えなし/下3桁提示可能
遅刻や体調不良、入場時のランダムエラー、本人確認、一部出演者変更等如何なる場合でもキャンセルや返金対応不可とし受け取り連絡は必ず行っていただきます。
主催者側から公演中止の発表があった場合のみ、サイト規約に基づき手数料を差し引いた金額を返金いたします。
代理購入はお控えください。必ず購入者様ご自身が入場いただくようお願いいたします。
取引において 日本語での会話が可能な方のみご購入をお願いいたします。
男性でも購入いただいて構いません。
キャリーケース等の大きな荷物は事前にコインロッカー等に預けてからお越しください。
チケットお渡し後はサイチェン等ご自由にしていただいて構いません。
ご購入頂いた時点で上記に了承したものとみなします。",True,2026-06
o3jwsirp6j,1780284527935,acees-arena-tour-v,2026-08-30,17:30,Asueアリーナ大阪,electronic,female,同行,m,5.0,,同行記載あり,2026-06-01 03:28:47,2026-06-26 23:01:20,,deleted,1,70000,"当方との同行でのお譲りになります。
該当名義/有効期限内/変更ボタンあり/重複すり替えなし/下3桁提示可能/サイチェン可
那須担購入不可
公演当日、会場付近にて待ち合わせし、同時入場していただきます。待ち合わせの詳細は連絡ボードにて公演1日前に連絡致します。時間厳守でお願い致します。また、当日会場の電波が悪い可能性がありますので、電話番号の交換をお願い致します。
チケットのお渡しと同時にその場で受取評価をお願い致します。座席のクレームは一切お受けできません。
遅刻された場合は先に入場致しますが、ご購入者様の都合で遅れた場合でも受け取り評価はして頂きますので時間厳守でお願い致します。本人確認、入場時のエラー、出演者変更、体調不良等、買い手様の自己都合含め、いかなる場合も公演中止以外での返金は致しかねますのでご了承ください。
上記を理解し、当日までスムーズに連絡が取れる日本人女性のみご購入ください。",True,2026-06
x591jl1qjt,1780409758401,acees-arena-tour-v,2026-08-30,17:30,Asueアリーナ大阪,electronic,female,7名義中5番手,R,5.0,,番手,2026-06-02 14:15:58,2026-06-22 05:01:06,,deleted,2,52000,"7名義中5番手
初期当選 全て該当 有効期限内 変更ボタン有 下3桁提示可能
同時入場後、7名義中5番目にチケットをお選びいただきます。
・当日会場付近にて集合し、同時入場していただきます。同時入場後、座席選択のためお時間をいただく場合がございますがなるべく早くお渡しが出来るようにいたします。
・同行者登録はこちらで行いますが、同行者登録に必要な情報を教えていただく場合がございます。
・QR表示のために端末をお借りする場合がございます。
・発券時1人1枚手渡しされるようになり、チケット持ち逃げ防止のために身分証1点を一時的にお預かりいたします。封筒にも封をして中身を見ることはございません。
・公演当日は開場時間の15-30分前の集合を予定しております。詳細は公演前日までにお伝えいたします。
・スムーズな待ち合わせのために、当日連絡のつく電話番号の交換をお願いいたします。
・公演中止の場合のみ、手数料を差し引いた金額を返金いたします。
・本人確認やランダムエラー、体調不良、公共交通機関などの遅延・遅刻など、公演中止以外の如何なる理由で入場できなかった場合でも返金不可のためご了承ください。
・集合時間に大幅に遅れる場合先に入場いたします。その際でも受け取り評価は行っていただきますのでご了承ください。
・チケットお渡し後はその場で必ず受け取り評価をお願いいたします。
・座席未定のため、座席が悪いなどのクレームは一切受け付けませんのでご了承ください。
※トラブル防止のため代理購入はお控えください。
※連絡がスムーズで、時間厳守できる方でお願いします。
※録画、録音、その他迷惑行為等はおやめください。
ご購入いただいた時点で上記全てに同意いただいたものとみなします。",True,2026-06
sold_1780288843511,1780288843511,acees-arena-tour-v,2026-08-30,17:30,Asueアリーナ大阪,electronic,female,QRごと 前日にログイン情報共有,,,,,2026-06-01 04:40:43,2026-06-26 23:01:20,2026-06-20 16:01:09,sold,2,65000,"初期当選/有効期限内/同行者登録可能/下3桁提示可能/浮所名義

QRごとのお譲りになります。公演前日にログイン情報を共有いたしますので当日は買い手様ご自身でロ...",False,2026-06
huv83yqg2g,1781840913958,acees-arena-tour-v,2026-08-30,17:30,Asueアリーナ大阪,electronic,female,公演前日にログイン情報お伝え,た,5.0,,QR,2026-06-19 03:48:33,2026-06-26 23:01:20,,deleted,2,66000,"初期当選/該当名義/変更ボタンあり/下3桁提示可能/有効期限内/着ブロ希望なし
公演前日までにログインに必要な情報をお送り致します。
同行者登録は購入者の方でお願い致します。
本人確認/システムエラー/ランダムエラー/体調不良/遅延等の買い手様都合での返金やキャンセルはいかなる場合も不可。入場後は速やかにログアウト、受け取り連絡を必ずお願い致します。
トラブル防止のため購入は日本人女性のみ、また代理購入は御遠慮ください。
購入された場合、以上全てに同意の上と判断いたします。",True,2026-06
lsz72ko6jt,1780374784138,acees-arena-tour-v,2026-08-30,17:30,Asueアリーナ大阪,electronic,female,同行,Y,5.0,,ランダム,2026-06-02 04:33:04,2026-06-26 23:01:20,,deleted,2,30000,"１～3名義のみの少人数ランダム
公演当日、当方と同時入場をしていただきます。
入場の際、QRコード表示の為お手持ちのスマートフォン端末をお借りする場合がございます。
またトラブル防止の観点から身分証を一時的にお預かりする場合がございますが、こちらからチケットをお渡しさせて頂く際にご返却させていただきます。
同時入場後はチケットを回収させていただき、一度解散いたします。（再集合までのお時間はご自由にお過ごしいただいて構いません。）
座席確認のため、チケットをお渡しするまでにお時間をいただく可能性がございます。
開演5分前までにはお渡しさせていただきます。
🌟上乗せにて早渡しも検討いたします。
買い手様はお座席をお選びいただけません。また、座席や待ち時間に関するクレームは一切お受け致しかねますのでご了承ください。
初期当選でも立ち見が出る可能性があります、ご了承ください。
(交通機関等の遅延含め)遅刻、体調不良、ランダムエラー等、入場後の声かけによる退場、いかなる理由であれ入場できなかった場合でも返金・キャンセル等は承諾致しませんので、受け取り評価をしていただきます。公演中止の場合のみ、手数料を差し引いた金額を返金いたします。
チケットお渡し後はその場で受け取り連絡を済ませていただいた後、ご自由にしていただいて構いません。
詳しい待ち合わせ時間・場所等は追ってご連絡差し上げますが、開場時刻30分前に会場付近にて集合が可能な日本語がスムーズに話せる女性のみご購入ください。
トラブル防止の為、代理購入はお控えください。必ず当日会場に来られる方のアカウントから購入をお願いいたします。",True,2026-06
inlthg5mt8,1781883818601,acees-arena-tour-v,2026-08-30,17:30,Asueアリーナ大阪,electronic,female,同行,ゆ,5.0,,同行番手,2026-06-19 15:43:38,2026-06-26 23:01:20,,deleted,1,50000,"3名義中3番手の当方と同行
初期当選/有効期限内/すり替え無し/下3桁提示可能
こちらは3名義中3番手の当方との同行者を募集したチケットになります。ご確認の上ご購入お願い致します。
当方がお取引させていただいている方のチケットで3番手のチケットを頂くため、その3番手のチケットを当方と同行していただく形となります🙇‍♀️
当日は会場近くで待ち合わせし、同時入場して頂きます。詳しい集合場所･時間については確認のうえ改めてご連絡させていただきます。
ランダムエラー、公共交通機関の遅延、感染症、体調不良等の公演中止以外の理由で入場出来なかった場合のキャンセル･返金は対応致しかねますのでご了承ください。公演中止の場合のみ手数料を差し引いた金額を返金致します。
また、当方25↑浮所担になります。トラブル避ける為浮所担さん以外のご購入をお願い致します。これからも仲良くしていただける方と一緒に連番させていただければと思っております🙇‍♀️
上記承諾頂ける方のみご購入お願い致します。またプラベルに移行させていただけたらと思っておりますので確認のほどよろしくお願い致します。",True,2026-06
sold_1780275917568,1780275917568,acees-arena-tour-v,2026-08-30,17:30,Asueアリーナ大阪,electronic,none,同行,,,,,2026-06-01 01:05:17,2026-06-26 23:01:20,2026-06-20 16:01:09,sold,1,15900,"⭐️少人数ランダム配布⭐️
【上乗せで早渡し、中相場買取可】

ランダム配布であることをご理解の上、ご購入ください。
・当日は集合後、同時入場して頂きます。
・...",False,2026-06
zthpgq0lpq,1781240546160,acees-arena-tour-v,2026-08-30,17:30,Asueアリーナ大阪,electronic,female,同行,り,5.0,,番手,2026-06-12 05:02:26,2026-06-26 23:01:20,,deleted,2,70000,"・2名義中2番手 2連 初期当選
・2名義とも有効期間内の作間、深田名義
・下3桁提示可 すり替えなし
・最終当選歴 2名義ともスタンド
･公演当日は開場時間の10分前にこちらが指定した場所にお集まりいただき同時入場いたします。
･同行者登録は全てこちらで済ませます。
･お座席を確認後にこちらが選ばなかった席を2連でお渡しします。
･座席の確認にお時間をいただく場合がございますが、必ず開演20分までにはお渡しいたします。
･チケットをお渡しした際にその場で受取評価をお願いいたします。
ランダムエラー、1部出演者の出演見合わせ、ご購入者様の交通機関の遅延や体調不良によるキャンセルと返金は一切不可とさせていただきます。
主催者による公演中止の場合のみ返金いたします。
上記内容をご了承いただけた成人済の健康な日本人女性の方のみご購入をお願いいたします。",True,2026-06
aw03bmzfwb,1780927439292,acees-arena-tour-v,2026-08-30,17:30,Asueアリーナ大阪,electronic,female,同行,a,5.0,,番手,2026-06-08 14:03:59,2026-06-26 23:01:20,,deleted,2,89000,"4名義中2番手
全て初期当選、該当名義、変更ボタンあり、有効期限内、すり替えなし、下3桁提示可
公演当日、開場15分前頃に会場付近にて待ち合わせし同時入場していただきます。
待ち合わせ時間・場所等は後ほどご連絡します。
座席選択にお時間いただく場合がございます。当方が座席選択後残ったチケットをお渡し致します。
いかなるお座席でもクレーム・返金は受け付けておりません。
チケットをお渡しするタイミングで受取をお願い致します。
公演中止以外(本人確認・ランダムエラー・体調不良・遅刻・出演者変更等）如何なる場合でも受取していただきます。入金後の返金対応は致しません。
公演中止の際は手数料を差し引いた額を返金致します。
日本人女性のみご購入お願い致します",True,2026-06
vv9nijbgq0,1781940963108,acees-arena-tour-v,2026-08-30,17:30,Asueアリーナ大阪,electronic,female,同行,negi,5.0,,ランダム,2026-06-20 07:36:03,2026-06-26 23:01:20,,deleted,1,16500,"【ランダム配布】 5-10分前のお渡し 初期当選のみ
【下記注意事項を必ずご一読ください】
※公演当日、当方と同時入場をしていただきます。
※入場の際、QRコード表示の為お手持ちのスマートフォン端末をお借りする場合がございます。
※必ずではありませんがトラブル防止の観点から身分証を一時的にお預かりする場合がございます。
※同時入場後はチケットを回収させていただき、一度解散いたします。（再集合までのお時間はご自由にお過ごしいただいて構いません。）
※座席確認のため、チケットをお渡しするまでにお時間をいただく可能性がございます。
※買い手様はお座席をお選びいただけません。また、座席や待ち時間に関するクレームは一切お受け致しかねますのでご了承ください。
※初期当選でも立ち見が出る可能性があります。
※(交通機関等の遅延含め)遅刻、体調不良、ランダムエラー等、入場後の声かけによる退場、いかなる理由であれ入場できなかった場合でも返金・キャンセル等は承諾致しませんので、受け取り評価をしていただきます。公演中止の場合のみ、手数料を差し引いた金額を返金いたします。
※チケットお渡し後はその場で受け取り連絡を済ませていただいた後、ご自由にしていただいて構いません。
※詳しい待ち合わせ時間・場所等は追ってご連絡差し上げますが、開場時刻30-45分前に会場付近にて集合が可能な日本語がスムーズに話せる女性のみご購入ください。
※トラブル防止の為、代理購入はお控えください。必ず当日会場に来られる方のアカウントから購入をお願いいたします。
【ご購入された場合、上記全てに同意されたものとさせていただきます。】",True,2026-06
1yi1x7kq79,1781976249846,acees-arena-tour-v,2026-07-10,12:30,有明アリーナ,electronic,female,同行,a,5.0,,同行番手,2026-06-20 17:24:09,2026-06-26 23:01:20,2026-06-21 07:01:02,sold,1,10651,"2名義中1番手
2連中の1枚(同行)//初期当選/該当名義(変更ボタンあり)/有効期限切れ/下3桁提示可
公演日当日、こちらの指定する時間に会場付近にてお待ち合わせをお願いいたします。
詳細は前日夜もしくは当日朝にメッセージボードにてお伝えいたします。
同時入場後座席を選択し、当方の選ばなかった座席をお渡しさせていただきます。
連番内での座席選択権はございませんのでご了承をお願いいたします。
チケット受け取り後は速やかに受け取り完了連絡をお願いいたします。
座席に関するクレームは一切お受けいたしかねます。
本人確認対応不可となります。
交通の乱れや遅刻、買い手様都合によるキャンセル、ランダムエラー、本人確認等、公演中止以外での返金はいたしかねます。
公演中止のみ手数料を差し引いた金額を返金いたします。",True,2026-06
f0lmme7w8b,1781978008033,acees-arena-tour-v,2026-07-10,12:30,有明アリーナ,electronic,female,同行,ぽ,5.0,,番手,2026-06-20 17:53:28,2026-06-26 23:01:20,,deleted,2,25000,"2名義中2番手
初期当選、下3桁提示可、 該当名義、有効期限内、すり替えなし
当日会場付近にて集合し同時入場いたします。
詳しい時間、場所等は購入後当日までにご連絡いたします。
入場後チケットを1度回収させていただきます。当方が座席選択をした後にお渡しいたします。
チケットをお渡ししましたら速やかに受取通知をお願いします。
チケットのお渡しを速やかに行うために、事前に電話番号の交換をお願いしております。
座席のクレーム受け付けません。
本人確認、ランダムエラー、体調不良等、買い手様の自己都合含め、いかなる場合も公演中止以外での返金は致しかねますのでご了承ください。
待ち合わせの時間は厳守でお願い致します。
ご購入者様が遅刻した際は先に入場させていただく場合がございます。
その際も受取連絡はして頂きますので、お時間に余裕を持ってお越しください。",True,2026-06
