ticket_id,created_at_unix,event_id,perf_date,perf_time,venue,ticket_type,name_type,delivery_method,seller_name,seller_rating,order_num,ticket_tags,first_observed_at,last_observed_at,sold_at,status,quantity,price,raw_description,details_fetched,year_month
i8cqysgm9n,1782189097190,acees-arena-tour-v,2026-07-12,17:30,有明アリーナ,electronic,female,同行,h,5.0,,番手,2026-06-23 04:31:37,2026-06-25 01:01:13,,deleted,1,20000,"6名義中6番手
全て該当名義、初期当選、変更ボタンあり、有効期限内、下3桁提示可能
・開場45分前をめどに会場付近にて集合予定
・同時入場後1度チケットを回収し、すぐにすり替えずにお渡しします
・必ず入場するご本人様がご購入ください
・座席選択権はありません
・お席に関するクレームは受け付けていません
・席種未定(立ち見が含まれる可能性があります)
・集合時間に遅れた場合待たずに入場する場合がありますが受け取りはして頂きます
・同行者登録の為にお名前(必ず本名)、お電話番号(当日繋がるもの)をお聞きします
・入場の際身分証を一時的に預かる可能性がありますが入場後すぐに返却いたします
・ランダムエラーの場合定価手数料分を除いた上乗せ金額につきましては返金いたしますが、定価手数料分は返金不可となります。
・その他天候、交通手段、出演者変更などいかなる理由でも一切の返金はいたしません。
・公演中止の場合にはサイトを通して返金いたします。
上記全てにご同意頂ける日本人女性のみご購入ください。",True,2026-06
sold_1782000475241,1782000475241,acees-arena-tour-v,2026-07-12,17:30,有明アリーナ,electronic,none,同行,,,,,2026-06-21 00:07:55,2026-06-26 23:01:20,2026-06-23 06:01:09,sold,1,1500,【開演25分前までに半券お渡し:1枚14000円にて対応可能です。ご希望の場合は編集しますので必ずコメントください。ご希望がない場合はこのままご購入ください】...,False,2026-06
0sn775g5id,1782197734835,acees-arena-tour-v,2026-07-12,17:30,有明アリーナ,electronic,none,同行,た,4.9,,ランダム,2026-06-23 06:55:34,2026-06-24 17:01:12,,deleted,1,1500,"【開演25分前までに半券お渡し:1枚14000円にて対応可能です。ご希望の場合は編集しますので必ずコメントください。ご希望がない場合はこのままご購入ください】
複数名義分のチケットを所持しております。
当日は開場30分前を目安に会場付近でお待ち合わせさせていただきます。ご一緒に入場後、チケットは一度回収し、その後ご連絡のうえでお渡しいたします。
※お座席に関するクレーム・ご要望は一切お受けできませんので、あらかじめご了承ください。 ※待ち合わせ時間に遅れた場合も、受け取り連絡（評価）はお願いしております。その際のご返金はできかねますのでご注意ください。
複数名義分を所持している都合上、チケットの選定にお時間をいただく場合がございます。あらかじめご理解のほどお願いいたします。
来られなくなった場合もキャンセルは不可のため受取連絡をお願いします
日本語の通じる、日本で通話可能な電話番号をお持ちの方のみ購入をお願いします",True,2026-06
sold_1782195525035,1782195525035,acees-arena-tour-v,2026-07-12,17:30,有明アリーナ,electronic,none,同行,,,,,2026-06-23 06:18:45,2026-06-26 23:01:20,2026-06-23 07:01:11,sold,1,1500,【開演25分前までに半券お渡し:1枚14000円にて対応可能です。ご希望の場合は編集しますので必ずコメントください。ご希望がない場合はこのままご購入ください】...,False,2026-06
5icgf32liz,1782199188977,acees-arena-tour-v,2026-07-12,12:30,有明アリーナ,electronic,female,【条件あり】当日手渡し/座席未定/ランダム配布/有効会員名義,♡♡♡,4.7,,同行ランダム,2026-06-23 07:19:48,2026-06-26 23:01:20,,deleted,2,3000,"《開場30分前集合予定》
※レビュー(評価4.8以上)ある方のみ申請下さい。
※申請時のコメント不要です。
★購入後に当日連絡のつくお電話番号と氏名(苗字)をメッセージボードにてお伝え下さい。
・複数名義所持しており、こちらで座席選択後にランダムで配布致します。 発券後はチケットを一旦回収し、座席を選択させて頂きます。その際にお時間頂く場合がございますが、ご了承下さい。こちらのチケットは、【開演5〜10分前頃】に配布予定となります。ご理解の程、よろしくお願い致します。 ・個人都合による遅刻等に関しましては、お待ち出来兼ねますので必ず時間厳守でお願い致します。万が一、ご購入者様の遅刻によりこちらが先に入場した場合にも、受取り連絡して頂きます。 ・入場の際のQRコード表示や同行者登録にご協力頂く場合がございますのでその際はご対応頂ける方でお願い致します。 ・座席へのクレーム(立見、制作開放等)、遅刻、本人確認、ランダムエラーなど、公演中止以外の如何なる場合においても返金は致しません。個人都合によるキャンセルの場合は、どのような事情であっても受取り連絡をお願い致します。 以上の内容をご理解頂ける方のみご購入お願い致します。",True,2026-06
c84r4dw2x1,1782199225269,acees-arena-tour-v,2026-07-12,17:30,有明アリーナ,electronic,female,【条件あり】当日手渡し/座席未定/ランダム配布/有効会員名義,♡♡♡,4.7,,同行ランダム,2026-06-23 07:20:25,2026-06-26 23:01:20,2026-06-23 10:01:18,sold,2,2000,"《開場30分前集合予定》
※レビュー(評価4.8以上)ある方のみ申請下さい。
※申請時のコメント不要です。
★購入後に当日連絡のつくお電話番号と氏名(苗字)をメッセージボードにてお伝え下さい。
・複数名義所持しており、こちらで座席選択後にランダムで配布致します。 発券後はチケットを一旦回収し、座席を選択させて頂きます。その際にお時間頂く場合がございますが、ご了承下さい。こちらのチケットは、【開演5〜10分前頃】に配布予定となります。ご理解の程、よろしくお願い致します。 ・個人都合による遅刻等に関しましては、お待ち出来兼ねますので必ず時間厳守でお願い致します。万が一、ご購入者様の遅刻によりこちらが先に入場した場合にも、受取り連絡して頂きます。 ・入場の際のQRコード表示や同行者登録にご協力頂く場合がございますのでその際はご対応頂ける方でお願い致します。 ・座席へのクレーム(立見、制作開放等)、遅刻、本人確認、ランダムエラーなど、公演中止以外の如何なる場合においても返金は致しません。個人都合によるキャンセルの場合は、どのような事情であっても受取り連絡をお願い致します。 以上の内容をご理解頂ける方のみご購入お願い致します。",True,2026-06
wondifliz6,1782202035280,acees-arena-tour-v,2026-07-11,17:30,有明アリーナ,electronic,female,少人数ランダム,り,5.0,,ランダム,2026-06-23 08:07:15,2026-06-26 23:01:20,,deleted,2,8000,"少人数ランダムとなります。公演当日は、開場15分前に会場付近にて待ち合わせし、同時入場していただきます。
詳しい待ち合わせ場所等は、ご入金後にマイページの連絡ボードでお知らせいたします。
同時入場後は座席確認のため一度チケットを回収いたします。
チケットのお渡しが可能になったら、お電話にてお呼びしますので当日連絡のつく電話番号のご提示をお願いいたします。
開演5-10分前までにチケットをお渡しいたしますが、早くお渡しする場合もございますのでご了承ください。
必ず2枚連番のチケットをお渡しいたします。
公演中止以外はいかなる理由の場合も返金致しかねます。
全てに同意いただけた方のみご購入をお願いいたします。",True,2026-06
9vqed8ztxo,1782201983313,acees-arena-tour-v,2026-07-11,17:30,有明アリーナ,electronic,female,少人数ランダム,り,5.0,,ランダム,2026-06-23 08:06:23,2026-06-26 23:01:20,,deleted,2,8000,"少人数ランダムとなります。公演当日は、開場15分前に会場付近にて待ち合わせし、同時入場していただきます。
詳しい待ち合わせ場所等は、ご入金後にマイページの連絡ボードでお知らせいたします。
同時入場後は座席確認のため一度チケットを回収いたします。
チケットのお渡しが可能になったら、お電話にてお呼びしますので当日連絡のつく電話番号のご提示をお願いいたします。
開演5-10分前までにチケットをお渡しいたしますが、早くお渡しする場合もございますのでご了承ください。
公演中止以外はいかなる理由の場合も返金致しかねます。
全てに同意いただけた方のみご購入をお願いいたします。",True,2026-06
sold_1780875017207,1780875017207,acees-arena-tour-v,2026-07-12,12:30,有明アリーナ,electronic,none,同行,,,,,2026-06-07 23:30:17,2026-06-26 23:01:20,2026-06-23 09:01:12,sold,2,9000,【開演25分前までに半券お渡し:1枚14500円にて対応可能です。ご希望の場合は編集しますので必ずコメントください。ご希望がない場合はこのままご購入ください】...,False,2026-06
ybnr3qtl61,1782203729258,acees-arena-tour-v,2026-07-12,12:30,有明アリーナ,electronic,none,同行,た,4.9,,ランダム,2026-06-23 08:35:29,2026-06-25 10:01:16,,deleted,2,9500,"【開演25分前までに半券お渡し:1枚14500円にて対応可能です。ご希望の場合は編集しますので必ずコメントください。ご希望がない場合はこのままご購入ください】
複数名義分のチケットを所持しております。
当日は開場30分前を目安に会場付近でお待ち合わせさせていただきます。ご一緒に入場後、チケットは一度回収し、その後ご連絡のうえでお渡しいたします。
※お座席に関するクレーム・ご要望は一切お受けできませんので、あらかじめご了承ください。 ※待ち合わせ時間に遅れた場合も、受け取り連絡（評価）はお願いしております。その際のご返金はできかねますのでご注意ください。
複数名義分を所持している都合上、チケットの選定にお時間をいただく場合がございます。あらかじめご理解のほどお願いいたします。
来られなくなった場合もキャンセルは不可のため受取連絡をお願いします
日本語の通じる、日本で通話可能な電話番号をお持ちの方のみ購入をお願いします",True,2026-06
np45fp1jn2,1782203683898,acees-arena-tour-v,2026-07-12,17:30,有明アリーナ,electronic,none,同行,た,4.9,,ランダム,2026-06-23 08:34:43,2026-06-26 23:01:20,,deleted,2,8500,"【開演25分前までに半券お渡し:1枚14000円にて対応可能です。ご希望の場合は編集しますので必ずコメントください。ご希望がない場合はこのままご購入ください】
複数名義分のチケットを所持しております。
当日は開場30分前を目安に会場付近でお待ち合わせさせていただきます。ご一緒に入場後、チケットは一度回収し、その後ご連絡のうえでお渡しいたします。
※お座席に関するクレーム・ご要望は一切お受けできませんので、あらかじめご了承ください。 ※待ち合わせ時間に遅れた場合も、受け取り連絡（評価）はお願いしております。その際のご返金はできかねますのでご注意ください。
複数名義分を所持している都合上、チケットの選定にお時間をいただく場合がございます。あらかじめご理解のほどお願いいたします。
来られなくなった場合もキャンセルは不可のため受取連絡をお願いします
日本語の通じる、日本で通話可能な電話番号をお持ちの方のみ購入をお願いします",True,2026-06
sold_1781482487328,1781482487328,acees-arena-tour-v,2026-07-11,12:30,有明アリーナ,electronic,female,入金後3時間以内にQRコード共有,,,,,2026-06-15 00:14:47,2026-06-26 23:01:20,2026-06-23 10:01:18,sold,2,32000,"情報局先行 初期当選 ACEes 浮所飛貴名義 指定席 2枚申し込み QRごとのお譲り 条件ご
ざいません 座席未定

情報局先行 ２枚申込みでの当選
都合によ...",False,2026-06
2ykbzia2u8,1782211688829,acees-arena-tour-v,2026-07-10,12:30,有明アリーナ,electronic,female,同行,まひ,5.0,,番手,2026-06-23 10:48:08,2026-06-26 23:01:20,,deleted,2,30000,"☆2名義中2番手‪☆
初期当選/該当2/有効期限内/変ボ有/下3桁提示可能
集合は11時頃会場付近を予定しておりますので時間厳守でお願い致します。待ち合わせ場所は決まりましたらお伝えします。
《注意事項》
・入場後は一度離れて頂き、座席確認を行いますのでお時間を頂く場合がございます。当方が選ばなかった2番手をお渡しします。
・チケットをお渡しと引き換えにその場で受け取り評価をお願いします。
・公演中止となった場合のみ、手数料を差し引いた返金対応致します。
・エラーや体調不良、交通機関等の如何なる理由でも取引確定後のキャンセルは一切受け付けておりませんのでご了承ください。たとえ待ち合わせ時間から大幅に遅れる場合でも、先に入場する可能性があるので余裕をもってお越しください。
・トラブル防止のため、日本人女性のみご購入ください。
・チケットお渡し後座席変更可能ですが、名前を傷つけるような行為は絶対にやめてください。",True,2026-06
dkcy8j934p,1782209016417,acees-arena-tour-v,2026-07-10,12:30,有明アリーナ,electronic,female,同行,a,5.0,,同行,2026-06-23 10:03:36,2026-06-26 23:01:20,2026-06-23 12:01:13,sold,1,30000,"2連中1枚同行/初期当選/該当名義/重複・すり替えなし/変更ボタン有/下3桁提示可/有効期限内/サイチェン可/深田担✖️
公演当日開演1時間前を目安に会場付近に集合し、同時入場していただきます。
当方が座席選択後チケットをお渡しいたしますのでその場で受取連絡をお願いいたします。 大幅に遅刻された場合、待たずに入場させていただきますが、その際も必ず受取連絡していただきます。  座席のクレームは一切受け付けません。 チケットお渡し後のサイチェンなど可能ですが、トラブルは一切責任を負いません。 また、名義に傷のつく行為はお辞め下さい。  公演中止の場合のみ手数料を差し引いた金額を返金いたします。 公演中止以外本人確認、ランダムエラー、出演者の変更、公共交通機関の遅延、体調不良などの如何なる場合でも返金は致しかねますのでご了承下さい。  トラブル防止のため、日本人女性の方のみご購入ください。代理購入不可です。",True,2026-06
sold_1782000691548,1782000691548,acees-arena-tour-v,2026-07-12,12:30,有明アリーナ,electronic,none,同行,,,,,2026-06-21 00:11:31,2026-06-26 23:01:20,2026-06-23 11:01:13,sold,1,1500,【開演25分前までに半券お渡し:1枚15000円にて対応可能です。ご希望の場合は編集しますので必ずコメントください。ご希望がない場合はこのままご購入ください】...,False,2026-06
90l2pnwnb0,1782211699803,acees-arena-tour-v,2026-07-12,12:30,有明アリーナ,electronic,none,同行,た,4.9,,ランダム,2026-06-23 10:48:19,2026-06-26 23:01:20,,deleted,1,1500,"【開演25分前までに半券お渡し:1枚15000円にて対応可能です。ご希望の場合は編集しますので必ずコメントください。ご希望がない場合はこのままご購入ください】
複数名義分のチケットを所持しております。
当日は開場30分前を目安に会場付近でお待ち合わせさせていただきます。ご一緒に入場後、チケットは一度回収し、その後ご連絡のうえでお渡しいたします。
※お座席に関するクレーム・ご要望は一切お受けできませんので、あらかじめご了承ください。 ※待ち合わせ時間に遅れた場合も、受け取り連絡（評価）はお願いしております。その際のご返金はできかねますのでご注意ください。
複数名義分を所持している都合上、チケットの選定にお時間をいただく場合がございます。あらかじめご理解のほどお願いいたします。
来られなくなった場合もキャンセルは不可のため受取連絡をお願いします
日本語の通じる、日本で通話可能な電話番号をお持ちの方のみ購入をお願いします",True,2026-06
bi44kwzgfg,1782218083783,acees-arena-tour-v,2026-07-11,12:30,有明アリーナ,electronic,female,入金後3時間以内にQRコード共有,ユカ,5.0,,QR,2026-06-23 12:34:43,2026-06-26 23:01:20,,deleted,2,32000,"情報局先行 ACEes 佐藤龍我名義 初期当選 指定席 2枚申し込み QRごとのお譲り 条件ございません 座席未定
情報局先行 ２枚申込みでの当選しました。
１回目の申し込みで当選しました。
席種：指定席になります。
復活当選、制作開放、立見指定ではございません。
ACEes 佐藤龍我名義(変更ボタンあり)
会員番号９１万番台～１０３万番台の間
有効会員です。
複数当選ございません。この公演のみ当選になります。
支払い方法ペイジー選択にて
銀行ATMにて現金でお支払いも完了しております。
QRコードごとのお譲りになります。条件もございません。
同行者登録は購入者様のほうでお願い致します。
QRコード表示に必要な会員番号、パスワードをお知らせさせていただきます。
公演中止以外での返金は致しかねます。ご了承ください。
公演中止の場合は、手数料を差し引いたを金額を返金させていただきます。",True,2026-06
anxzoh54jt,1782216969221,acees-arena-tour-v,2026-07-12,12:30,有明アリーナ,electronic,female,同行,おんぷ,5.0,,同行,2026-06-23 12:16:09,2026-06-26 23:01:20,,deleted,1,45000,"有効期限内/初期当選/本人確認可/該当名義(ボタンあり)下三桁提示可/サイチェン不可/
公演当日は指定した時刻に会場付近にお集まりいただき同時入場していただきます。
1名義同行ですので発券した名義のうちのどちらかをお渡しします。
最後までお渡しした席でお楽しみください。
日本人女性のみ購入をお願いいたします。
必ず時間厳守お願いいたします。
遅刻された場合は購入者様のご都合でキャンセルとし、返金はできかねます。
待ち合わせ場所の詳細は公演当日に連絡ボードからご連絡させていただきます。
購入者の都合(交通機関・体調不良・濃厚接触者・遅刻等)・本人確認等その他ランダムエラーなどで入場できなかった場合、返金対応出来ませんのでご理解下さい。
当日まで座席未定の為、座席に関するクレームや返金はお受け致しません。
またチケットを受け取り次第その場ですぐに受け取り連絡をお願い致します。如何なる場合でも送金停止は受け付けません。
最終解散後の返金は一切応じません。
上記内容をご理解いただける方のみご購入ください。",True,2026-06
ufgrxx23lv,1782221558091,acees-arena-tour-v,2026-07-10,17:30,有明アリーナ,electronic,female,公演前日にログイン情報共有,♡,5.0,,QR,2026-06-23 13:32:38,2026-06-23 15:01:24,,deleted,2,40000,"QR毎/該当名義/有効期限内/初期選/変更ボタンあり/重複すり替えなし/下3桁提示可
公演前日にログイン情報をお伝え致します。
同行者登録、同意チェックはご購入者様にてご対応をお願いいたします。
入場後は速やかにログアウト、受け取り評価をお願いいたします。エラー、本人確認等の公演中止以外で入場が出来なかった場合返金対応は一切致しません。",True,2026-06
47aw6pf1p2,1782221112570,acees-arena-tour-v,2026-07-11,12:30,有明アリーナ,electronic,female,前日ログイン情報お伝えします,かちよ,5.0,,QR,2026-06-23 13:25:12,2026-06-26 23:01:20,,deleted,1,50000,"単番　浮所名義　期限内名義
しばらく使ってない名義になります",True,2026-06
sold_1782178041021,1782178041021,acees-arena-tour-v,2026-07-11,17:30,有明アリーナ,electronic,none,同行,,,,,2026-06-23 01:27:21,2026-06-26 23:01:20,2026-06-23 14:01:21,sold,2,7500,【開演25分前までに半券お渡し:1枚15500円にて対応可能です。ご希望の場合は編集しますので必ずコメントください。ご希望がない場合はこのままご購入ください】...,False,2026-06
1ojyg5gxo8,1782221976658,acees-arena-tour-v,2026-07-12,12:30,有明アリーナ,electronic,female,【条件あり】当日手渡し/座席未定/ランダム配布/有効会員名義,♡♡♡,4.7,,同行ランダム,2026-06-23 13:39:36,2026-06-26 23:01:20,,deleted,2,5000,"《開場30分前集合予定》
※2枚でご購入頂けた場合、連番確約です。
※レビュー(評価4.8以上)ある方のみ申請下さい。
※申請時のコメント不要です。
★購入後に当日連絡のつくお電話番号と氏名(苗字)をメッセージボードにてお伝え下さい。
・複数名義所持しており、こちらで座席選択後にランダムで配布致します。 発券後はチケットを一旦回収し、座席を選択させて頂きます。その際にお時間頂く場合がございますが、ご了承下さい。こちらのチケットは、【開演5〜10分前頃】に配布予定となります。ご理解の程、よろしくお願い致します。 ・個人都合による遅刻等に関しましては、お待ち出来兼ねますので必ず時間厳守でお願い致します。万が一、ご購入者様の遅刻によりこちらが先に入場した場合にも、受取り連絡して頂きます。 ・入場の際のQRコード表示や同行者登録にご協力頂く場合がございますのでその際はご対応頂ける方でお願い致します。 ・座席へのクレーム(立見、制作開放等)、遅刻、本人確認、ランダムエラーなど、公演中止以外の如何なる場合においても返金は致しません。個人都合によるキャンセルの場合は、どのような事情であっても受取り連絡をお願い致します。 以上の内容をご理解頂ける方のみご購入お願い致します。",True,2026-06
6lctwp57fm,1782225021160,acees-arena-tour-v,2026-07-10,12:30,有明アリーナ,electronic,female,公演日前日にログイン情報共有,A,5.0,,QR,2026-06-23 14:30:21,2026-06-26 23:01:20,,deleted,2,35000,"QR毎/初期当選/該当名義/有効期限内/下３桁提示可/同行者登録可/変更ボタン有/重複すり替え無
・公演中止以外のランダムエラー、本人確認、公共交通機関の遅延など主催者側の都合による公演中止以外での返金対応は一切いたしません。いかなる場合でも必ず受取連絡していただきますのであらかじめご了承ください。
・公演中止の場合のみ手数料を差し引いた金額を返金いたします。
・購入後はいかなる場合でもキャンセル、返金はできかねます。
・入場後は速やかにログアウト、公演始まるまでに受取評価をお願いいたします。
・デジタルチケットのため、座席に関するクレームは一切受け付けません。",True,2026-06
sold_1782224564998,1782224564998,acees-arena-tour-v,2026-07-10,17:30,有明アリーナ,electronic,female,公演日1日前までにQRコード共有,,,,,2026-06-23 14:22:44,2026-06-26 23:01:20,2026-06-23 15:01:24,sold,2,36222,"QR毎/該当名義/有効期限内/初期選/変更ボタンあり/重複すり替えなし/下3桁提示可
公演前日にログイン情報をお伝え致します。
同行者登録、同意チェックはご購入...",False,2026-06
