ticket_id,created_at_unix,event_id,perf_date,perf_time,venue,ticket_type,name_type,delivery_method,seller_name,seller_rating,order_num,ticket_tags,first_observed_at,last_observed_at,sold_at,status,quantity,price,raw_description,details_fetched,year_month
pku471d9ze,1781695683945,acees-arena-tour-v,2026-07-11,17:30,有明アリーナ,electronic,female,3名義中2番手,ri,5.0,,同行番手,2026-06-17 11:28:03,2026-06-26 23:01:20,,deleted,2,35000,"3名義中2番手
初期当選・該当名義（変更ボタンあり）・有効期限内・すり替えなし・下3桁提示可能
16時45分〜17時ごろ会場付近にてお待ち合わせお願いします。
同時入場し発券後、当方の選ばなかったお席をお渡しします。（バラで購入の場合、同じく2番手の方とご相談の上、座席を選択ください）
チケットお渡し後、すぐに受け取り通知をお願いいたします。必ず当日ご入場するご本人様のご購入でお願いいたします。
目の前で受取通知頂けない場合は、半券はお渡し出来ませんので、ご了承ください。
公演中止の場合のみ、返金対応可。ランダムエラー、公共交通機関による遅延、体調不良等買い手様都合のキャンセル、どのような事情でも返金対応は一切お受けできませんので予めご了承ください。
10分以上遅刻された場合は先に入場させて頂きます。
常識ある20歳以上の日本人女性のみ購入申請よろしくお願いいたします。",True,2026-06
sold_1780992296365,1780992296365,acees-arena-tour-v,2026-07-11,17:30,有明アリーナ,electronic,female,同行,,,,,2026-06-09 08:04:56,2026-06-26 23:01:20,2026-06-20 16:01:09,sold,1,30000,"座席未定 情報局先行 2名義中2番手でのお渡し 全て該当名義 有効期限内 変更ボタンあり 初期当選 下3桁提示可能 すり替えなし 

公演当日こちらの指定した時...",False,2026-06
vto5iq14m2,1781974259554,acees-arena-tour-v,2026-07-11,17:30,有明アリーナ,electronic,female,同行,ゆう,5.0,,同行,2026-06-20 16:50:59,2026-06-26 23:01:20,,deleted,1,40000,"初期当選/該当名義/重複すり替えなし/下3桁提示可/有効期限内/浮所担不可
開場時間を目安に待ち合わせいたします。
チケットは1度回収、座席確認後当方が選ばなかった方をお渡しいたします。
公演中止の場合は返金いたしますが、その他買い手様の都合、出演者変更、本人確認、ランダムエラー等による返金はいたしません。
プライベート出品、プラベル対応可能。",True,2026-06
bgh61bt09z,1781884384892,acees-arena-tour-v,2026-07-11,17:30,有明アリーナ,electronic,female,同時入場,みみ,5.0,,番手,2026-06-19 15:53:04,2026-06-24 15:01:19,,deleted,1,21000,"6名義中5番手 すり替えなし
プラベル19000に値下げ可
情報局/初期当選×5、復活×1/該当名義/変更ボタンあり/期限内/着ブロ指定なし/郵便物戻りなし
ご希望があれば事前の会員番号下3桁提示可
チケットについて
・発券後チケットを回収します。
・こちらが座席を選択した後、5番手のチケットをお渡しします。残り2名義(4枚)からの座席選択をしていただきます。引いた座席へのクレームは受け付けません。受取連絡画面を確認次第半券をお渡しします。
・お渡しの際に必ず受取連絡をお願いします。
・お渡し後はお好きにしていただき構いません。
待ち合わせ・入場
・購入後にこちらの連絡を待たず当日連絡が取れる電話番号・点呼の際のお名前(偽名可)の送信をお願いします。
・待ち合わせ等の詳細は前日夜に連絡します。
・開場20-30分前を目安に会場付近待ち合わせ、同時入場。時間になり次第移動しますので時間厳守。
・当日連絡がスムーズに取れるようにお願いします。
・QR表示をお願いする場合がございます。入場後はログアウトをお願いします。
・入場時間の指定等や変更、公共交通機関の大幅な遅延等があった際には時間を変更する場合もございます。
・持ち逃げ防止に身分証を回収する場合がございます。きちんとこちらの指示に従っていただけましたら内容確認等せず必ず返却いたしますのでご安心ください。
公演中止の際はキャンセルにて全額返金。
その他いかなる理由でも(購入ミス、買い手様の遅刻、当日音信不通、本人確認、ランダムエラー、場内での違反行為、出演者変更、体調不良、電話番号が海外のものや打ちミスで繋がらず待ち合わせ時間を過ぎた場合、こちらの指示に従わずの退場、座席へのクレームなど)キャンセル、返金一切不可。
日本語での指示に必ず従い行動ができる方で、以上全てご了承いただける女性の方のみ、ご購入をお願いします。",True,2026-06
13m6fr9b7c,1780982156409,acees-arena-tour-v,2026-07-11,17:30,有明アリーナ,electronic,female,同行,ぴ,5.0,,番手,2026-06-09 05:15:56,2026-06-26 23:01:20,,deleted,1,35000,"2名義中2番手。
2名義ともACEes該当名義・初期当選・有効期限内ボタンあり・着ブロ希望なし。
チケットの下3桁を開示可能。すり替え等一切ございません。
当方がチケット選択した後、
残りの名義分のチケットをそのままお渡しいたします。購入者に選択権がございません。
チケットお受け取りの際には、その場でチケットの下3桁をご確認いただき、速やかに受取連絡のご対応をお願いいたします。
会場内での座席確認および選定に多少お時間をいただく場合がございますので、ご了承ください。
会場周辺の電波状況が不安定となる可能性がございます。
スムーズなご連絡のため、お電話番号をお伺いする場合がございますので、
ご理解・ご協力のほどよろしくお願い申し上げます。
※公演中止となった場合を除き、いかなるご事情（体調不良、遅刻、ランダムエラー等）であっても、返金には対応いたしかねます。あらかじめご了承くださいますようお願いいたします。
また、すべての状況において、必ず「受取評価」のご対応をお願いいたします。
詳しい待ち合わせ時間・場所等につきましては、
公演前日までにメッセージボードにてご連絡いたします。
恐れ入りますが日本人または日本語が通じる女性の方のみご購入お願いいたします。",True,2026-06
sold_1781784311214,1781784311214,acees-arena-tour-v,2026-07-11,17:30,有明アリーナ,electronic,female,同行,,,,,2026-06-18 12:05:11,2026-06-26 23:01:20,2026-06-20 16:01:09,sold,2,17000,"3名義中3番手のお譲りです。該当名義　　有効期限内　すり替えなし　下三桁提示可　


公演1時間前に指定した場所に集合していただき一緒に入場していただきます。...",False,2026-06
zlsfx8u9tf,1780300849620,acees-arena-tour-v,2026-07-11,17:30,有明アリーナ,electronic,female,公演前日QRコード共有,a,5.0,,QR,2026-06-01 08:00:49,2026-06-26 23:01:20,,deleted,2,32000,"初期当選/非該当/有効期限内/下3桁提示可
公演前日に連絡ボードにてログイン情報をお伝えします。
同行者登録、同意チェック共に購入者様の方でご対応お願いいたします。
入場しましたら速やかにログアウト、受け取り通知をお願いいたします。
座席に関するクレームは一切お受けできません。
公演中止以外のいかなる理由であっても返金不可となります。
全て了承した方のみご購入をお願いいたします。",True,2026-06
nbjpx9rwnd,1781043094698,acees-arena-tour-v,2026-07-11,17:30,有明アリーナ,electronic,female,同行,あ,5.0,,同行,2026-06-09 22:11:34,2026-06-26 23:01:20,,deleted,2,18000,"早渡しランダム配布
全て有効期限内該当名義の当選
公演当日は開場20分前を目安に集合していただき、同時入場致します。
入場時はスタッフからチケット1枚ずつのお渡しですので、事前に身分証明書をお預かりいただく可能性がございます。ご協力をお願い致します。
入場後は一度チケットを回収してからの解散になります。こちらで座席確認後に再集合し、チケットをお渡しいたします。座席の選択権はありませんのでご注意ください。
チケットのお渡しまでにお時間をいただきます。その間はすぐに連絡が取れるようにしてお待ちください。開演の25分前頃までのご連絡になる可能性もございます。チケットお渡ししましたら、速やかに受取連絡お願いいたします。
詳しい集合場所は連絡ボードにてご連絡させていただきます。時間厳守でお願いいたします。
事前にご連絡いただいた場合でも、10分以上の遅刻は待たずに入場させていただきますのでご了承ください。その際も受取確認はしていただきます。
代理購入は不可です。代理購入を発覚した場合は入場できない場合がございますが、その際も受取確認はしていただきます。
当日、急な出演者の変更、買い手様の遅刻、購入者様の体調不良により入場できなかった場合、入場時のランダムエラーや入場エラー、座席などへのクレームでの返金は一切致しかねます。その際も受取確認はしていただきます。
また、公演中止以外のキャンセル、入場目的ではない購入は一切受け付けません。その際も受取確認はしていただきます。
内容にすべてご納得、了承した方のみご購入ください。
購入時点で、以上の全てにご同意いただいたものとみなします。",True,2026-06
sold_1780325322097,1780325322097,acees-arena-tour-v,2026-07-11,17:30,有明アリーナ,electronic,female,公演日7日前までにQRコード共有,,,,,2026-06-01 14:48:42,2026-06-26 23:01:20,2026-06-20 16:01:09,sold,2,20000,"該当名義(変更ボタンあり）期限有効、QRごとすり替えなし、初期当選、着ブロ希望なし、payeasyで入金済み

事前に会員番号下3桁お伝えできます。
マイページ...",False,2026-06
sh19zbot7e,1781670578615,acees-arena-tour-v,2026-07-11,17:30,有明アリーナ,electronic,female,同行,s,5.0,,ランダム,2026-06-17 04:29:38,2026-06-26 23:01:20,,deleted,1,10000,"ランダム配布
当日開場30-40分前に会場付近にて集合、同時入場して頂きます。集合時間は目安のため変更となる可能性があります。入場時、QR表示にご協力頂く場合があります。その際身分証を一時的に預からせて頂きますので必ず持参ください。チケット回収時にお返しいたします。
入場後は一旦解散、開演5-10分前を目安に再集合し受け取り評価確認後、チケットをお渡し致します。座席選択権はありません。
時間厳守です。交通機関の遅れ、天候、体調不良など理由に問わず成立後のキャンセル不可。遅刻された場合は待たずに入場いたします。その際の受け取り評価はして頂きます。
公演中止以外の返金は一切致しません。公演中止の場合のみ手数料を引いた全額をお返し致します。
以上了承頂ける日本人女性のみご購入お願い致します。
18歳以下又は男性の方で購入を希望される方は恐れ入りますが購入前にコメントお願い致します。場合によってはお断りさせて頂く場合がございます。
ご購入後は電話番号のご提示お願い致します。",True,2026-06
7cqfw9yiwm,1781141066823,acees-arena-tour-v,2026-07-11,17:30,有明アリーナ,electronic,female,同行,aru,5.0,,同行番手,2026-06-11 01:24:26,2026-06-24 01:01:12,,deleted,1,40000,"2名義中1番手同行/初期当選/非該当1名義含/変更ボタン有/すり替えなし/下3桁提示可
プライベート出品に切り替えますのでご連絡ください。一部手渡し可能。
公演中止以外のいかなる理由（体調不良・交通機関の遅延・出演者の変更、ランダムエラー、本人確認）でも返金はお受けできません。
公演中止の場合のみ、手数料を引いた額を返金いたします。
上記に了承していただける方のみご購入お願い致します。",True,2026-06
sold_1780412691242,1780412691242,acees-arena-tour-v,2026-07-11,17:30,有明アリーナ,electronic,female,公演日7日前までにQRコード共有,,,,,2026-06-02 15:04:51,2026-06-26 23:01:20,2026-06-20 16:01:09,sold,2,27000,"該当名義(変更ボタンあり）期限有効、QRごとすり替えなし、初期当選、着ブロ希望なし、payeasyで入金済み

事前に会員番号下3桁お伝えできます。
マイページ...",False,2026-06
sgk62yw9sq,1781796316221,acees-arena-tour-v,2026-07-11,17:30,有明アリーナ,electronic,female,同行,a,5.0,,同行,2026-06-18 15:25:16,2026-06-26 23:01:20,,deleted,1,40000,"2連中1枚同行／初期当選／重複すり替えなし／有効期限内／該当名義／下3桁提示可／作間担不可
・プライベート出品またはプラベルに切り替え可能です。
・開場時間前に会場付近にて集合予定です。
・座席に関するクレーム等は一切受け付けません。
・入場後は速やかに受け取り通知をお願いいたします。
・大幅に遅刻した場合は先に入場しますが、その場合も受け取り連絡をしていただきます。
・交通機関の遅延、ランダムエラー、システムエラー、出演者変更、悪天候での中止等につきましてもキャンセル対応はできませんのでお願いいたします。
・公演中止以外はいかなる場合であっても返金いたしません。受け取り評価をお願いいたします。
・トラブル防止の為成人している日本人女性のみ購入お願いいたします。代理購入もお控えください。
購入後は上記全ての内容に同意したものとみなします。",True,2026-06
sold_1780487089753,1780487089753,acees-arena-tour-v,2026-07-11,17:30,有明アリーナ,electronic,female,公演前日にQRコード共有,,,,,2026-06-03 11:44:49,2026-06-26 23:01:20,2026-06-20 16:01:09,sold,2,30000,"座席未定 QR毎 2連 すり替え重複なし
初期当選/該当名義/有効期限内/変更ボタン有/下3桁提示可

同行者登録は購入者様ご自身でお願い致します。
公演日前日...",False,2026-06
51p0537e3i,1781757925689,acees-arena-tour-v,2026-07-11,17:30,有明アリーナ,electronic,female,同行,ココア134,5.0,,番手,2026-06-18 04:45:25,2026-06-26 23:01:20,,deleted,2,35000,"3名義中2番手/情報局先行/座席未定/初期当選/有効期限内/該当名義/すり替えなし/下3桁提示可
開場時間15分前頃を目安に会場付近に集合して頂きます。時間厳守でお願い致します。万が一遅刻された場合は先に入場致しますが受取連絡して頂きます。
同時入場後、3名義の座席を確認した上で、3名義中の2連をこちらで先に選択後、2番目に2連番を選択していただきます。
座席を確認するため少しお時間いただきますが、必ずすり替えなしでお渡しします。
座席に関するクレーム等は一切受け付けません。
チケットお渡し時に受取通知をお願い致します。
サイチェン等はお好きにしていただいて構いませんが、係員に声かけられるような迷惑行為やトラブルの無いようにお願いいたします。
チケットお渡し後のトラブル等は一切責任は持てません。
公演中止の際は、規定に基づいた額を返金致します。
メンバー不在、本人確認、ランダムエラー、交通機関の乱れ等による遅刻、体調不良など、如何なる場合でも公演中止以外は必ず受取通知をお願い致します。
🌟プライベート出品をしますのでメッセージお願いします。
代理購入は不可。
入場するご本人がご購入をお願いします。
日本語の分かる方でお願いします。
以上のことをご了承頂ける方のみご購入をお願いします。",True,2026-06
1762vw6jf6,1781102816511,acees-arena-tour-v,2026-07-11,17:30,有明アリーナ,electronic,female,公演前日にログイン情報を共有,み,5.0,,QR,2026-06-10 14:46:56,2026-06-26 23:01:20,2026-06-21 03:01:07,sold,2,35000,"QRごとのお譲り
初期当選/該当名義/変更ボタンあり/有効期限内/事前に下3桁提示可
公演日前日にログインに必要な情報をご連絡いたします。
同行者登録はご購入者様の方でお手続き頂けます。
ランダムエラー、本人確認、体調不良、出演者の一部不在、交通機関の遅延など公演中止以外のいかなる場合も返金、キャンセルは対応致しかねます。公演中止の場合はサイトの規約に則り返金致します。
上記ご了承頂ける方のみご購入ください。",True,2026-06
hwjyotf9ut,1781424719301,acees-arena-tour-v,2026-07-11,17:30,有明アリーナ,electronic,female,同行,m,4.7,,番手同行,2026-06-14 08:11:59,2026-06-26 23:01:20,,deleted,2,25000,"3名義中3番手
すり替えなし 下3桁提示可能 初期当選 有効期限内 着ブロ選択なし
・当日会場付近にてお待ち合わせし、同時入場お願いいたします。
お待ち合せ時間、お待ち合せ場所の詳細は公演当日までに取引メッセージにてご連絡させていただきます。
・入場後は一度チケットを回収し、3名義中3番手にてチケットをお渡しさせていただきます。
座席確認のためお時間いただく可能性もございますが、入場からチケット受け渡しまでできる限り迅速に対応させていただきます。
・当日は時間厳守で集合をお願いいたします。ご購入者様の遅刻は到着を待たずに入場させていただきます。お時間に余裕を持ってお越しください。
出演者変更、入場時のランダムエラー、本人確認、交通機関の遅延、体調不良、座席などへのクレームでの返金は一切致しかねます。
・代表者として入場していただく可能性がございます。
その場合、QRコードを開いた状態でこちらのスマホ端末をお渡しいたしますので、一律で端末持ち逃げ防止のため一時的に身分証をお預かりさせていただきます。入場後、チケットと端末をお渡し/返却いただくタイミングにて、速やかに身分証を返却いたします。
（ご購入者様の端末をお借りしてログインさせていただく場合もございますのでご承知ください。）
（QRコードごとのお譲りとなる可能性もございます。）
・トラブル防止のため代理購入不可
必ず当日いらっしゃる方が落札をお願いいたします。
・公演中止以外ではいかなる理由でもキャンセル、返金は承れません。",True,2026-06
sold_1780394463382,1780394463382,acees-arena-tour-v,2026-07-11,17:30,有明アリーナ,electronic,female,公演日7日前までにQRコード共有,,,,,2026-06-02 10:01:03,2026-06-26 23:01:20,2026-06-20 16:01:09,sold,2,31300,有効期限内/変更ボタンあり/該当名義/事前に下3桁提示可/ 初期当選/ 着ブロ希望無し/ コンビニ支払い / 公演日前日までにログイン情報をお知らせします。同行...,False,2026-06
sold_1780880117448,1780880117448,acees-arena-tour-v,2026-07-11,17:30,有明アリーナ,electronic,female,公演前日にログイン情報共有,,,,,2026-06-08 00:55:17,2026-06-26 23:01:20,2026-06-20 16:01:09,sold,2,34000,"座席未定 QR毎 2連 すり替え重複なし
初期当選/該当名義/有効期限内/変更ボタン有/下3桁提示可

同行者登録は購入者様ご自身でお願い致します。購入後24時...",False,2026-06
sold_1781607614927,1781607614927,acees-arena-tour-v,2026-07-11,17:30,有明アリーナ,electronic,female,同行,,,,,2026-06-16 11:00:14,2026-06-26 23:01:20,2026-06-20 16:01:09,sold,2,18000,"★指定席のみすり替えなし★


すり替えなし、ランダム配布です。
下記全てお読み頂き、なにかご不明点ございましたらコメント欄までお願いいたします。
ご購入者様は...",False,2026-06
hwj5rh18vu,1781692155622,acees-arena-tour-v,2026-07-11,17:30,有明アリーナ,electronic,female,同行,S,4.8,,ランダム,2026-06-17 10:29:15,2026-06-26 23:01:20,,deleted,1,9000,"ランダム配布
指定席チケットのお渡し
開場30分前程度に会場付近で待ち合わせ、同時入場していただきます。
複数名義所持しております。同時入場をしてチケットを回収後一度解散し、開演5~10分前にランダムで配布致します。必ず指定席のチケットをお渡し致します。立見は含みません。
入場時QRコード表示にご協力いただく場合がございます。トラブル防止の為、入場時に公的身分証明書を一時的にお預かりします。封をした状態でお預かりし、入場後速やかにお返し致します。トラブル等ない限り見ることはございませんのでご協力をお願い致します。
また、当日お取引をスムーズに進めさせていただくため電話番号のご提示をお願いしております。ご理解いただける方のみご購入下さい。
集合時間過ぎても来ない場合は待たずに入場しますが、受取連絡はして頂きます。遅刻のないようお越しください。
チケットをお渡し後はその場で受取連絡をお願い致します。
代理購入不可。必ず購入者様本人が待ち合わせにお越しください。
公演中止の際は規約に基づきご返金致します。
公演中止以外（本人確認・ランダムエラー・体調不良・交通機関の遅延・一部出演者不在等）で返金及びキャンセル対応はできません。
日本人女性の方のみご購入ください。
以上、記載されてる条件全てご理解頂ける方のみご購入をお願い致します。",True,2026-06
sold_1781783906070,1781783906070,acees-arena-tour-v,2026-07-11,17:30,有明アリーナ,electronic,female,同行,,,,,2026-06-18 11:58:26,2026-06-26 23:01:20,2026-06-20 16:01:09,sold,2,20000,"3名義中2番手のお譲りです。　有効期限内　すり替えなし　下三桁提示可


公演1時間前に指定した場所に集合していただき一緒に入場していただきます。

公演中止以...",False,2026-06
lxo0fvo949,1780411252774,acees-arena-tour-v,2026-07-11,17:30,有明アリーナ,electronic,female,同行,y,5.0,,番手同行,2026-06-02 14:40:52,2026-06-26 23:01:20,,deleted,2,35000,"3名義中3番手／全て該当名義（変更ボタン有）有効期限内／すり替えなし／下3桁提示可能／初期当選✕3
・3名義中3番手のお渡しです。同時入場後、チケットを一度回収し解散した後、座席選択後に余ったお席をお渡しさせていただきます。座席選択にお時間をいただく可能性がございますが、すり替えは致しません。チケットを受け取り後は速やかに受取通知をお願い致します。
・公演当日は開場の20-30分前に会場周辺で集合を予定しております。待ち合わせ時間、場所の詳細については、ご入金後にマイページの連絡ボードでお知らせします。大幅に遅刻された場合は待たずに入場しますが、受取通知はして頂きますので、お時間に余裕を持ってお越しください。
・体調不良、ランダムエラー、本人確認、遅刻、出演者の変更等、公演中止以外の如何なる場合でもキャンセル返金は致しかねます。本人確認には対応しておりません。公演中止の際のみ、送料手数料を差し引いた全額を返金いたします。また座席のクレームについてもお受け出来ません。
・当日の電波状況を考慮しお電話番号をお伺いします。
・日本語が通じる成人女性のみご購入お願い致します。
ご購入と同時に上記につきまして、ご理解頂いたものとみなしますのでご了承ください。",True,2026-06
sold_1780641007411,1780641007411,acees-arena-tour-v,2026-07-11,17:30,有明アリーナ,electronic,female,公演日7日前までにQRコード共有,,,,,2026-06-05 06:30:07,2026-06-26 23:01:20,2026-06-20 16:01:09,sold,2,26000,"該当名義(変更ボタンあり）期限有効、QRごとすり替えなし、初期当選、着ブロ希望なし、payeasyで入金済み

事前に会員番号下3桁お伝えできます。
マイページ...",False,2026-06
