ticket_id,created_at_unix,event_id,perf_date,perf_time,venue,ticket_type,name_type,delivery_method,seller_name,seller_rating,order_num,ticket_tags,first_observed_at,last_observed_at,sold_at,status,quantity,price,raw_description,details_fetched,year_month
jmr3sutyzp,1774851754103,ae-group-live-tour-runway,2026-07-11,18:00,エコパアリーナ,electronic,female,すり替えなし同行,め,5.0,,同行記載あり,2026-03-30 06:22:34,2026-06-22 02:01:06,,deleted,1,56000,"当方と同行となります。
開場10〜15分前に集合予定ですが詳しい時間や場所等に関しては前日の夜までにはご連絡いたします。
待ち合わせ時間から10分以上遅刻される場合もお待ちせず入場いたします。その際も受取通知は必ずしていただきます。
チケットをお渡しする際、その場で速やかに受取通知をお願いいたします。
その後はサイチェン等自由にしていただいて構いません。
また、公演中止以外での返金は一切受けつけておりません。
当方が選ばなかった座席をお渡しいたしますので、購入者様には座席の選択権利がないこと予めご了承ください。
座席へのクレームも一切お受けしておりません。
代理購入はお控えください。
以上のことをご理解頂いた上で、日本語のわかる20歳以上の日本人女性のみご購入ください。",True,2026-03
stb7e969j3,1774844150479,ae-group-live-tour-runway,2026-07-11,18:00,エコパアリーナ,electronic,female,4名義中4番手,ri,5.0,,番手,2026-03-30 04:15:50,2026-06-22 02:01:06,,deleted,2,40000,"4名義中4番手/下3桁提示可/初期当選/すり替えなし
公演当日は、会場付近にて開演1時間半前に集合し同時入場していただきます。詳しい待ち合わせ時間・場所等については前日に連絡ボードにてご連絡致します。
4名義所持しているため、同時入場後チケットを一旦回収し、座席選択後にチケットをお渡しします。
チケットのお渡し後は、サイチェンなど自由にしていただいて構いません。
座席に関するクレームはお受けできません。
チケットのお渡しと同時に、必ず受取連絡をお願い致します。集合時間に遅れた場合も受取連絡はして頂きますのでお願い致します。同行者登録はこちらで行います。
また入場の際、買い手様の端末にてQRコードの表示をお願いする場合がございますので、ご協力お願い致します。その際、一時的に身分証お借りする場合がございます、入場後に必ずお返ししますのでご安心ください。
公演中止以外の理由では返金致しかねます。ランダムエラー・体調不良・本人確認・遅刻等で入場できなかった場合も、必ず受け取り連絡をしていただきます。
成人済の日本人女性の方のみご購入お願いします。取引確定の時点で、上記の内容にご理解ご協力いただけるものとみなします。",True,2026-03
ris14d44kk,1773660407920,ae-group-live-tour-runway,2026-07-12,12:30,エコパアリーナ,electronic,female,同行,も,5.0,,ランダム,2026-03-16 11:26:47,2026-06-22 02:01:06,,deleted,2,40000,"⭐️ランダム⭐️
必ずランダム配布に理解がある方のみご購入ください。
日本語のわかる日本人女性のみご購入ください。
複数名義所持の為、同時入場後に一度チケットを回収させて頂きます。チケットは迅速にお渡し出来るように致しますが座席選択にお時間を頂きますことご了承ください。
チケットをお渡しする際にその場で受け取り連絡をお願いいたします。
当日顔つき身分証明書をお預かりしますので必ずお持ちください。
当日端末をお預かりする場合がございます。
当日は事前に連絡ボードでお伝えする指定した時間、場所にお集まり頂きます。複数人での入場になるため遅刻厳禁でお願いいたします。
お座席のクレーム等は一切受付致しません。
体調不良などによるキャンセルは一切受け付けません。
公演中止の場合のみ、手数料等を引いた額を返金いたします。遅刻、当日のランダムエラーや本人確認、出演者の不在等、公演中止以外の如何なる理由でも返金は致しません。
代理購入等はトラブルを避けるためにもご遠慮ください。必ず購入者様本人がお越し頂くようお願いいたします。
以上の点を全てご理解頂ける場合のみご購入ください。
・公演当日、会場付近でお待ち合わせをし、同時入場をしていただきます。開場15分前の集合を予定しておりますが、詳しい集合時間・場所はご入金後、お日にちが近くなりましたら連絡ボードにてご連絡致します。",True,2026-03
ur1lfzqenk,1773315405939,ae-group-live-tour-runway,2026-07-12,12:30,エコパアリーナ,electronic,female,FC先行/ 同行すり替えなし/下3桁提示可能/有効期限内,マ,5.0,,同行,2026-03-12 11:36:45,2026-06-22 02:01:06,,deleted,1,60000,"FC先行/ 同行すり替えなし/下3桁提示可能/有効期限内 /初期当選
2連中の1枚同行になります。（小島担は購入をご遠慮ください。）
・公演当日は会場付近で待ち合わせをし、同時入場していただきます。
・集合時間は開場15分前〜20分前を予定しております。
・詳しい待ち合わせ時間・場所等は公演前日にお知らせいたします。
・連番内の座席は当方が先に選ばせていただきます。
・チケットお渡し時に必ず受取連絡をお願いいたします。お渡し後はサイチェン等ご自由にしていただいて結構です。当方もサイチェンする場合がございます。
・公演中止の際は手数料を差し引いた金額を返金いたします。
・公演中止を除くランダムエラー、本人確認、体調不良、自己都合遅刻、交通機関の乱れ、出演者の出演キャンセル、その他のいかなる理由につきましても返金やキャンセル対応できません。公演中止以外は必ず受け取りをしていただきます。
・落札後のキャンセル、座席のクレーム等一切お受けできません。
・20歳以上の日本語が通じる女性のみご購入ください。",True,2026-03
c2iy0zhmot,1774843837872,ae-group-live-tour-runway,2026-07-12,12:30,エコパアリーナ,electronic,female,同行,A,5.0,,同行,2026-03-30 04:10:37,2026-06-22 02:01:06,,deleted,1,68000,"初期当選/有効期限内/重複なし/同行/本人確認可/下3桁提示可能/2連中の1枚
※小島担のご購入はお控えください※
公演当日会場付近にて待ち合わせし、同時入場して頂きます。
詳しい待ち合わせ時間等は公演1週間前を目処にご連絡させていただきます。
また、当日同行者登録についてもご対応をお願いさせていただきます。
当方がチケットを選択後、チケットをお渡しします。
発券されたチケットの内の1枚をお渡しします。
購入者様はチケットをお選び頂けません。（連番内の並び順はこちらで選択させて頂きます）
当日合流と同時に発送通知を致しますので、入場後チケットをお渡しした際に速やかに受取連絡をしていただきますようお願いいたします。
ランダムエラー、体調不良、その他トラブル等で当日入場できない場合につきましても、受取連絡はしていただきます。
公演中止の場合のみ、手数料を差し引いた金額を返金いたします。
当日は時間厳守でお願い致します。
買い手様の音信不通、公共交通機関の乱れ等により集合時間に間に合わない場合、お待ちせずに入場いたします。
その場合も受け取り連絡はしていただきます。
サイチェン等される場合はご自由にして頂いて構いませんが、名義が潰れるような行為はおやめください。
当方もサイチェンする場合がございますので、ご了承頂けますと幸いです。
ご購入はトラブル防止のため成人済み日本人女性の方のみ、こまめに連絡を取れる方でお願いいたします。
代理購入はご遠慮ください。
以上の条件を全てご確認いただき、ご理解いただけた方のみご購入をお願いいたします。",True,2026-03
dlzpae43im,1773643127759,ae-group-live-tour-runway,2026-07-12,12:30,エコパアリーナ,electronic,female,同行,とも,5.0,,同行番手,2026-03-16 06:38:47,2026-06-22 02:01:06,,deleted,2,65000,"3名義中2番手/すり替えなし/下3桁提示可/有効期限内
公演当日、開場15分前頃に会場付近にて待ち合わせをし、同時入場して頂きます。
いかなる理由であっても大幅な遅刻は待たずに入場いたします。
その場合でも返金対応はしませんので、必ず受取、時間厳守できる方でお願いいたします。
当方が座席選択した後、残った座席からお選び頂きます。また、その際に座席確認にお時間頂戴する場合がございますが、予めご了承ください。
端末をお借りする場合がございます。
身分証を一時お預かりさせて頂きますので、必ずご持参ください。
2連で購入された場合、お連れ様とは別々に入場して頂く可能性がございますが、必ず連番でのチケットをお渡しします。
座席に関するクレームは一切お受けしません。
チケットをお渡しする際、必ずその場で受取連絡をお願いいたします。
遅刻や体調不良などの買い手様の都合によるキャンセル、ランダムエラーや本人確認などで入場できなかった場合も返金対応は一切しませんので、受取連絡をお願いいたします。
公演中止の場合のみ、手数料を差し引いた分を返金させて頂きます。
当日の電波環境を考慮し、電話番号のご提示にご協力をお願いいたします。
上記全てご了承頂ける方、日本語が通じる方のみご購入をお願いいたします。",True,2026-03
pbpe6dmjpl,1774404383994,ae-group-live-tour-runway,2026-07-12,12:30,エコパアリーナ,electronic,female,公演前日にログイン情報提示,た,5.0,,QR,2026-03-25 02:06:23,2026-06-22 02:01:06,,deleted,2,70000,"FC先行／座席未定／連番QR／初期当選／発送物戻り無し／コンビニ決済／着ブロ希望無し／すり替えなし／下3桁提示可／有効期限内
プライベート出品に変更させていただきますので、購入希望の方はメッセージをお願いいたします。
・DNA当選ポートメッセなごやアリーナ席（デビューツアー後に作成名義のため当選歴上記のみ)
・公演前日に必要な情報を連絡ボードにてご連絡させて頂きます。
・同行者登録は買い手様でお願いいたします。
・入場後は速やかにログアウト、受け取り評価お願いいたします。
・ログイン後はQR表示に必要な操作以外お控えください。
・録音、録画等名義に傷が付くような行為はお控えください。
・公演中止以外での体調不良やランダムエラー、などで入場出来なかった場合でも必ず受け取り評価はしていただきますのでご了承ください。
・受取完了後の送金停止等も対応致しかねます。
・公演中止の際のみ、チケテンのシステムにより自動で全額返金されます。",True,2026-03
lo3s2buipp,1774973264983,ae-group-live-tour-runway,2026-07-12,12:30,エコパアリーナ,electronic,none,同行,つ,5.0,,ランダム,2026-03-31 16:07:44,2026-06-22 02:01:06,,deleted,2,40000,"🌟少数ランダム🌟
必ずランダム配布に理解がある方のみご購入ください。
日本語のわかる日本人女性のみご購入ください。
複数名義所持の為、同時入場後に一度チケットを回収させて頂きます。チケットは迅速にお渡し出来るように致しますが座席選択にお時間を頂きますことご了承ください。
チケットをお渡しする際にその場で受け取り連絡をお願いいたします。
当日顔つき身分証明書をお預かりしますので必ずお持ちください。
当日は事前に連絡ボードでお伝えする指定した時間、場所にお集まり頂きます。複数人での入場になるため遅刻厳禁でお願いいたします。
お座席のクレーム等は一切受付致しません。
体調不良などによるキャンセルは一切受け付けません。
公演中止の場合のみ、手数料等を引いた額を返金いたします。遅刻、当日のランダムエラーや本人確認、出演者の不在等、公演中止以外の如何なる理由でも返金は致しません。
代理購入等はトラブルを避けるためにもご遠慮ください。必ず購入者様本人がお越し頂くようお願いいたします。
以上の点を全てご理解頂ける場合のみご購入ください。
・公演当日、会場付近でお待ち合わせをし、同時入場をしていただきます。開場15分前の集合を予定しておりますが、詳しい集合時間・場所はご入金後、お日にちが近くなりましたら連絡ボードにてご連絡致します。",True,2026-03
24mlzp006n,1772443444944,ae-group-live-tour-runway,2026-07-12,12:30,エコパアリーナ,electronic,female,同行,も,5.0,,同行ランダム,2026-03-02 09:24:04,2026-06-22 02:01:06,,deleted,2,35000,"必ずランダム配布に理解がある方のみご購入ください。
日本語のわかる日本人女性のみご購入ください。
複数名義所持の為、同時入場後に一度チケットを回収させて頂きます。チケットは迅速にお渡し出来るように致しますが座席選択にお時間を頂きますことご了承ください。
チケットをお渡しする際にその場で受け取り連絡をお願いいたします。
当日顔つき身分証明書をお預かりしますので必ずお持ちください。
当日端末をお預かりする場合がございます。
当日は事前に連絡ボードでお伝えする指定した時間、場所にお集まり頂きます。複数人での入場になるため遅刻厳禁でお願いいたします。
お座席のクレーム等は一切受付致しません。
体調不良などによるキャンセルは一切受け付けません。
公演中止の場合のみ、手数料等を引いた額を返金いたします。遅刻、当日のランダムエラーや本人確認、出演者の不在等、公演中止以外の如何なる理由でも返金は致しません。
代理購入等はトラブルを避けるためにもご遠慮ください。必ず購入者様本人がお越し頂くようお願いいたします。
以上の点を全てご理解頂ける場合のみご購入ください。
・公演当日、会場付近でお待ち合わせをし、同時入場をしていただきます。開場15分前の集合を予定しておりますが、詳しい集合時間・場所はご入金後、お日にちが近くなりましたら連絡ボードにてご連絡致します。",True,2026-03
8y57t3e0q6,1774491015796,ae-group-live-tour-runway,2026-07-12,17:00,エコパアリーナ,electronic,male,同行,Cy,5.0,,同行,2026-03-26 02:10:15,2026-06-22 02:01:06,,deleted,1,96000,"初期当選/すり替えなし/有効期限内/下3桁提示可/本人確認対応不可/正門担不可
当選歴：デビューツアー落選、DNAスタンド後列
当日は開場時間の10分前に集合し、同時入場していただきます。
チケットお渡し後は自由に行動していただいてかまいませんが、名義を傷つけるような行為や、周囲の方に迷惑となる行為はお控えください。
連番内の座席選択権利はございません。
ご希望であれば定価分チケテン通し、残り手渡しも可能です。
体調不良や交通機関による遅延、相場変動など、買い手様のご都合によるキャンセルにつきましては、いかなる場合でも返金不可となります。なお、公演が中止になった場合のみ手数料を引いた金額を返金いたします。
国籍は問いませんが、日本語でのやり取りができない方のご購入はご遠慮ください。
上記内容にご理解・ご了承いただける方のみご購入をお願いいたします。",True,2026-03
7vtd4flytm,1773590366426,ae-group-live-tour-runway,2026-07-12,17:00,エコパアリーナ,electronic,female,同時入場,み,5.0,,ランダム同行,2026-03-15 15:59:26,2026-06-22 02:01:06,,deleted,2,0,"⭐️少人数ランダム配布⭐️
プライベート出品に変更いたしますのでご了承ください。一部サイト通し残り当日手渡しも可能です。メッセージにてご相談いただけましたら対応いたします。
会場付近で集合し同時入場していただきます。現時点では開場20分前(15:40)を予定しておりますのでお時間に余裕をもってお越しください。詳細はご入金後にお伝えします。
複数名義所持しております。入場時にご購入者様の端末を操作して代表者としてご入場いただく場合がございます。またその際に身分証をお預かりする場合がございますので念の為ご持参ください。お預かりした身分証は何も問題がなければ同時入場後チケットを回収する際に返却いたしますのでご協力のほどよろしくお願いいたします。
入場後は全てのチケットを回収し一旦解散、当方にて座席選択後にランダムでお渡しします。ご購入者様ご自身での座席選択はできません。なるべく早くお渡しできるよう努めますがお渡しまでお時間を頂戴しますので予めご了承ください。中相場買取可能ですのでご希望の方はご相談ください。
チケットをお渡しする際にその場で受取連絡をお願いいたします。座席未定のデジタルチケットの為、座席判明後のクレームは一切受け付けません。サイドチェンジはしていただいて構いませんが周りに留意し名義に傷の付くようなマナー違反行為はご遠慮ください。
集合時間に遅れる際は判明時点でご連絡ください。多少はお待ちしますが状況に応じて先に入場いたします。その際も受取連絡はしていただきます。
お取引をスムーズに進める為、集合30分前までに服装と電話番号をお伝えください。
日本語でのやり取りが可能であれば性別、年齢は問いませんが親子(お子様が中学生以下)や20歳未満の方、男性の方、お取引に不慣れな方は事前に一言いただけますと幸いです。トラブル防止の為、代理購入や車椅子を使用される等で補助、介助が必要な方は申し訳ございませんがご遠慮ください。また入場の妨げになるような大きなお荷物は事前に預けてからお越しください。
参加される方が未成年等で代理購入したい場合は必ずご購入前にその旨をお伝えいただき、当日御二方(ご購入者様、参加されるご本人様)と連絡が取れる手段をご提示ください。万が一トラブルが発生した場合の責任は負いかねます。
集合時にお取引に関する注意事項を説明させていただきますがお取引に不慣れな方へは更に詳しく丁寧にお伝えしますのでご不明点がございましたら気兼ねなく仰ってください。
事前に公演中止となった場合は自動的に返金されます。開場後の中止や入場時のランダムエラー、本人確認、体調不良、交通機関の遅延による遅刻、出演者変更等いかなる場合におきましても返金及びキャンセル対応はできかねます。来場、入場できなかった場合も必ず受取連絡していただきますので予めご了承ください。
長くなってしまいましたが最後までお読みいただき有難うございます。何か質問等ございましたらお気軽にお申し付けください。
ご購入いただいた時点で全てに同意されたとみなします。",True,2026-03
drxjnq5s8d,1774921135627,ae-group-live-tour-runway,2026-07-12,17:00,エコパアリーナ,electronic,none,FC枠のみランダム配布,あ,5.0,,ランダム,2026-03-31 01:38:55,2026-06-22 02:01:06,,deleted,1,28000,"複数名義中ランダム配布でのお譲りです。
※購入した時点で全ての内容に同意したとみなします。
名義数、ゲートなど下記に記載している内容以外の質問にはお答えできかねます。ランダム配布ですのでご購入者様に座席の選択権は一切ございません。
・座席を選ぶのにお時間をいただく場合もございますがご了承ください。
・解散前に再集合場所を指定致します。開演時間近くなりましたら指定場所付近にお集まりください。
・開演時間前までにはチケットをお渡しします。会場内が混み合っているなどの買い手様の理由での受け渡し時間の遅れは責任を持ちません。
・【開場の30分前】に会場付近に集合していただき、同時入場となります。場所や時間の詳細は決定次第、連絡ボードよりお伝え致します。
・チケット持ち逃げ防止のため購入者様の顔付き身分証をお預かりする場合がございます。お渡しするチケットと引き替えに身分証はすぐにお返し致します。
・当日連絡の取れる電話番号をお聞きします。迅速にお取引を進めさせていただくためにもご協力ください。
・本人確認やエラー等で入場できなかった場合保証は致しかねます。また、購入者様による都合のキャンセル対応も致しかねます(購入者様の体調不良、コロナ、濃厚接触、交通機関の遅延、出演者の欠席等)。
・当日、時間厳守で取引できる方、チケットのお渡しと同時に受取連絡をしていただける方でお願い致します。遅刻はお待ち致しません。集合時間に間に合わなかった場合でも受け取り通知はして頂きます。
・代理購入はトラブルの原因になりますのでお控えください。
公演中止の場合のみ、手数料を引いた額を返金させていただきます。それ以外での返金は致しません。
以上ご了承頂けましたら日本語の通じる方のみご購入にお進み下さい。",True,2026-03
yxg8lpzjry,1772378436545,ae-group-live-tour-runway,2026-07-12,17:00,エコパアリーナ,electronic,female,同行,s,5.0,,同行,2026-03-01 15:20:36,2026-06-22 02:01:06,,deleted,1,90000,"2連中の1枚(同行)/初期当選 / 有効期限内 / すり替えなし / 下3桁提示可  / 発送物戻りなし / サイチェン可
小島担不可
当日、会場付近にて待ち合わせをし同時入場していただきます。詳しい待ち合わせ場所と時間につきましてはご入金後、公演日前日までにメッセージにて送らせていただきます。
お渡ししたチケットはサイチェン等好きにしていただいて構いません。
座席に関するクレーム等公演中止以外のいかなる理由においても返金は致しかねます。
日本語が話せる成人女性のみ購入可",True,2026-03
