ticket_id,created_at_unix,event_id,perf_date,perf_time,venue,ticket_type,name_type,delivery_method,seller_name,seller_rating,order_num,ticket_tags,first_observed_at,last_observed_at,sold_at,status,quantity,price,raw_description,details_fetched,year_month
o5itlbqonq,1780022809462,key-to-lit-arena-tour-2026-neo-classics,2026-08-01,12:30,GLION ARENA KOBE,electronic,female,公演日3日前までにQRコード共有,🐈‍⬛,5.0,,QR,2026-05-29 02:46:49,2026-06-30 23:01:46,,listing,2,20000,"情報局先行/座席未定/非該当名義 / 初期当選/有効期限内/サイチェン可/着ブロ希望なし/QR毎のお譲りです🙇🏻‍♀️‪‪
公演3日前、マイページの連絡ボードにてログインに必要な情報をお伝えいたします。
同行者登録、同意チェック等は購入者様でご登録ください！
ご希望があれば会員番号下3桁提示可能です。
公演当日はご自身のスマートフォンにてログインして いただき、QRコード表示の上全員揃って入場してください🙌
ご入場後は速やかに受取連絡とログアウトをお願い致します。
サイチェン等お好きなようにして頂いて構いません✨
座席のクレーム、ランダムエラー、体調不良等で入場できなかった場合など、公演中止以外の如何なる理由でも返金致しません。
必ず受取連絡をお願い致します。
公演中止の場合のみ規則に伴い手数料を差し引いた金額返金致します✨
取引未経験の方でも🙆‍♀️お互いが良い気持ちで終われる様対応させて頂きます。ご不明点、不安な事等ありましたらお申し付け下さい。",True,2026-05
3zxqrr84a1,1780028833829,key-to-lit-arena-tour-2026-neo-classics,2026-08-01,12:30,GLION ARENA KOBE,electronic,female,公演日3日前にログイン情報送付,ひ,5.0,,QR,2026-05-29 04:27:13,2026-06-30 23:01:46,,listing,2,20000,"QR毎/該当名義(ボタン有)/重複すり替え無し/ 下3桁提示 / 有効期限内 / 初期当選 / Pay-easy決済 / 着ブロ無し
キテレツでの当選歴なし
入金確認後下3桁提示。
公演3日前に必要情報をお伝え予定。
入場後速やかに受取連絡をお願いします。
入場後のサイドチェンジ等ご自由にどうぞ。
同行者登録は買い手様がご登録下さい。
同行者登録まで全て買い手様自身で行って頂く為、重複販売はありません。赤線エラーは対応しません。
そのような理由での送金停止は一切受け付けません。
交通機関の乱れや出演者変更等、公演中止以外でのキャンセルは受け付けません。公演中止の場合のみ手数料を差し引いた全額を返金します。",True,2026-05
sold_1780061980393,1780061980393,key-to-lit-arena-tour-2026-neo-classics,2026-08-01,12:30,GLION ARENA KOBE,electronic,female,同行,,,,,2026-05-29 13:39:40,2026-06-30 23:01:46,2026-06-20 16:01:09,sold,1,10880,,False,2026-05
sold_1780056927693,1780056927693,key-to-lit-arena-tour-2026-neo-classics,2026-08-01,12:30,GLION ARENA KOBE,electronic,female,公演日7日前までにQRコード共有,,,,,2026-05-29 12:15:27,2026-06-30 23:01:46,2026-06-20 16:01:09,sold,1,12000,"8/1 昼 単番 QR毎

すり替え無し/非該当/変更ボタン有/同行者登録可能/初期当選/有効期限内/下3桁提示可

ランダムエラー、本人確認、その他いかなる理...",False,2026-05
wob2c2erft,1780219751145,key-to-lit-arena-tour-2026-neo-classics,2026-08-01,12:30,GLION ARENA KOBE,electronic,female,公演前日までにログイン情報をお伝えします,7,5.0,,QR,2026-05-31 09:29:11,2026-06-30 23:01:46,,listing,2,40000,"初期当選/該当名義/下3桁提示可能
同行者登録は買い手様のほうでご対応ください。
公演中止以外の返金は不可となります。",True,2026-05
60v9f47vzk,1780034280130,key-to-lit-arena-tour-2026-neo-classics,2026-08-01,17:30,GLION ARENA KOBE,electronic,female,公演日前日にQRコード共有,みっきー,5.0,,QR,2026-05-29 05:58:00,2026-06-30 23:01:46,,listing,2,33800,初期当選、1名義中の1名義、中村嶺亜名義、QRごと、変更ボタンあり、同行者様はご本人名義、有効期限内、すり替えなし、下三桁提示あり,True,2026-05
ic8sk57fuj,1780107866654,key-to-lit-arena-tour-2026-neo-classics,2026-08-01,17:30,GLION ARENA KOBE,electronic,female,同行,れ,5.0,,ランダム記載あり,2026-05-30 02:24:26,2026-06-30 23:01:46,,listing,2,12000,"2名義中2番手
初期当選、該当名義、すり替えなし、下三桁提示可、有効期限内
公演中止以外のいかなる場合は返金できかねます。
担当不在、交通機関の遅れ、遅刻などいかなる場合でも返金対応致しません。
ランダムエラーの際も返金不可です。
開場の30分前に会場付近で待ち合わせ予定です。入場の際に端末ならびに身分証を受け取りさせていただく場合があります。チケットを受け取り次第すぐに受取完了連絡をしていただきます。
チケットお渡し後はご自由にしていただいて構いません。",True,2026-05
2h39o55d21,1780049828104,key-to-lit-arena-tour-2026-neo-classics,2026-08-01,17:30,GLION ARENA KOBE,electronic,female,公演日3日前までにQRコード共有,よち,5.0,,QR,2026-05-29 10:17:08,2026-06-30 23:01:46,,listing,2,37000,"QRごと・2連番・【条件なし】・【該当名義】・女性名義・初期当選・重複なし・すり替えなし・着席希望なし・有効会員期限内・コンビニ決済・入金確認後下3桁提示いたします。
同行者登録は買い手様にてお願いいたします。
何かご質問等ございましたらお気軽にご連絡下さい。
公演中止の場合は手数料を引いた金額を7日以内にご返金いたします。
よろしくお願いいたします。",True,2026-05
gdfpau0dyu,1780047130241,key-to-lit-arena-tour-2026-neo-classics,2026-08-01,17:30,GLION ARENA KOBE,electronic,female,同行,T,5.0,,同行番手,2026-05-29 09:32:10,2026-06-30 23:01:46,,listing,1,20000,"4名義中4番手/初期当選/該当名義/有効期限内/すり替えなし/下3桁提示可/着ブロ希望なし/座席未定
4名義中4番手
全て該当名義
ご購入の方はプライベート出品いたしますのでお声がけ下さい。
公演当日は当方が指定する場所、時間に集合していただき同時入場となります。
ゲートによってはQRごとでお渡しいたします。
公演中止以外返金不可
（ランダムエラー、本人確認、通障害、公共交通機関の遅延、体調不良（出演者含む）、その他購入者様都合等、いかなる理由で入場できなかった場合でも返金はいたしかねます）
公演中止以外の理由によるキャンセル、返金請求、送金停止依頼等はお受けできません。
ご購入いただいた時点で、上記内容すべてに同意いただいたものといたします。",True,2026-05
txzn72yfrt,1780048439956,key-to-lit-arena-tour-2026-neo-classics,2026-08-01,17:30,GLION ARENA KOBE,paper,none,当日手渡し,れ,5.0,,ランダム,2026-05-29 09:53:59,2026-06-30 23:01:46,,listing,2,7500,"【取引にあたり注意事項】
ランダム配布について理解ある方のみ購入お願いします。
入場時、端末をお借りしてQRを表示させていただく場合がございます。その際、持ち逃げ防止の為、身分証をお預かりさせて頂きます。身分証は封筒に入れて頂き、買い手様に封していただきます。こちらで原本に触ることはありません。チケットと交換で入場後即お返しします。なお、チケット代金につきましては全額入場前に受け取りさせていただきます。
入場後、1度チケットを回収し座席確認後、指定の時間になり次第チケットを配布させて頂きます。
公演中止の場合のみ手数料等差し引いた額を返金致します
それ以外の返金については一切受け付けません。
キャンセルの場合、サイト通し分の受取をお願いします。
本人確認,ランダムエラー,遅刻等の公演中止以外の返金はいかなる場合でも一切致しません。
座席に関するクレーム等も一切受け付けません。  集合時間に間に合わなかった場合も受け取り評価は必ずしていただきます。事前に電話番号や集合場所等はご連絡しますので、電波が悪いなどの理由での遅刻も一歳認めません。開場45分前に会場に来れる方のみ購入をお願いいたします。購入された方＝全て理解していただいたとさせていただきます。
サイト入金後、追加条件を付けてくる行為はご遠慮下さい
入金後はすべての条件を理解した上でご購入ください
ご不明点がある場合には入金前にお尋ねください。",True,2026-05
ayf0kfpix8,1780031687554,key-to-lit-arena-tour-2026-neo-classics,2026-08-01,17:30,GLION ARENA KOBE,electronic,female,同行,あ,5.0,,同行,2026-05-29 05:14:47,2026-06-30 23:01:46,,listing,1,18000,該当名義　有効期限内　重複すり替えなし　下3桁提示可能　佐々木担との同行　サイチェン可,True,2026-05
30e0pxo9hj,1780047416080,key-to-lit-arena-tour-2026-neo-classics,2026-08-01,17:30,GLION ARENA KOBE,electronic,female,同行,T,5.0,,同行番手,2026-05-29 09:36:56,2026-06-30 23:01:46,,listing,1,50000,"4名義中2番手/初期当選/該当名義/有効期限内/すり替えなし/下3桁提示可/着ブロ希望なし/座席未定
4名義中2番手
全て該当名義
ご購入の方はプライベート出品いたしますのでお声がけ下さい。
公演当日は当方が指定する場所、時間に集合していただき同時入場となります。
ゲートによってはQRごとでお渡しいたします。
公演中止以外返金不可
（ランダムエラー、本人確認、通障害、公共交通機関の遅延、体調不良（出演者含む）、その他購入者様都合等、いかなる理由で入場できなかった場合でも返金はいたしかねます）
公演中止以外の理由によるキャンセル、返金請求、送金停止依頼等はお受けできません。
ご購入いただいた時点で、上記内容すべてに同意いただいたものといたします。",True,2026-05
sold_1780035084372,1780035084372,key-to-lit-arena-tour-2026-neo-classics,2026-08-01,17:30,GLION ARENA KOBE,electronic,female,同行,,,,,2026-05-29 06:11:24,2026-06-30 23:01:46,2026-06-20 16:01:09,sold,2,10500,"4名義中3番手/下3桁提示可能  /すり替えなし／有効期限内　該当✖️3,非該当✖️1

公演当日は当方が指定する場所、時間に集合していただき同時入場となります...",False,2026-05
obvoreptou,1780132931028,key-to-lit-arena-tour-2026-neo-classics,2026-08-01,17:30,GLION ARENA KOBE,electronic,female,同行,♡,5.0,,QR同行番手,2026-05-30 09:22:11,2026-06-30 23:01:46,,listing,1,15000,"初期当選、該当名義（変更ボタンあり）、すり替えなし、下三桁提示可、有効期限内
2名義中2番手のお渡しです。座席の選択権ございません。
公演中止以外のいかなる場合も返金できかねます。
交通機関の遅れ、遅刻等いかなる場合でも返金できかねます。
ランダムエラーの場合も受け取りして頂きます。
開場の15分前頃に会場付近で待ち合わせにて同時入場いたします。
入場の際に身分証を預かる場合があります。
ご了承ください。
チケットを受け取り次第すぐに受取完了連絡をしていただきます。
チケットお渡し後はサイチェン等ご自由にしていただいて構いません。
購入した時点で上記は了承したものとみなします。
日本語でスムーズに連絡の取れる日本人女性のみご購入をお願いいたします。",True,2026-05
5anhpodyy2,1780238563573,key-to-lit-arena-tour-2026-neo-classics,2026-08-01,17:30,GLION ARENA KOBE,electronic,female,同行,みり,5.0,,同行,2026-05-31 14:42:43,2026-06-30 23:01:46,,listing,1,20000,"同行していただける方探しております🙇🏻‍♀️
初期当選／男性不可／下3桁提示可/着ブロ希望なし/本人確認対応可
・チケットお渡し後は、サイチェン等ご自由にして頂いて構いません。
・当日は開場15分前集合を予定しております。
集合場所については、公演前日にお知らせいたします。
･遅刻された場合待たずに入場しますが、その際も受け取り通知をお願いいたします。お時間には余裕を持ってお越しください。
・公演中止以外のいかなる場合（体調不良、出演者変更等）でも返金できません。
購入後、必要事項明記のうえご連絡お願いいたします。
※上記全てご承諾いただける、日本語の分かる女性のみ購入をお願いいたします。",True,2026-05
ybnu6ofl1n,1780079111309,key-to-lit-arena-tour-2026-neo-classics,2026-08-01,17:30,GLION ARENA KOBE,electronic,female,同行,ぴ,5.0,,QR番手,2026-05-29 18:25:11,2026-06-30 23:01:46,,listing,2,13000,"2名義中2番手/下3桁提示可能  /エラー歴なし/変更ボタンあり/該当1 非該当1
公演当日は当方が指定する場所、時間に集合していただき同時入場となります。
時間や場所は日程が近くなりましたらご連絡致します。
同時入場後、一度チケットを回収致します。こちらがチケット選択後に2番手でご選択いただきます。席を確認する時間頂きますのでご了承ください。
チケットお渡しと引き換えにその場で受け取り連絡をお願い致します。なお、お座席に関するクレームは一切受け付けておりません。
公演中止以外(当日の体調不良や遅刻、本人確認やランダムエラーなどの場合)は必ず受け取り連絡して頂きますのでご了承ください。公演中止や延期の場合のみ、手数料を差し引いた金額を返金させていただきます。
代理購入はお取引のトラブルに繋がる可能性があるため御遠慮ください。",True,2026-05
bnffdty4mf,1780048342004,key-to-lit-arena-tour-2026-neo-classics,2026-08-01,17:30,GLION ARENA KOBE,paper,none,当日手渡し,れ,5.0,,ランダム,2026-05-29 09:52:22,2026-06-30 23:01:46,,listing,1,5500,"【取引にあたり注意事項】
ランダム配布について理解ある方のみ購入お願いします。
入場時、端末をお借りしてQRを表示させていただく場合がございます。その際、持ち逃げ防止の為、身分証をお預かりさせて頂きます。身分証は封筒に入れて頂き、買い手様に封していただきます。こちらで原本に触ることはありません。チケットと交換で入場後即お返しします。なお、チケット代金につきましては全額入場前に受け取りさせていただきます。
入場後、1度チケットを回収し座席確認後、指定の時間になり次第チケットを配布させて頂きます。
公演中止の場合のみ手数料等差し引いた額を返金致します
それ以外の返金については一切受け付けません。
キャンセルの場合、サイト通し分の受取をお願いします。
本人確認,ランダムエラー,遅刻等の公演中止以外の返金はいかなる場合でも一切致しません。
座席に関するクレーム等も一切受け付けません。  集合時間に間に合わなかった場合も受け取り評価は必ずしていただきます。事前に電話番号や集合場所等はご連絡しますので、電波が悪いなどの理由での遅刻も一歳認めません。開場45分前に会場に来れる方のみ購入をお願いいたします。購入された方＝全て理解していただいたとさせていただきます。
サイト入金後、追加条件を付けてくる行為はご遠慮下さい
入金後はすべての条件を理解した上でご購入ください
ご不明点がある場合には入金前にお尋ねください。",True,2026-05
huo19pfvwr,1780047286116,key-to-lit-arena-tour-2026-neo-classics,2026-08-01,17:30,GLION ARENA KOBE,electronic,female,同行,T,5.0,,同行番手,2026-05-29 09:34:46,2026-06-30 23:01:46,,listing,2,25000,"4名義中3番手/初期当選/該当名義/有効期限内/すり替えなし/下3桁提示可/着ブロ希望なし/座席未定
4名義中3番手
全て該当名義
ご購入の方はプライベート出品いたしますのでお声がけ下さい。
公演当日は当方が指定する場所、時間に集合していただき同時入場となります。
ゲートによってはQRごとでお渡しいたします。
公演中止以外返金不可
（ランダムエラー、本人確認、通障害、公共交通機関の遅延、体調不良（出演者含む）、その他購入者様都合等、いかなる理由で入場できなかった場合でも返金はいたしかねます）
公演中止以外の理由によるキャンセル、返金請求、送金停止依頼等はお受けできません。
ご購入いただいた時点で、上記内容すべてに同意いただいたものといたします。",True,2026-05
sold_1780141915401,1780141915401,key-to-lit-arena-tour-2026-neo-classics,2026-08-01,17:30,GLION ARENA KOBE,electronic,female,同行,,,,,2026-05-30 11:51:55,2026-06-30 23:01:46,2026-06-20 16:01:09,sold,2,9000,"2名義中2番手/該当2/初期当選/下3桁提示可能/有効期限内/本確非対応

会場15分前頃にこちらが指定した場所に集合し、同時入場していただきます。
入場後チケ...",False,2026-05
sold_1780136855133,1780136855133,key-to-lit-arena-tour-2026-neo-classics,2026-08-01,17:30,GLION ARENA KOBE,electronic,female,2名義中2番手,,,,,2026-05-30 10:27:35,2026-06-30 23:01:46,2026-06-20 16:01:09,sold,2,9000,"2名義中2番手
初期当選/該当名義/有効期限内/変更ボタンあり/すり替えなし/下3桁提示可能/サイチェン等可能

入場後チケットを1度回収し、座席選択を行います...",False,2026-05
v997flyw79,1780238235110,key-to-lit-arena-tour-2026-neo-classics,2026-08-01,17:30,GLION ARENA KOBE,electronic,none,同行,ぴこ,5.0,,同行,2026-05-31 14:37:15,2026-06-30 23:01:46,,listing,2,13000,"2名義中2番手/初期当選/該当1×非該当1/すり替えなし/下3桁提示可/有効期限内/サイチェン可/
・公演当日、当方が指定した時間に会場付近にて待ち合わせし、同時入場していただきます。
集合時間は開場時間の15分前を予定しております。
詳細は公演日が近づき次第、マイページの連絡ボードでお知らせします。
・チケットお渡しと同時にその場で受け取り連絡をお願いいたします。
・同行者登録はこちらで行います。
・座席未定のため、座席に関するクレームは一切受け付けておりません。
・重複当選のため、同行者との前後での入場となる可能性がございますが、必ず連番のチケットをお渡しいたします。
・同時入場後、一旦チケットを回収し、座席確認後にチケットをお渡しいたします。座席確認に少々お時間いただきますが、ご了承ください。
・アリスタ行き来不可能なため、席次第でQR毎になる可能性もございます。
お手数お掛けしますが、よろしくお願い致します。
・公演中止以外（体調不良、交通機関の遅延、入場エラー、出演者不在・変更など）での返金は一切致しかねます。
公演中止の場合のみ、手数料を除いての返金対応させていただきます。
・日本人女性の方のみご購入ください。",True,2026-05
sold_1780110442825,1780110442825,key-to-lit-arena-tour-2026-neo-classics,2026-08-01,17:30,GLION ARENA KOBE,electronic,female,番手,,,,,2026-05-30 03:07:22,2026-06-30 23:01:46,2026-06-20 16:01:09,sold,1,12000,"2名義中2番手⚠️単番（すり替えなし）/該当名義/有効期限内/下三桁提示可
同時入場し、当方が選ばなかった席をお渡しします。
前日までにマイページにて集合時間、...",False,2026-05
sold_1780246714400,1780246714400,key-to-lit-arena-tour-2026-neo-classics,2026-08-01,17:30,GLION ARENA KOBE,electronic,female,当日手渡し,,,,,2026-05-31 16:58:34,2026-06-30 23:01:46,2026-06-20 16:01:09,sold,2,14500,"3名義中2番手
該当×3/初期当選/すり替えなし/下3桁提示可

• 公演中止以外のランダムエラー、買い手様の遅刻、体調不良、交通機関遅延等、いかなる場合でもキ...",False,2026-05
lmiv7iig38,1780070811764,key-to-lit-arena-tour-2026-neo-classics,2026-08-01,17:30,GLION ARENA KOBE,electronic,female,同行,み,5.0,,番手,2026-05-29 16:06:51,2026-06-30 23:01:46,2026-06-25 16:01:11,sold,1,14999,"3名義中2番手
初期当選　　該当×2 非該当×1
有効期限内/下3桁提示可/変更ボタンあり
※一枚でお引き取りの場合、もう一方の2番手の方と連番でお座りください。上乗せで座席選択権確定にします。
当日集合時、同行者登録にご協力いただく場合があります。
◉同一ゲート（アリスタ行き来可）の場合
入場後チケットを回収いたします。当方が選ばなかった名義の中からお好きな方をお選びください。2枚で購入の場合、必ず連番でお引き取りくださいお渡しする際に、その場で受け取り完了をよろしくお願いいたします。完了まではお渡しできません。
◉別ゲート（アリスタ行き来不可）だった場合
当方が選ばなかったゲート名義をお選びの場合、QR毎お渡しします。
1️⃣こちらが指定するお時間、場所にお越しいただき、買い手様のスマホ端末をお借りし、こちらがログイン•QR画面まで操作させていただきます。（ログインに必要な操作以外は一切操作しないことをお約束します。）
その時点で「受け渡し完了」を押させていただきます。
2️⃣QR画面をご確認いただき、問題なければ「受け取り完了」をお願いします。
3️⃣解散後、入場していただき、【QR画面のスクショ】と【ログアウト画面のスクショ】を［スクショ画面上表示時刻で2枚の差が3分以内のもの］でお送りください。
また、開演時間が来た時点でご連絡がない場合は評価を下げてつけさせてもらうことをご理解ください。
返金不可
◉ランダムエラー、体調不良、出演者変更、本人確認、別ゲート入場時にログインページを誤って消すミスなどによるキャンセルは対応できません。当方に明らかな不手際がある場合以外はいかなる場合も受け取り完了をしていただきます。
サイチェンはトラブル防止、名義を守るためにご遠慮ください。
ランダムエラーは入場者自身で対策しようのないものであるため、【その点を理解されている方のみ】ご購入ください。
公演中止の場合、手数料を差し引いた額を返金いたします。
公演前日に集合場所、時間等をお伝え予定。きちんとご連絡くだされば多少の遅刻はお待ちします。こまめに連絡を取れる方のみご購入ください。",True,2026-05
5lk9ukcfo9,1780106569389,key-to-lit-arena-tour-2026-neo-classics,2026-08-01,17:30,GLION ARENA KOBE,electronic,female,情報局先行 坐席未定 少人数ランダム配布,S,5.0,,ランダム,2026-05-30 02:02:49,2026-06-28 06:01:18,,deleted,1,5000,"複数名義所持しておりますので同時入場後、一度チケットを回収し、ランダム配布にてお譲り致します。
入場後会場内でお待ち頂きますが、必ず開演時間までにお渡し致します。
持ち逃げ防止の為入場時身分証明書を一時的にお預かりする可能性がございますが、入場後直ぐにご返却させて頂きます。（こちらで用意した封筒に身分証明書を入れて一時預かりいたします。入場でき次第、チケットと交換で即返却いたします。）
チケット受取り後ご確認頂けましたら、その場で受取通知をして頂きますよう宜しくお願い致します。
なお買い手様は一切お座席をお選び頂けません。
当日の体調不良・大幅な遅刻・ランダムエラー・本人確認等の公演中止以外の場合の返金は一切致しかねます。
開場10分前会場付近集合予定。詳しい待ち合わせ時間・場所は連絡ボードにてやり取りさせて頂きます。
公演当日集合時間に柔軟に対応できる方、公演日前日と当日はこまめに連絡を取れる方のみでお願いします。
以上全てご了承いただける方のみご購入お願いいたします。",True,2026-05
