ticket_id,created_at_unix,event_id,perf_date,perf_time,venue,ticket_type,name_type,delivery_method,seller_name,seller_rating,order_num,ticket_tags,first_observed_at,last_observed_at,sold_at,status,quantity,price,raw_description,details_fetched,year_month
32796khdbu,1780026501543,key-to-lit-arena-tour-2026-neo-classics,2026-08-21,18:00,有明アリーナ,electronic,none,ランダム配布(集合少人数),c,5.0,,ランダム,2026-05-29 03:48:21,2026-06-30 23:01:46,,listing,2,10000,"【必ず下記全てお読みいただきご理解いただけた方のみご購入下さい】
【購入されたらまず購入者情報をメッセージに入れて下さい】
お待ち合わせ後QR表示用の端末ごとにわかれて入場していただき、発券されましたら1度全てのチケットを回収致します。発券したチケットがご自身のチケットになるわけではないので券面は確認せずにこちらにお渡し下さい。券面の写真なども撮らないで下さい。
購入者様がお席を選ぶことはできません。当該会場にて立見席、制作開放席、着席ブロックなどのような席種が採用される場合どんなお席になる可能性もございます。
チケットお渡しまでにお時間を頂戴しますので入場後一度解散し、開演10分前を目安に再度落ち合いお渡しします。その際は自由行動で構いませんが開演時刻迫りましたらこちらが指定した場所にて待機してくださるなどスムーズなお取引にご協力お願い致します。 待機中いつ渡していただけるかの催促などはお控え下さい。
お待ち合わせ時間目安は開場時間30分前(開演ではなく開場です)になりますが、当方の状況と公演により前後する可能性はございますのでお日にち近づきましたらこちらの連絡ボードより待ち合わせ場所と共にご案内致します。
遅刻には対応しておりませんので(交通機関の遅延などであっても不可)こちらの指定する時間に余裕を持って来ていただける当日融通のきく方のみご購入下さい。遅刻は開演時間ではなくこちらの指定する時間が指標ですのでご了承願います。
お待ち合わせ後は入場列に並びますので会場外での用事はそれまでにお済ませ下さい。入場後もチケットお渡しまではお手洗い使えない可能性が高いので必ず済ませてからいらしてください。
当日の予期せぬネット環境の不具合なども考慮して、購入されましたらすぐ、こちらからお伺いする前にお名前(漢字フルネーム)と電話番号もお知らせ下さい。
感染症関連による公演中止の場合を除き、購入者様の体調不良、出演者変更、ランダムエラー、本人確認、端末の不具合、遅刻などいかなる場合により入場ができなかった場合でも受取連絡はしていただき、返金は致しかねます。(特にランダムエラーは運営側のシステムの為こちらにはどうすることもできませんのでクレームは受けません)
また、事前/当日に関わらず購入者様都合でのキャンセルはお受けできませんのできちんと考えてからご購入下さい。
代理購入もトラブルの原因になりかねませんので禁止です。
チケットをお渡しした際に受取連絡までの処理をしていただきます。応じていただけない方にはチケットお渡し致しません。 また、券面を確認して受取連絡まで完了したのちの送金停止はどんな理由であっても受け付けません。
開演間際につき再集合時のやり取りを極力最小限にするため、発送連絡は事前に行うことがありますが受取連絡はチケットを渡した際で大丈夫です。
〈その他条件〉
・19歳以上であり、メッセージ上だけでなく実際の会話でも日本語に不自由のないこと。同行者登録時にお名前(と電話番号)を使わせていただくことがあるので申し訳ございませんが実名が日本式姓名の方のみとなります。
・団体での移動に困難が生じる可能性のある方は購入お控え下さい。(足の悪い方、杖や松葉杖を携えている方、キャリーケースなど大きな荷物をお持ちの方など)
・お手持ちのスマートフォンをお借りして発券に必要な情報をこちらで打ち込み、その端末で発券していただくことがあります。その際身分証をお預かりすることもあります。この身分証につきましては入場後すぐチケット回収時に返却致します。
・録音録画やその他迷惑行為はご遠慮願います。
・ランダム配布について理解されていること。
以上、全て読まれていないと思われる購入に関しては一切責任負えませんのでよろしくお願い致します。",True,2026-05
yz7k8m77n7,1780040582855,key-to-lit-arena-tour-2026-neo-classics,2026-08-21,18:00,有明アリーナ,electronic,female,ランダム配布,(☆ᵔ  ̫ᵔ☆),5.0,,ランダム,2026-05-29 07:43:02,2026-06-26 22:01:13,,deleted,2,7000,"ランダム配布となります。連番でご購入いただいた場合は連番でお渡しします。
全名義エラー履歴なし、同一クレカコンビニ払いなし
・公演当日、開場30分前を目安に会場付近で待ち合わせをし、同時入場していただきます。
・チケットの発券をお願いすることがあります。その際に身分証（原本のみ）を中身の見えない封筒に入れてお預かりさせていただきます。入場後はチケットを回収後速やかに返却いたします。電波状況により連絡がつかなくなる恐れもありますので、購入後はお名前と必ず連絡の取れる電話番号の記載をお願い致します。
・なるべく早くお渡しできるよう心がけますが、座席選択にお時間をいただく場合がございます。必ず開演5分前までにはチケットをお渡し致します。チケットお渡し後は速やかに受け取り通知をお願い致します。座席のクレーム等は一切受け付けません。サイチェン等していただいて構いませんが、盗撮、録音、迷惑行為等はお辞めください。
・遅刻などの連絡は早めにお願い致します。大幅に遅れる場合、到着を待たずに入場する事がありますが、その場合も受け取り通知はしていただきます。
・本人確認等なるべく対応致しますが、システム、ランダムエラー、操作ミス等公演中止以外の如何なる理由でも入場出来なかった場合の返金は出来ませんのでご了承ください。公演中止の場合のみ手数料を引いた金額を返金させていただきます。
以上の項目を理解していただける日本人女性のみご購入をお願い致します。",True,2026-05
qcpcydbotw,1780191175967,key-to-lit-arena-tour-2026-neo-classics,2026-08-21,18:00,有明アリーナ,electronic,female,同行,ま,5.0,,同行番手,2026-05-31 01:32:55,2026-06-30 23:01:46,2026-06-26 14:01:13,sold,2,10050,"全て初期当選、情報局先行、4番手中4番手 、QR発券のため座席未定
該当名義×3、非該当×1、全て有効期限内、ペイジー決済、着席ブロック希望ではございません。入場時は連番される方と分かれて入場いただきますが、チケットは1度こちらで全て回収し、 お時間を頂きますが座席選択後残りのチケットをお渡しいたします。下3桁提示可能。すり替えなし。サイチェン可能。ルールを守った上で行ってください。同行者登録はこちらで行います。 16時40分に待ち合わせ場所に来れる方。時間に遅れた場合も返金対応も致しかねますので、必ず受取をお願いいたします。ゲートが出た後にアルファベット（番号）によってはQRごとお渡しになるかもしれません。
・ランダムエラー、ログインエラー、検温、赤線エラー、本人確認、出演者変更等の公演中止以外で入場ができなかった場合返金対応は一切致しません。また、買い手様によるキャンセルを行う際の返金対応についても一切致しません。
・チケット持ち逃げ防止のため身分証の写真を撮らせていただく場合がございます。
・電話番号をお伝え頂ける方のご購入お願いいたします。※日本人女性のみの購入をお願いいたします。
・チケットをお渡ししましたらその場で必ず受け取り通知連絡をして頂きます。受け取り評価をしていただけない場合、チケットをお渡しすることは出来ません。
・お渡ししたチケットの座席のクレームは一切受け付けません。
・代理購入はトラブルの原因になりますのでお控えください。
お互いに気持ちのよい取引を行うことを心がけますのでよろしくお願いいたします。
⚠️取引が決定した場合、プラベルにて変更を考えております。",True,2026-05
ftqjvx7ilz,1780071280862,key-to-lit-arena-tour-2026-neo-classics,2026-08-21,18:00,有明アリーナ,electronic,female,同行,s,5.0,,同行記載あり,2026-05-29 16:14:40,2026-06-30 23:01:46,,listing,1,40000,"本人確認対応可/重複・すり替えなし/下3桁提示可/初期当選/ 有効期限内/着ブロ希望なし/同行者登録可/サイチェン可
・当方(嶺亜担)との同行になります。
・連番内の座席はお選びいただけません。
・公演当日、会場付近にて待ち合わせし、同時入場していただきます。
・公演中止の場合のみ手数料を除いた金額を返金いたします。
・ご不明点等ございましたらメッセージにてご連絡ください。",True,2026-05
ipqcee6z5n,1780131043350,key-to-lit-arena-tour-2026-neo-classics,2026-08-22,12:30,有明アリーナ,electronic,female,同時入場,Ｊ,5.0,,同行番手,2026-05-30 08:50:43,2026-06-30 23:01:46,,listing,2,20000,"２名義中２番手のお譲り
プラベル出品可能
すり替えなし/全て該当名義/初期当選/当選名義下３桁提示/有効期限内/Pay-easy入金/着ブロ指定なし/サイチェン可/変更ボタン全てあり/本人確認不可
＊取引成立後すぐに当選名義会員No.下３桁をお教えいたします
＊開場時間（11:30）ころ会場近くで待ち合わせをし、同時入場お願いいたします
＊発券後、当方が選ばなかった名義のチケットをお渡しいたします
＊ご入場後すぐにチケットをお渡しいたしますが、座席に迷った場合は少しお時間いただく場合もございます（解散なしでチケットをお渡しいたします）
＊１枚でのご購入の場合は、ご購入後ご担当と同担可否をお教えください
＊チケット受取りましたら、受取完了報告をお願いいたします
＊公演中止の際は、チケテン事務局に取引キャンセル依頼をさせていただきます。",True,2026-05
kv675mqwsi,1780048545036,key-to-lit-arena-tour-2026-neo-classics,2026-08-22,12:30,有明アリーナ,paper,none,当日手渡し,れ,5.0,,ランダム,2026-05-29 09:55:45,2026-06-30 23:01:46,,listing,2,8500,"【取引にあたり注意事項】
ランダム配布について理解ある方のみ購入お願いします。
入場時、端末をお借りしてQRを表示させていただく場合がございます。その際、持ち逃げ防止の為、身分証をお預かりさせて頂きます。身分証は封筒に入れて頂き、買い手様に封していただきます。こちらで原本に触ることはありません。チケットと交換で入場後即お返しします。なお、チケット代金につきましては全額入場前に受け取りさせていただきます。
入場後、1度チケットを回収し座席確認後、指定の時間になり次第チケットを配布させて頂きます。
公演中止の場合のみ手数料等差し引いた額を返金致します
それ以外の返金については一切受け付けません。
キャンセルの場合、サイト通し分の受取をお願いします。
本人確認,ランダムエラー,遅刻等の公演中止以外の返金はいかなる場合でも一切致しません。
座席に関するクレーム等も一切受け付けません。  集合時間に間に合わなかった場合も受け取り評価は必ずしていただきます。事前に電話番号や集合場所等はご連絡しますので、電波が悪いなどの理由での遅刻も一歳認めません。開場45分前に会場に来れる方のみ購入をお願いいたします。購入された方＝全て理解していただいたとさせていただきます。
サイト入金後、追加条件を付けてくる行為はご遠慮下さい
入金後はすべての条件を理解した上でご購入ください
ご不明点がある場合には入金前にお尋ねください。",True,2026-05
beccoxxf04,1780242611475,key-to-lit-arena-tour-2026-neo-classics,2026-08-22,12:30,有明アリーナ,electronic,none,同行,ｓ,5.0,,同行,2026-05-31 15:50:11,2026-06-30 23:01:46,,listing,1,20000,"該当名義同行/すり替えなし/有効期限内/下3桁提示可/中村担と同行
当日開場時間に集合場所にお集まりいただき、同時入場いたします。チケットを回収後、2連中のどちらかの座席を当方が選択して、すり替えせずにそのままもう1枚をお渡しいたします。
その他注意事項
・着ブロなし
・体調不良や各種エラーなどにより入場が出来なかった場合、本人確認などで退場させられた場合、メンバーの欠席があった場合、その他いかなる場合にも、開演までに必ず受取通知をお願いいたします。
・本人確認対応不可。
・いかなる理由でもキャンセル不可。
・サイチェン可ですが、録音録画等ブラリ入り行為厳禁です。
・公演中止時のみ手数料を差し引いた金額を返金致します。",True,2026-05
sold_1780022180789,1780022180789,key-to-lit-arena-tour-2026-neo-classics,2026-08-22,12:30,有明アリーナ,electronic,female,同行,,,,,2026-05-29 02:36:20,2026-06-30 23:01:46,2026-06-20 16:01:09,sold,1,5170,"少人数ランダム配布。
				
11:15を目安に集合していただき、同時入場をお願い致します。こちらで座席確認後、開演前10分前までにお渡しします。座席の選択権...",False,2026-05
7u72lqbygw,1780026593671,key-to-lit-arena-tour-2026-neo-classics,2026-08-22,12:30,有明アリーナ,electronic,none,ランダム配布,c,5.0,,ランダム,2026-05-29 03:49:53,2026-06-30 23:01:46,,listing,2,10000,"【必ず下記全てお読みいただきご理解いただけた方のみご購入下さい】
【購入されたらまず購入者情報をメッセージに入れて下さい】
お待ち合わせ後QR表示用の端末ごとにわかれて入場していただき、発券されましたら1度全てのチケットを回収致します。発券したチケットがご自身のチケットになるわけではないので券面は確認せずにこちらにお渡し下さい。券面の写真なども撮らないで下さい。
購入者様がお席を選ぶことはできません。当該会場にて立見席、制作開放席、着席ブロックなどのような席種が採用される場合どんなお席になる可能性もございます。
チケットお渡しまでにお時間を頂戴しますので入場後一度解散し、開演10分前を目安に再度落ち合いお渡しします。その際は自由行動で構いませんが開演時刻迫りましたらこちらが指定した場所にて待機してくださるなどスムーズなお取引にご協力お願い致します。 待機中いつ渡していただけるかの催促などはお控え下さい。
お待ち合わせ時間目安は開場時間30分前(開演ではなく開場です)になりますが、当方の状況と公演により前後する可能性はございますのでお日にち近づきましたらこちらの連絡ボードより待ち合わせ場所と共にご案内致します。
遅刻には対応しておりませんので(交通機関の遅延などであっても不可)こちらの指定する時間に余裕を持って来ていただける当日融通のきく方のみご購入下さい。遅刻は開演時間ではなくこちらの指定する時間が指標ですのでご了承願います。
お待ち合わせ後は入場列に並びますので会場外での用事はそれまでにお済ませ下さい。入場後もチケットお渡しまではお手洗い使えない可能性が高いので必ず済ませてからいらしてください。
当日の予期せぬネット環境の不具合なども考慮して、購入されましたらすぐ、こちらからお伺いする前にお名前(漢字フルネーム)と電話番号もお知らせ下さい。
感染症関連による公演中止の場合を除き、購入者様の体調不良、出演者変更、ランダムエラー、本人確認、端末の不具合、遅刻などいかなる場合により入場ができなかった場合でも受取連絡はしていただき、返金は致しかねます。(特にランダムエラーは運営側のシステムの為こちらにはどうすることもできませんのでクレームは受けません)
また、事前/当日に関わらず購入者様都合でのキャンセルはお受けできませんのできちんと考えてからご購入下さい。
代理購入もトラブルの原因になりかねませんので禁止です。
チケットをお渡しした際に受取連絡までの処理をしていただきます。応じていただけない方にはチケットお渡し致しません。 また、券面を確認して受取連絡まで完了したのちの送金停止はどんな理由であっても受け付けません。
開演間際につき再集合時のやり取りを極力最小限にするため、発送連絡は事前に行うことがありますが受取連絡はチケットを渡した際で大丈夫です。
〈その他条件〉
・19歳以上であり、メッセージ上だけでなく実際の会話でも日本語に不自由のないこと。同行者登録時にお名前(と電話番号)を使わせていただくことがあるので申し訳ございませんが実名が日本式姓名の方のみとなります。
・団体での移動に困難が生じる可能性のある方は購入お控え下さい。(足の悪い方、杖や松葉杖を携えている方、キャリーケースなど大きな荷物をお持ちの方など)
・お手持ちのスマートフォンをお借りして発券に必要な情報をこちらで打ち込み、その端末で発券していただくことがあります。その際身分証をお預かりすることもあります。この身分証につきましては入場後すぐチケット回収時に返却致します。
・録音録画やその他迷惑行為はご遠慮願います。
・ランダム配布について理解されていること。
以上、全て読まれていないと思われる購入に関しては一切責任負えませんのでよろしくお願い致します。",True,2026-05
sold_1780039372206,1780039372206,key-to-lit-arena-tour-2026-neo-classics,2026-08-22,12:30,有明アリーナ,electronic,female,公演日2日前までにログイン情報共有,,,,,2026-05-29 07:22:52,2026-06-30 23:01:46,2026-06-20 16:01:09,sold,2,20000,"該当（変更ボタンあり）/初期当選/ QR毎/ 有効期限内/下3桁提示可/同行者登録可/着ブロ希望なし/payeasyで入金済み

事前に会員番号下3桁お伝えでき...",False,2026-05
7lhiewhva1,1780072042630,key-to-lit-arena-tour-2026-neo-classics,2026-08-22,12:30,有明アリーナ,electronic,female,同行,mm,5.0,,ランダム,2026-05-29 16:27:22,2026-06-30 23:01:46,,listing,1,7239,"座席未定 ランダム配布 条件あり 座席選択不可 代理購入不可
ランダム配布になりますので最後までご理解いただきご購入ください。
・複数名義所持しておりますので、同時入場後チケットを一旦回収し解散した後、座席選択後にランダムでチケットをお渡しします。買い手様は座席をお選び頂けません。座席選択にお時間を頂きますので配布を急がれる方はご遠慮ください。公演開始までにはチケットをお渡しさせて頂きます。当日はこちらの指示に従ってご対応お願いいたします。チケットを受け取り後は速やかに受取通知をお願い致します。
・お席のクレームは一切お受け出来ません。
・公演当日は開場時間の30-45分前に会場周辺で集合を予定しております。待ち合わせ時間、場所の詳細については、ご入金後にマイページの連絡ボードでお知らせします。 10分以上遅刻される場合は待たずに入場しますが、受取通知はして頂きますので、お時間に余裕を持ってお越しください。
・入場時に端末をお借りする可能性がございます。 入場の際にお連れ様と分かれて頂く可能性がございますがチケットは連番でお渡しさせて頂きます。 この際チケット持ち逃げ防止のために身分証を一度お借りさせていただきます。尚、問題がなければ、こちらが身分証の内容を確認することはなく、チケット回収と同時に返却致します。
・チケットをお渡しすると同時に受け取り評価して頂きます。その場で受け取り評価して頂き、その後チケットをお渡しします。
・ランダムエラー、本人確認の理由での入場が出来なかった場合の返金は対応出来ません。買い手様の都合(体調不良、遅刻、メンバーの不在等)でのキャンセルも対応は出来かねます。
・入場管理のため落札後、連絡ボードにて名字とお電話番号をお伺いします。
・トラブル防止のため、デジチケやランダムチケットのお取引に不慣れな方は購入をお控えください。
・以上のことをご理解頂ける、日本語が通じる成人女性のみご購入お願い致します。
メッセージいただければ、プライベート出品での対応も可能です。",True,2026-05
