ticket_id,created_at_unix,event_id,perf_date,perf_time,venue,ticket_type,name_type,delivery_method,seller_name,seller_rating,order_num,ticket_tags,first_observed_at,last_observed_at,sold_at,status,quantity,price,raw_description,details_fetched,year_month
sold_1780035266691,1780035266691,key-to-lit-arena-tour-2026-neo-classics,2026-07-11,18:00,朱鷺メッセ 新潟コンベンションセンター,electronic,female,同行,,,,,2026-05-29 06:14:26,2026-06-30 23:01:46,2026-06-20 16:01:09,sold,1,25000,"該当（変更ボタンあり）有効期限内名義
嶺亜担不可×
⭐️公演当日は会場付近で待ち合わせをし、同時入場していただきます。
⭐️詳しい待ち合わせ時間や場所等はお取引...",False,2026-05
sold_1780119711551,1780119711551,key-to-lit-arena-tour-2026-neo-classics,2026-07-11,18:00,朱鷺メッセ 新潟コンベンションセンター,electronic,female,同行,,,,,2026-05-30 05:41:51,2026-06-30 23:01:46,2026-06-20 16:01:09,sold,2,11000,"3名義中2番手
初期当選/該当名義/下3桁提示可/変更ボタンあり/すり替えなし

3名義中2番手でのお譲りとなります。
入場時に端末をお借りする場合がございます...",False,2026-05
j4000wa4di,1780053386190,key-to-lit-arena-tour-2026-neo-classics,2026-07-11,18:00,朱鷺メッセ 新潟コンベンションセンター,electronic,female,同行,にこ,5.0,,同行記載あり,2026-05-29 11:16:26,2026-06-28 05:01:26,,deleted,1,4000,"公演当日は待ち合わせ後に同時入場します。
集合時間は開演1時間30分前を予定。集合時間に10分以上遅れた場合入場保証はできません。その場合でも受け取りしていただきますのでお時間に余裕をもってお越し下さい。
複数名義から入場後こちらが先に必要な分席を選びますので、座席にこだわりのある方はご遠慮ください。
座席確認のため入場後一旦解散し、開演10分前までには再度集合しチケットをお渡し致します。チケットお渡し時に受取連絡をお願いします。
入場時チケットの表示にご協力いただく場合がございます。 お連れ様と別々で入場した場合でも連番のチケットをお渡し致します。
主催者側からの公演中止以外の返金対応は致しません。日本語がきちんと理解・話せる女性の方のみご購入ください。
代理購入は不可とさせていただきます。必ず入場する本人のみご購入ください。
同行者登録にご協力していただける方でお願いします。購入後はこちらからの連絡を待たずに、当日連絡の取れる代表者1名のお名前とお電話番号をお送りください。
本人確認、ランダムエラー、当日又は当日までの体調不良、出演者不在などによる購入後のキャンセルや、チケットお渡し後の座席に関するクレーム等での入場後の送金停止も一切対応致しませんのでご了承ください。",True,2026-05
b41tvl1n0h,1780062271224,key-to-lit-arena-tour-2026-neo-classics,2026-07-11,18:00,朱鷺メッセ 新潟コンベンションセンター,pickup_number,female,公演前日までにログイン情報共有,もん,5.0,,QR,2026-05-29 13:44:31,2026-06-30 23:01:46,,listing,2,20000,"QRごと/すり替え重複なし/非該当/有効期限内/下3桁提示/同行者登録可
公演前日にログイン情報お伝えします。
公演中止のみ返金します。
体調不良やランダムエラー等で入場できなかった際も受取はしていただきますのでご了承ください。",True,2026-05
sold_1780192551953,1780192551953,key-to-lit-arena-tour-2026-neo-classics,2026-07-11,18:00,朱鷺メッセ 新潟コンベンションセンター,electronic,female,同行,,,,,2026-05-31 01:55:51,2026-06-30 23:01:46,2026-06-20 16:01:09,sold,2,620,"【ランダム配布にご理解ある方のみご購入お願い致します】
同時入場後、ランダムでチケットをお渡しさせて頂きます。
ご自身での座席選択はできかねますのでご了承くださ...",False,2026-05
sold_1780116023600,1780116023600,key-to-lit-arena-tour-2026-neo-classics,2026-07-11,18:00,朱鷺メッセ 新潟コンベンションセンター,electronic,female,同行,,,,,2026-05-30 04:40:23,2026-06-30 23:01:46,2026-06-20 16:01:09,sold,1,14500,"該当名義/すり替えなし/有効期限内/変更ボタンあり/下3桁提示可/

公演当日は会場付近で待ち合わせをし、同時入場していただきます。
詳しい待ち合わせ時間や場所...",False,2026-05
sold_1780026993222,1780026993222,key-to-lit-arena-tour-2026-neo-classics,2026-07-11,18:00,朱鷺メッセ 新潟コンベンションセンター,electronic,female,公演日前日までにQRコード共有,,,,,2026-05-29 03:56:33,2026-06-30 23:01:46,2026-06-20 16:01:09,sold,2,20683,"初期当選 重複すり替えなし 下3桁提示可 岩崎名義 変ボあり 同行者登録可 コンビニ決済 有効期限内名義

公演日前日にログインに必要な情報を連絡ボードにてお送...",False,2026-05
nytvmbwn7k,1780034135177,key-to-lit-arena-tour-2026-neo-classics,2026-07-11,18:00,朱鷺メッセ 新潟コンベンションセンター,electronic,male,公演日前日までにログイン情報共有,m,5.0,,QR,2026-05-29 05:55:35,2026-06-26 14:01:13,,deleted,2,25000,"初期当選／該当名義(猪狩)／有効期限内／QR毎／ペイジー決済／すり替えなし／下3桁提示可／着ブロ希望なし／変更ボタンあり／サイチェン可
データ収集のため、チケット発券しましたら開演までに座席情報の共有をお願いいたします。ご協力いただける方は即決2.0/枚とさせていただきます。
【注意事項】
・ログイン情報は公演日前日までにお知らせいたします。
・会場入場後、チケット表示確認時点で受取評価およびログアウトをお願いいたします。
・開演時間になりましたらパスワードを変更いたしますので、時間に余裕を持ってご入場ください。
・サイチェン等はしていただいて構いませんが、座席についてのクレームは一切受け付けておりませんのでご了承ください。
・名義人の来場および本人確認対応はできません。
・トラブル防止のため、代理購入はご遠慮ください。
【返金について】
・ランダムエラー、本人確認、通信障害、公共交通機関の遅延、体調不良（出演者含む）、その他購入者様都合等、いかなる理由で入場できなかった場合でも返金はいたしかねます。
・公演中止の場合のみ、送料・手数料を差し引いた金額を返金いたします。
・公演中止以外の理由によるキャンセル、返金請求、送金停止依頼等はお受けできません。
ご購入いただいた時点で、上記内容すべてに同意いただいたものといたします。",True,2026-05
fjssi9tovq,1780047806748,key-to-lit-arena-tour-2026-neo-classics,2026-07-11,18:00,朱鷺メッセ 新潟コンベンションセンター,electronic,female,公演日前日にログイン情報の共有,にゅの,5.0,,QR,2026-05-29 09:43:26,2026-06-30 23:01:46,,deleted,2,18000,"有効期限内該当名義/変ボあり/初期当選/下3桁提示可能/同行者登録可能
公演日前日にログイン情報をお伝えいたしますのでご自身で同行者登録からご対応お願いいたします
いかなる理由でも公演中止以外の返金は致しかねますので予めご了承ください",True,2026-05
h5t717w5b4,1780055048184,key-to-lit-arena-tour-2026-neo-classics,2026-07-11,18:00,朱鷺メッセ 新潟コンベンションセンター,electronic,female,同行,n,5.0,,同行,2026-05-29 11:44:08,2026-06-28 16:01:27,,deleted,1,30000,"即3.0
該当(井上)名義/下3桁提示可/初期当選/有効期限内/変更ボタンあり/重複すり替えなし/着ブロ希望なし/サイチェン可
開場時間10分前頃集合し当方(井上担)と同時入場していただきます。
入場時スタッフから1枚ずつ半券を渡される場合も一度半券回収させていただきます。そのまま座席確認まで同行していだたき当方が連番内の座席選択をした後サイチェン等好きにしていただいて構いません。
改めて買い手様は連番内の座席はお選びいただけませんのでご承知おきください。
集合時間に遅れた場合は待たずに入場いたしますが受け取り評価していただきます。その他如何なる理由に置いても買い手様都合の理由でのキャセル受け付けません。
公演中止以外の返金は出来かねますのでご了承ください。
質問や購入希望の方はメッセージからご連絡ください。
トラブル防止のため成人済みの日本人女性で取引経験ある方のみ購入可能",True,2026-05
shot0yiop9,1780045656095,key-to-lit-arena-tour-2026-neo-classics,2026-07-11,18:00,朱鷺メッセ 新潟コンベンションセンター,electronic,female,指定席のみ 4名義中4番手,ねこ,5.0,,番手,2026-05-29 09:07:36,2026-06-27 12:01:20,,deleted,2,4000,"4名義中4番手 すり替えなし 下3桁提示可能 全て変更ボタンあり該当名義 有効期限内
開場時間の~30分前までに会場付近でお集まりいただき、同時入場いたします。
遅刻された場合先に入場する場合もございますが、その場合も受け取り通知して頂きますので予めご了承ください。
4名義中4番手になりますので座席の選択はできません。
チケットお渡しまでお時間いただく場合がございます。
ランダムエラーなど公演中止以外はいかなる場合も返金対応不可です。
日本人女性のみご購入ください。",True,2026-05
sold_1780221091963,1780221091963,key-to-lit-arena-tour-2026-neo-classics,2026-07-11,18:00,朱鷺メッセ 新潟コンベンションセンター,electronic,female,同行,,,,,2026-05-31 09:51:31,2026-06-30 23:01:46,2026-06-20 16:01:09,sold,2,6000,"3名義中3番手
全て該当名義/有効期限内/変更ボタン有/すり替えなし/下３桁提示可

当日指定したお時間に集合し、同時入場をしていただきます。
入場の際、QRの...",False,2026-05
vs79netp6o,1780206368049,key-to-lit-arena-tour-2026-neo-classics,2026-07-11,18:00,朱鷺メッセ 新潟コンベンションセンター,electronic,female,同行,も,5.0,,ランダム記載あり,2026-05-31 05:46:08,2026-06-30 23:01:46,,listing,1,500,"座席未定 ランダム配布となります。
開場時間の1時間前頃に会場付近に集合して頂き同時入場して頂きます。
複数名義所持のためランダム配布させていただきます。集合時こちらの当選済みFCでログインさせていただき、その際にお名前の分かるものと交換させていただきます。入場後チケットをお渡しする際に返却させていただきます。コンビニ支払い完了済。ご購入者様は座席を選ぶことは出来ません。ギリギリになる場合も御座いますが開演時間までにチケットを再配布致します。
当日連絡がこまめに取れる方、お時間を厳守できる方、日本語が理解できる方のみお願いします。
当日、買い手様の遅刻、交通機関の乱れ等で入場いただけなかったなど購入者様の体調不良により入場できなかった場合、座席などへのクレームでの返金は一切致しかねます。そのような場合でも必ず受取連絡はして頂きますのでご了承ください。 ランダムエラーなどの際は全額返金致します。チケットをお渡しさせて頂く際に、必ず受取連絡をお願い致します。受取連絡をして頂いた時点でお取引が問題な く完了したこととみなし、それ以降のクレーム等は受け付けません。如何なる場合でもキャンセルはお受けできません。",True,2026-05
sold_1780135882425,1780135882425,key-to-lit-arena-tour-2026-neo-classics,2026-07-11,18:00,朱鷺メッセ 新潟コンベンションセンター,electronic,female,3名義中3番手 開場15分前会場付近集合,,,,,2026-05-30 10:11:22,2026-06-30 23:01:46,2026-06-20 16:01:09,sold,2,9800,該当名義のみ/有効期限内/変更ボタン有/着ブロ希望1名義有/購入後会員番号下3桁開示可/開場15分前に会場付近に集合し同時入場していただきます/公演中止以外のみ...,False,2026-05
sold_1780020985080,1780020985080,key-to-lit-arena-tour-2026-neo-classics,2026-07-11,18:00,朱鷺メッセ 新潟コンベンションセンター,electronic,female,公演日前日にQRコード共有,,,,,2026-05-29 02:16:25,2026-06-30 23:01:46,2026-06-20 16:01:09,sold,2,20000,"1.5〜即2

QR毎 重複/すり替えなし
下3桁表示可 初期当選 有効期限内
猪狩名義

・公演中止以外、ランダムエラーや遅刻、体調不良、出演者変更、電波障害...",False,2026-05
vynhh2rty2,1780029605412,key-to-lit-arena-tour-2026-neo-classics,2026-07-11,18:00,朱鷺メッセ 新潟コンベンションセンター,electronic,female,同行,TA,5.0,,ランダム,2026-05-29 04:40:05,2026-06-30 23:01:46,,listing,1,10800,"ランダム配布 同時入場 立見なし 全て指定席 有効会員
ランダム配布をご理解している方のみご購入ください。
男性の方、日本語か話せる外国人の方も購入できます。
当日こちらの指定した時間に必ず集合してください。
待ち合わせは開場の30分前予定です。
チケットはランダムにお渡しする為、購入者様は座席を選ぶことが出来ません。
会場の電波が悪い場合に備え、事前に当日連絡のつく電話番号をお伺いします。
発券後は一度全てのチケットを回収し、再度チケットをお渡しする迄にお時間を頂きます。
その間一旦解散とし、お手洗い等自由に行動していただいて大丈夫です。
お渡しするチケットが決定次第ご連絡するので指定の場所へ再度集合をお願いいたします。チケットのお渡しは開演時間間際となる可能性がございます。
集合時間厳守できる方、入場列に整列し同時入場可能な方、常識を守れる方でお願い致します。
上記事項に同意できる方のみ購入お待ちしております。
公演中止以外での如何なる理由（体調不良やランダムエラー
他）でもキャンセルは対応致しません。
集合時間に遅刻された場合、こちらは定刻に入場する為、受取連絡はお願いしております。",True,2026-05
sold_1780121232111,1780121232111,key-to-lit-arena-tour-2026-neo-classics,2026-07-11,18:00,朱鷺メッセ 新潟コンベンションセンター,electronic,female,QR毎,,,,,2026-05-30 06:07:12,2026-06-30 23:01:46,2026-06-20 16:01:09,sold,1,30000,"前日にログイン情報をお送りします。
単番/期限内該当名義/すり替え重複なし/変更ボタン有/下3桁提示可
",False,2026-05
sold_1780145904119,1780145904119,key-to-lit-arena-tour-2026-neo-classics,2026-07-11,18:00,朱鷺メッセ 新潟コンベンションセンター,electronic,female,同行,,,,,2026-05-30 12:58:24,2026-06-30 23:01:46,2026-06-20 16:01:09,sold,2,9000,"2名義中2番手、全て2連
全て該当名義、変更ボタンあり、すり替えなし、有効期限内

公演当日17時頃に会場付近で待ち合わせし同時入場していただきます。
連番で購...",False,2026-05
sold_1780074218580,1780074218580,key-to-lit-arena-tour-2026-neo-classics,2026-07-11,18:00,朱鷺メッセ 新潟コンベンションセンター,electronic,female,2名義中2番手 ,,,,,2026-05-29 17:03:38,2026-06-30 23:01:46,2026-06-20 16:01:09,sold,1,10000,"2名義中2番手/ 初期当選/有効期限内の該当名義(変更ボタン有り)

2連×2名義で当選しており、残り1枚です。
すり替えは致しません。
ご希望であれば会員番号...",False,2026-05
ho1k2q9g4c,1780031231681,key-to-lit-arena-tour-2026-neo-classics,2026-07-11,18:00,朱鷺メッセ 新潟コンベンションセンター,electronic,female,3名義中2番手,kr,5.0,,番手QR,2026-05-29 05:07:11,2026-06-30 02:01:34,,deleted,2,15000,"3名義中2番手/全て該当名義/下3桁提示可能/本確対応不可
3名義での入場になります。
集合の際は時間厳守でお願いします。
入場後、チケットを1度回収し、座席選択を行います。
必ず開演前までにチケットをお渡しします。
チケットお渡し時に受取連絡をお願いします。
ご自身での座席選択は出来かねますのでご了承下さい。
本人確認・ランダムエラ－、遅刻、体調不良、出演者変更等、主催者都合の公演中止以外での返金対応はいたしません。
集合時間に遅刻した場合は先に入場いたします。
その際も受け取り連絡はしていただきますのでご了承下さい。
公演中止の場合のみ、手数料を差し引いた金額を返金致します。
デジタルチケットのため、座席に関するクレームは一切受け付けません。
詳しい待ち合わせ時間・場所等は、入金後にお知らせします。
上記全てに同意いただける方のみご購入ください。",True,2026-05
3saq92yzw1,1780192052233,key-to-lit-arena-tour-2026-neo-classics,2026-07-11,18:00,朱鷺メッセ 新潟コンベンションセンター,electronic,female,同行,S,5.0,,ランダム,2026-05-31 01:47:32,2026-06-30 23:01:46,,listing,1,413,"【ランダム配布にご理解ある方のみご購入お願い致します】
同時入場後、ランダムでチケットをお渡しさせて頂きます。
ご自身での座席選択はできかねますのでご了承ください。
・当日、会場時間の45〜30分前に会場周辺にて集合し同時入場致します。
集合場所は連絡ボードにてご連絡させて頂きます。
・チケット持ち逃げ防止のため身分証を一時的にお預かりさせて頂きます。入場後すぐ返却させて頂きます。
・チケットをお渡しすると同時に受け取り評価して頂きます。その場で受け取り評価して頂き、その後チケットをお渡しします。
・遅刻、体調不良、出演者変更、ランダムエラー等、キャンセルはいかなる場合もお受け致しかねます。
公演中止の場合は手数料を引いた差額分を返金させて頂きます。
・入場後解散し、公演の5〜10分前までにはチケットをお渡しさせて頂きます。
その場で受け取り次第受け取り評価をお願い致します。
以上同意していただけた方のみご購入をお願い致します。
公演前はスムーズにご連絡頂きますよう宜しくお願い致します。",True,2026-05
sold_1780119829908,1780119829908,key-to-lit-arena-tour-2026-neo-classics,2026-07-11,18:00,朱鷺メッセ 新潟コンベンションセンター,electronic,female,同行,,,,,2026-05-30 05:43:49,2026-06-30 23:01:46,2026-06-20 16:01:09,sold,2,9500,"3名義中3番手
初期当選/該当名義/下3桁提示可/変更ボタンあり/すり替えなし

3名義中3番手でのお渡しとなります。
入場時に端末をお借りする場合がございます...",False,2026-05
c48iw19gfd,1780128294325,key-to-lit-arena-tour-2026-neo-classics,2026-07-11,18:00,朱鷺メッセ 新潟コンベンションセンター,electronic,female,同行,ゆ,5.0,,番手,2026-05-30 08:04:54,2026-06-30 23:01:46,,listing,2,5500,"3名義中3番手/全て期限内該当名義変更ボタンあり/すり替えなし/下3桁提示可能
当日は会場30分～15分前に会場付近に待ち合わせし、同時入場いたします。
入場後1度チケットを回収し、当方と2番手の方が選ばなかった3番手(5.6枚目)のお渡しになります。
座席未定のため、お席に関するクレームはご遠慮ください。
公演中止の際には、手数料等を差し引いた金額を返金いたします。体調不良やチケットの表示エラー、公共交通機関の遅れ、遅刻、本人確認、出演者不在等の公演中止以外の理由で入場できなかった際の返金はいたしかねます。",True,2026-05
sold_1780031371481,1780031371481,key-to-lit-arena-tour-2026-neo-classics,2026-07-11,18:00,朱鷺メッセ 新潟コンベンションセンター,electronic,female,公演日3日前までにQRコード共有,,,,,2026-05-29 05:09:31,2026-06-30 23:01:46,2026-06-20 16:01:09,sold,2,15000,"初期当選、該当名義‎🤍、すり替えなし、下3桁提示可能
⚠️期限内に支払い番号お渡ししますので払える方のみご購入ください。
公演中止の場合のみ定価分返金します。...",False,2026-05
sold_1780049430593,1780049430593,key-to-lit-arena-tour-2026-neo-classics,2026-07-11,18:00,朱鷺メッセ 新潟コンベンションセンター,electronic,female,2名義中2番手,,,,,2026-05-29 10:10:30,2026-06-30 23:01:46,2026-06-20 16:01:09,sold,2,15000,"2名義中2番手 すり替えなし 下3桁提示可 どちらも該当名義 有効期限内 本人確認対応不可

開場時間10分～15分前頃に会場付近にて待ち合わせ、入場致します。...",False,2026-05
r2wmi53hu5,1780172473415,key-to-lit-arena-tour-2026-neo-classics,2026-07-11,18:00,朱鷺メッセ 新潟コンベンションセンター,electronic,female,同行,ななせ,5.0,,番手,2026-05-30 20:21:13,2026-06-30 23:01:46,,listing,2,7000,"3名義中3番手
全て該当名義/有効期限内/変更ボタン有/すり替えなし/下3桁提示可
当日指定したお時間に集合し、同時入場をしていただきます。
入場の際、QRの表示にご協力いただく場合がございます。入場後チケットを回収し座席確認後、3番手でのお渡しとなります。
公演中止の場合は手数料を引いた金額を返金させていただきますが、中止以外を理由とする返金はいたしかねます。
質問がある場合はご購入前にお願いいたします。
ご購入いただいた場合は上記全てに同意したとみなします。",True,2026-05
sold_1780070570829,1780070570829,key-to-lit-arena-tour-2026-neo-classics,2026-07-11,18:00,朱鷺メッセ 新潟コンベンションセンター,electronic,female,同行,,,,,2026-05-29 16:02:50,2026-06-30 23:01:46,2026-06-20 16:01:09,sold,1,100,"座席未定 ランダム配布 条件あり 座席選択不可 代理購入不可 

 ランダム配布になりますので最後までご理解いただきご購入ください。  

・複数名義所持してお...",False,2026-05
sold_1780045469496,1780045469496,key-to-lit-arena-tour-2026-neo-classics,2026-07-11,18:00,朱鷺メッセ 新潟コンベンションセンター,paper,none,当日手渡し,,,,,2026-05-29 09:04:29,2026-06-30 23:01:46,2026-06-20 16:01:09,sold,2,10000,"【取引にあたり注意事項】
ランダム配布について理解ある方のみ購入お願いします。
入場時、端末をお借りしてQRを表示させていただく場合がございます。その際、持ち逃...",False,2026-05
sold_1780060080780,1780060080780,key-to-lit-arena-tour-2026-neo-classics,2026-07-11,18:00,朱鷺メッセ 新潟コンベンションセンター,electronic,female,公演日3日前までにログイン情報共有,,,,,2026-05-29 13:08:00,2026-06-30 23:01:46,2026-06-20 16:01:09,sold,2,19000,該当名義 / QR毎 / 着ブロ希望なし / 重複すり替えなし / 有効期限内 / 変更ボタン有 / Pay-easy支払い / 下3桁掲示可能 / 公演中止の...,False,2026-05
pzdw1bvow0,1780053816311,key-to-lit-arena-tour-2026-neo-classics,2026-07-11,18:00,朱鷺メッセ 新潟コンベンションセンター,electronic,female,同行,♡,3.8,,ランダム記載あり,2026-05-29 11:23:36,2026-06-30 23:01:46,,listing,1,8000,"FC 初期当選  該当名義 有効期限内 ランダム配布
同時入場後、チケットを一旦回収しお渡ししたチケットで入っていただきます。お席は選べません。
・開場30分前に会場付近で合流できる方でお願い致します。
・当日まで座席未定の為、どこのお席になるかは分かりません。場合によっては別で入場いただく可能性もあります。
・座席に関するクレーム、返金は一切できません。
・連番購入の場合でも入場時のみ分かれて頂く場合があります。
・本人確認、エラー表示、その他いかなるトラブルの場合も返金は致しかねます。
・入場後チケットお渡しまでお時間を頂く場合がございます。
・こちらの指示に問題なく従って頂ける方でお願いします。
・時間厳守でお願いします。遅刻の際は交通遅延、災害等いかなる理由でもご購入者様のご都合でのキャンセルとし、返金は致しかねます。その他いかなる場合でもキャンセルは不可です。
・日本語がわかる方のみご購入お願い致します。
購入者様は上記同意したものとみなします。",True,2026-05
