ticket_id,created_at_unix,event_id,perf_date,perf_time,venue,ticket_type,name_type,delivery_method,seller_name,seller_rating,order_num,ticket_tags,first_observed_at,last_observed_at,sold_at,status,quantity,price,raw_description,details_fetched,year_month
d6fuv4ewxo,1780028066900,key-to-lit-arena-tour-2026-neo-classics,2026-08-23,17:30,有明アリーナ,electronic,none,同行,はる,5.0,,ランダム,2026-05-29 04:14:26,2026-06-30 23:01:46,,listing,1,6800,"複数名義所持のためランダムにて配布致します。購入者様には座席選択権はございません。購入前のコメントは不要です。
※※※必ず全文お読みになった上でご購入ください、購入後のキャンセルは致しかねます※※※
・開場時間の20分前までにお集まりください。時間厳守です。場所は前日までにメッセージにてお知らせいたします。
・同行者登録はこちらで行います。
・代理人購入はお控えください。当日購入者ご本人様以外がいらした際チケットのお渡しはできかねます。その場合も受取通知は行っていただきます。
・入場後全てのチケットを回収しこちらが座席選択したのちにチケットをお渡しします。チケットを選ぶのにお時間を頂く場合がございますがご了承下さい。
・開演までにチケットをお渡しいたします。チケットを受け取ったその場で受取評価を行ってください。
・当日公演中止以外のいかなる場合（体調不良、遅刻(交通機関による遅延を含む)、本人確認によるエラー、発券エラー、出演者変更等）も返金はいたしません。必ず受け取り評価を行っていただきます。
・当日のお取引をスムーズに行うため、購入後はこちらからの連絡を待たずに【①お名前(苗字のみカタカナ)②当日連絡のつく電話番号】の2点を取引連絡にてご連絡ください。
ご購入いただいた時点で上記内容に同意したものとみなします。長くなりましたが以上を守れる成人、日本人女性の方でご購入お願い致します。また全てのことに関してノークレーム・ノーリターンでお願いいたします。",True,2026-05
b8w57xmg92,1780055454679,key-to-lit-arena-tour-2026-neo-classics,2026-08-23,17:30,有明アリーナ,electronic,female,同行,ゆ,5.0,,,2026-05-29 11:50:54,2026-06-30 23:01:46,2026-06-26 14:01:13,sold,2,13000,"情報局先行/座席未定/3名義中3番手どちらも該当名義/重複すり替えなし/有効期限内/すり替えなし/下3桁提示可
公演当日、開演 1時間前から30分前に会場付近にて待ち合わせし、同時入場していただきます。
詳しい待ち合わせ時間・場所等は、ご入金後にマイページの連絡ボードでお知らせします。
お待ち合わせをスムーズに済ませるためにお電話番号をお聞きする場合があります。
入場後、早めにチケットをお渡しできるように致しますが、座席確認のためにお時間を頂く場合があります。
公演中止の際には、送料・仲介手数料を差し引いた金額を返金します。
公演中止以外いかなる理由でも返金致しません。",True,2026-05
jooqm8vbbb,1780030760056,key-to-lit-arena-tour-2026-neo-classics,2026-08-23,17:30,有明アリーナ,electronic,female,同行,にこ,5.0,,同行記載あり,2026-05-29 04:59:20,2026-06-30 23:01:46,,listing,1,8000,"公演当日は待ち合わせ後に同時入場します。
集合時間は開演1時間30分前を予定。集合時間に10分以上遅れた場合入場保証はできません。その場合でも受け取りしていただきますのでお時間に余裕をもってお越し下さい。
複数名義から入場後こちらが先に必要な分席を選びますので、座席にこだわりのある方はご遠慮ください。
座席確認のため入場後一旦解散し、開演10分前までには再度集合しチケットをお渡し致します。チケットお渡し時に受取連絡をお願いします。
入場時チケットの表示にご協力いただく場合がございます。 お連れ様と別々で入場した場合でも連番のチケットをお渡し致します。
主催者側からの公演中止以外の返金対応は致しません。日本語がきちんと理解・話せる女性の方のみご購入ください。
代理購入は不可とさせていただきます。必ず入場する本人のみご購入ください。
同行者登録にご協力していただける方でお願いします。購入後はこちらからの連絡を待たずに、当日連絡の取れる代表者1名のお名前とお電話番号をお送りください。
本人確認、ランダムエラー、当日又は当日までの体調不良、出演者不在などによる購入後のキャンセルや、チケットお渡し後の座席に関するクレーム等での入場後の送金停止も一切対応致しませんのでご了承ください。",True,2026-05
iuda19ruhs,1780026525044,key-to-lit-arena-tour-2026-neo-classics,2026-08-23,17:30,有明アリーナ,electronic,female,前日,ちゃむ、,5.0,,QR,2026-05-29 03:48:45,2026-06-30 23:01:46,2026-06-28 03:01:23,sold,2,26000,"QR毎/初期当選/該当名義/有効期限内/変更ボタンあり/同行者登録可/下3桁提示可/当選歴複数回あり/過去エラーなし/着ブロ希望なし/Pay-easy支払い
1日前に情報をお伝えします
入場後速やかにログアウト受け取り通知してください
日本語が通じる方のみご購入お願いします。
詳しいことはご入金後にマイページの連絡ボードでお知らせします。
公演中止以外、ランダムエラーや遅刻、体調不良、出演者変更、電波障害等如何なる理由で入場が出来なかった場合でも返金いたしませんので、事前にご了承ください。
・座席未定のため、座席に関するクレームは一切受け付けません。
・公演中止の際のみ送料・手数料を差し引いた金額をを返金いたします。",True,2026-05
i5tarmgyej,1780250499118,key-to-lit-arena-tour-2026-neo-classics,2026-10-03,18:00,マリンメッセ福岡 A館,electronic,female,同行,S,5.0,,番手,2026-05-31 18:01:39,2026-06-30 23:01:46,,listing,2,18000,"2名義中2番手/該当/すり替えなし/本人確認対応不可/下三桁提示可能/初期当選/有効期限内/サイチェン可
・当日は開場10分前に会場付近にて待ち合わせの上、同時入場していただきます。
詳しい待ち合わせ場所については公演日前日か当日に連絡ボードにてお知らせ致します。
《注意事項》
・当方が選ばなかった方の席をお渡しします。購入者様は座席をお選びいただけません。
座席のクレーム等も一切お受け致しませんので、ご了承ください。
・席の選定のため、入場からチケットお渡しまでお時間をいただきます。
・公演中止の場合のみ、仲介手数料等を差し引いた金額を返金致します。
その他の体調不良、出演者の変更、ランダムエラーなど如何なる場合でもキャンセル、返金対応致しません。必ず受け取りをしていただきます。
・指定した集合時間より大幅に遅刻される際は待たずに先に入場致します。その場合でも受取連絡はしていただきますので時間厳守でお願いします。",True,2026-05
vz15ijkyxe,1780026766866,key-to-lit-arena-tour-2026-neo-classics,2026-10-03,18:00,マリンメッセ福岡 A館,electronic,female,公演日2日前までにQRコード共有,Y,5.0,,QR,2026-05-29 03:52:46,2026-06-30 23:01:46,,listing,2,30000,"QRごと/該当名義変更ボタン有り/初期当選/有効期限内/すり替えなし重複なし下3桁提示可/着ブロ希望なし/クレカ以外決済
ご購入後、下3桁をお伝えします。
公演日の2日前までに、会員番号とパスワードを連絡ボードにてお送りいたします。同行者登録は購入者様ご自身にてお願いいたします。
座席未定のため、お席に関するクレームは一切受け付けません。体調不良、システムエラ、ランダムエラー、本人確認、交通機関による遅刻、出演者変更等いかなる場合も返金、キャンセル対応は致しかねます。公演中止の場合のみ、送料、手数料を差し引いた金額を返金致します。購入後は全ての内容に同意したものとみなします。",True,2026-05
sold_1780022423974,1780022423974,key-to-lit-arena-tour-2026-neo-classics,2026-10-03,18:00,マリンメッセ福岡 A館,electronic,female,前日までにログイン情報共有,,,,,2026-05-29 02:40:23,2026-06-30 23:01:46,2026-06-20 16:01:09,sold,2,15000,"値下げ可。即1.5/枚
初期当選/QR毎/すり替えなし/下3桁提示可能/該当

公演日前日にログイン情報を共有致します。同行者登録はご購入者様自身でお願い致しま...",False,2026-05
thk0x9qqv0,1780111362550,key-to-lit-arena-tour-2026-neo-classics,2026-10-03,18:00,マリンメッセ福岡 A館,electronic,female,同行,ふん,5.0,,同行,2026-05-30 03:22:42,2026-06-24 07:01:16,,deleted,1,43000,"中村担との連番になります。
同担の方はトラブル防止のため、ご購入お控えください。
・同行者登録お願いします
・本人確認対応可
・公演中止のみ、チケテンの規約に則り返金対応いたします。
・当日の体調不良、買い手様の遅刻等で入場できない場合でも受取をお願いいたします。
・日本人の女性のみご購入ください。
・必ず入場されるご本人様がご購入ください。代理購入不可",True,2026-05
4eolqlyijk,1780026460927,key-to-lit-arena-tour-2026-neo-classics,2026-10-03,18:00,マリンメッセ福岡 A館,electronic,female,同行,まるこ,5.0,,同行,2026-05-29 03:47:40,2026-06-30 23:01:46,,listing,1,35000,"取引成立次第プライベート出品へ切り替えます。
当方(井上担)と同行になります。
同行者登録をお願いいたします。
本人確認対応可。
・公演中止の際のみ、チケテンの規約に則り返金対応いたします。
当日の体調不良、買い手様の遅刻等で入場できない場合でも受取をお願いいたします。
・日本人の女性のみご購入ください。
・必ず入場されるご本人様がご購入ください。代理購入不可。",True,2026-05
sold_1780023600280,1780023600280,key-to-lit-arena-tour-2026-neo-classics,2026-10-03,18:00,マリンメッセ福岡 A館,electronic,female,公演前日までにログイン情報共有,,,,,2026-05-29 03:00:00,2026-06-30 23:01:46,2026-06-20 16:01:09,sold,2,15000,"値下げ可。即1.5/枚
初期当選/QR毎/すり替えなし/下3桁提示可能/該当

公演日前日にログイン情報を共有致します。同行者登録はご購入者様自身でお願い致しま...",False,2026-05
sold_1780028301109,1780028301109,key-to-lit-arena-tour-2026-neo-classics,2026-10-03,18:00,マリンメッセ福岡 A館,electronic,female,少数ランダム,,,,,2026-05-29 04:18:21,2026-06-30 23:01:46,2026-06-20 16:01:09,sold,2,15000,"公演当日、開場15分前に会場付近にて待ち合わせ、同時入場して頂きます。
お連れ様と別れて入場していただく場合がございますが、連番でご購入された際には必ず連番のチ...",False,2026-05
5whv0lkakl,1780047638370,key-to-lit-arena-tour-2026-neo-classics,2026-10-03,18:00,マリンメッセ福岡 A館,electronic,female,同行,T,5.0,,同行番手,2026-05-29 09:40:38,2026-06-30 23:01:46,,listing,2,40000,"5名義中3番手/初期当選/有効期限内/すり替えなし/下3桁提示可/着ブロ希望なし/座席未定
5名義中3番手
ご購入の方はプライベート出品いたしますのでお声がけ下さい。
公演当日は当方が指定する場所、時間に集合していただき同時入場となります。
公演中止以外返金不可
（ランダムエラー、本人確認、通障害、公共交通機関の遅延、体調不良（出演者含む）、その他購入者様都合等、いかなる理由で入場できなかった場合でも返金はいたしかねます）
公演中止以外の理由によるキャンセル、返金請求、送金停止依頼等はお受けできません。
ご購入いただいた時点で、上記内容すべてに同意いただいたものといたします。",True,2026-05
oxds0cxz9u,1780202398958,key-to-lit-arena-tour-2026-neo-classics,2026-10-03,18:00,マリンメッセ福岡 A館,electronic,female,同行,S,5.0,,ランダム,2026-05-31 04:39:58,2026-06-30 23:01:46,,listing,1,6204,"【ランダム配布にご理解ある方のみご購入お願い致します】
同時入場後、ランダムでチケットをお渡しさせて頂きます。
ご自身での座席選択はできかねますのでご了承ください。
・当日、会場時間の45〜30分前に会場周辺にて集合し同時入場致します。
集合場所は連絡ボードにてご連絡させて頂きます。
・チケット持ち逃げ防止のため身分証を一時的にお預かりさせて頂きます。入場後すぐ返却させて頂きます。
・チケットをお渡しすると同時に受け取り評価して頂きます。その場で受け取り評価して頂き、その後チケットをお渡しします。
・遅刻、体調不良、出演者変更、ランダムエラー等、キャンセルはいかなる場合もお受け致しかねます。
公演中止の場合は手数料を引いた差額分を返金させて頂きます。
・入場後解散し、公演の5〜10分前までにはチケットをお渡しさせて頂きます。
その場で受け取り次第受け取り評価をお願い致します。
以上同意していただけた方のみご購入をお願い致します。
公演前はスムーズにご連絡頂きますよう宜しくお願い致します。",True,2026-05
by34zyruuf,1780219509082,key-to-lit-arena-tour-2026-neo-classics,2026-10-03,18:00,マリンメッセ福岡 A館,electronic,female,7名義中4番手,あ,5.0,,番手,2026-05-31 09:25:09,2026-06-30 23:01:46,,listing,2,30000,"7名義中4番手
全て該当名義/有効期限内／変更ボタン有/すり替えなし/下3桁提示可
・当日は開場時間の45分前頃を目安に集合をお願いいたします。
・2連でご購入いただいた場合でも、入場時は同行者様と別れてご入場いただく可能性がございます。
・チケットは必ず2連でお渡しします
・入場時に身分証を預かる場合がございます。必ずご持参ください。その際は責任をもって管理し、ご入場後、チケットのお渡し時（サイト通しの方は受取評価等のお取引完了後）に速やかに返却いたします。
・入場時の発券のため、端末を一時的にお借りする場合がございますので、あらかじめご了承ください。
・チケットお渡し後は、サイチェン等ご自由に行っていただいて構いません。
・公演中止の場合を除き、ご連絡なしの遅刻、大幅な遅刻、交通機関の遅延、体調不良、ランダムエラー等、いかなる理由であっても返金・キャンセルはお受けできません。
ご購入いただいた場合は上記全てに同意したとみなします。",True,2026-05
g46p1ps5dh,1780047582824,key-to-lit-arena-tour-2026-neo-classics,2026-10-03,18:00,マリンメッセ福岡 A館,electronic,female,同行,T,5.0,,同行番手,2026-05-29 09:39:42,2026-06-30 23:01:46,,listing,2,20000,"5名義中4番手/初期当選/有効期限内/すり替えなし/下3桁提示可/着ブロ希望なし/座席未定
5名義中4番手
ご購入の方はプライベート出品いたしますのでお声がけ下さい。
公演当日は当方が指定する場所、時間に集合していただき同時入場となります。
公演中止以外返金不可
（ランダムエラー、本人確認、通障害、公共交通機関の遅延、体調不良（出演者含む）、その他購入者様都合等、いかなる理由で入場できなかった場合でも返金はいたしかねます）
公演中止以外の理由によるキャンセル、返金請求、送金停止依頼等はお受けできません。
ご購入いただいた時点で、上記内容すべてに同意いただいたものといたします。",True,2026-05
sold_1780028540951,1780028540951,key-to-lit-arena-tour-2026-neo-classics,2026-10-03,18:00,マリンメッセ福岡 A館,electronic,female,公演日1日前までにログイン情報をお伝えいたします。,,,,,2026-05-29 04:22:20,2026-06-30 23:01:46,2026-06-20 16:01:09,sold,2,28000,"QRごと/該当名義/変更ボタンあり/初期当選/有効期限内/下3桁提示可能/発送物戻りなし/すりかえなし/着ブロ希望なし/Pay-easy決済

・公演前日までに...",False,2026-05
4i9cy48fs9,1780072859440,key-to-lit-arena-tour-2026-neo-classics,2026-10-03,18:00,マリンメッセ福岡 A館,electronic,female,同行,mm,5.0,,ランダム,2026-05-29 16:40:59,2026-06-30 23:01:46,,listing,1,6205,"座席未定 ランダム配布 条件あり 座席選択不可 代理購入不可
ランダム配布になりますので最後までご理解いただきご購入ください。
・複数名義所持しておりますので、同時入場後チケットを一旦回収し解散した後、座席選択後にランダムでチケットをお渡しします。買い手様は座席をお選び頂けません。座席選択にお時間を頂きますので配布を急がれる方はご遠慮ください。公演開始までにはチケットをお渡しさせて頂きます。当日はこちらの指示に従ってご対応お願いいたします。チケットを受け取り後は速やかに受取通知をお願い致します。
・お席のクレームは一切お受け出来ません。
・公演当日は開場時間の30-45分前に会場周辺で集合を予定しております。待ち合わせ時間、場所の詳細については、ご入金後にマイページの連絡ボードでお知らせします。 10分以上遅刻される場合は待たずに入場しますが、受取通知はして頂きますので、お時間に余裕を持ってお越しください。
・入場時に端末をお借りする可能性がございます。 入場の際にお連れ様と分かれて頂く可能性がございますがチケットは連番でお渡しさせて頂きます。 この際チケット持ち逃げ防止のために身分証を一度お借りさせていただきます。尚、問題がなければ、こちらが身分証の内容を確認することはなく、チケット回収と同時に返却致します。
・チケットをお渡しすると同時に受け取り評価して頂きます。その場で受け取り評価して頂き、その後チケットをお渡しします。
・ランダムエラー、本人確認の理由での入場が出来なかった場合の返金は対応出来ません。買い手様の都合(体調不良、遅刻、メンバーの不在等)でのキャンセルも対応は出来かねます。
・入場管理のため落札後、連絡ボードにて名字とお電話番号をお伺いします。
・トラブル防止のため、デジチケやランダムチケットのお取引に不慣れな方は購入をお控えください。
・以上のことをご理解頂ける、日本語が通じる成人女性のみご購入お願い致します。
メッセージいただければ、プライベート出品での対応も可能です。",True,2026-05
talpqjy6z2,1780029816294,key-to-lit-arena-tour-2026-neo-classics,2026-10-03,18:00,マリンメッセ福岡 A館,electronic,female,指定席のみランダム配布,ねこ,5.0,,ランダム,2026-05-29 04:43:36,2026-06-30 23:01:46,,listing,2,10000,"ランダム配布ご理解いただける方のみご購入お願いします。初めての方も最後まで丁寧に対応いたします。
5名義以内での入場になります。開場~30分前に会場付近に集合予定。時間厳守でお願いします。入場後、チケットを1度回収し、座席選択を行います。必ず開演前までにチケットをお渡しします。チケットお渡し時に受取連絡をお願いします。ご自身での座席選択は出来かねますのでご了承下さい。本人確認やランダムエラ－、遅刻、検温、体調不良、出演者変更等、主催者都合の公演中止以外での返金対応はいたしません。集合時間に遅刻した場合は先に入場いたします。その際も受け取り連絡はしていただきますのでご了承下さい。
公演中止の場合のみ、手数料を差し引いた金額を返金致します。デジタルチケットのため、座席に関するクレームは一切受け付けません。
詳しい待ち合わせ時間・場所等は、入金後にお知らせします。",True,2026-05
t07ho38fs2,1780154592812,key-to-lit-arena-tour-2026-neo-classics,2026-10-03,18:00,マリンメッセ福岡 A館,electronic,female,3名義中2番手,MK,5.0,,同行,2026-05-30 15:23:12,2026-06-30 23:01:46,,listing,2,18000,"3名義中2番手/該当/有効期限内/ご希望の場合下3桁提示可。
公演当日、会場付近にて待ち合わせし、同時入場していただきます。詳しい待ち合わせ時間・場所等は、前日にお知らせします。
当日、持ち逃げ防止のため受取確認まで身分証お預かりいたします。目の前で封をし受取と同時にそのまま返却いたします。
チケットお渡し後はその場で速やかに受取確認をしていただきます。
体調不良・本人確認・ランダムエラー・一部メンバーの出演見合わせ等の公演中止以外の如何なる理由でも返金はいたしかねます。
座席に関するクレームは一切受け付けません。
日本人女性、上記全てにご理解いただける方のみご購入をお願いいたします。",True,2026-05
odhtlmw4lh,1780039285185,key-to-lit-arena-tour-2026-neo-classics,2026-10-03,18:00,マリンメッセ福岡 A館,paper,female,同行,にゃん,5.0,,番手,2026-05-29 07:21:25,2026-06-30 23:01:46,,listing,2,14000,"2名義中2番手/ 該当名義/有効期限内/本確対応可🌟/下3桁提示可能/着ブロ指定なし
公演中止の際は手数料を差し引いた金額を返金致しますが、それ以外の如何なる理由（体調不良、本人確認、ランダムエラー、交通機関の遅延等）であっても返金致しませんのでご了承ください。
ご購入頂いた時点で上記に同意となり、送金停止や、返金要求受け付けません。その場合も、速やかに受け取り通知お願い致します。
入場後は開演前に、受け取り通知を速やかにお願い致します。",True,2026-05
rnw5xqb11o,1780056084027,key-to-lit-arena-tour-2026-neo-classics,2026-10-03,18:00,マリンメッセ福岡 A館,electronic,female,同行,♡,3.8,,ランダム記載あり,2026-05-29 12:01:24,2026-06-30 23:01:46,,listing,1,8000,"FC 初期当選  該当名義 有効期限内 ランダム配布
同時入場後、チケットを一旦回収しお渡ししたチケットで入っていただきます。お席は選べません。
・開場30分前に会場付近で合流できる方でお願い致します。
・当日まで座席未定の為、どこのお席になるかは分かりません。場合によっては別で入場いただく可能性もあります。
・座席に関するクレーム、返金は一切できません。
・連番購入の場合でも入場時のみ分かれて頂く場合があります。
・本人確認、エラー表示、その他いかなるトラブルの場合も返金は致しかねます。
・入場後チケットお渡しまでお時間を頂く場合がございます。
・こちらの指示に問題なく従って頂ける方でお願いします。
・時間厳守でお願いします。遅刻の際は交通遅延、災害等いかなる理由でもご購入者様のご都合でのキャンセルとし、返金は致しかねます。その他いかなる場合でもキャンセルは不可です。
・日本語がわかる方のみご購入お願い致します。
購入者様は上記同意したものとみなします。",True,2026-05
