ticket_id,created_at_unix,event_id,perf_date,perf_time,venue,ticket_type,name_type,delivery_method,seller_name,seller_rating,order_num,ticket_tags,first_observed_at,last_observed_at,sold_at,status,quantity,price,raw_description,details_fetched,year_month
g71jfgma1e,1782867765665,key-to-lit-arena-tour-2026-neo-classics,2026-07-11,18:00,朱鷺メッセ 新潟コンベンションセンター,electronic,female,同時入場,ふわ,5.0,,番手,2026-07-01 01:02:45,2026-07-01 01:01:42,,listing,2,5000,"4名義中4番手/すり替えなし/下三桁提示可/有効期限内該当名義/変更ボタン有/サイチェン可
・公演当日開場時間15〜30分前を目安に会場付近にて待ち合わせ予定です。詳細は決まり次第ご連絡致します。
・同時入場後一度チケットを回収し、当方が座席を選んだ後4番目にチケットをお渡し致します。
・チケットを受け取り次第その場で受取確認をお願い致します。
・入場時、持ち逃げ防止の為一時的に身分証をお預かりする可能性がございます。その場合チケット回収時にチケットと引き換えにご返却致します。
・公演中止の場合のみ手数料を差し引いた金額を返金致します。
公演中止以外如何なる理由も返金不可です。",True,2026-07
d384ymbz3g,1782865019685,key-to-lit-arena-tour-2026-neo-classics,2026-08-02,17:30,GLION ARENA KOBE,electronic,female,当日,ぷ,5.0,,ランダム,2026-07-01 00:16:59,2026-07-01 01:01:42,,listing,1,5000,"⚠️複数枚所持しております。購入の際はメッセージください。プラベ出品にします。
・当日指定の時間に会場にて集合していただきます。10分以上の遅刻は待たずに入場、受け取り評価のみしていただきます。
・全員で同時入場し、1度こちらで全てのチケットを回収、座席選択させていただきます。チケットお渡しまでにお時間頂く場合がございますが、ご購入者様が開演時間に着席できるようにお渡し致します。
・日本人の女性・男性のみ購入可能です。トラブル防止のため、外国人の方・日本語が通じない方の購入、並びに代理購入は御遠慮ください。
⚠️男性の方は一度メッセージで教えていただきたいです。
・チケットお渡しする際に、速やかに受け取り評価お願い致します。
・同行者登録にご協力いただく場合がございます。
・遅刻・体調不良、メンバー不在等の公演中止以外のいかなる場合でも返金は致しません。買い手様都合で当日お越しいただけない場合、こちらで代理の方を探しますので速やかに受け取り評価のみお願いいたします。
・ランダムでのお渡しになるため、ご購入者の方に座席選択権はございません。また座席に関するクレームは一切受け付けておりません。
・入場時のランダムエラーや本人確認等で入場ができなかった際の補償は致しかねます。
・持ち逃げ防止のため、入場の際に一時的に身分証をお預かりさせて頂く場合がございますが、入場後チケットと引き換えにてお返しさせて頂きます。
・チケット受け渡しのためご購入者様のお名前とお電話番号をお伺いする場合がございます。
・黒服の警備状況によりLINEの交換をしていただく場合があります。
その場合グルチャ作成をさせていただくので柔軟にご対応お願いいたします。
上記の内容にご承知いただき、ご購入お願いいたします。",True,2026-07
9wmde4kczy,1782865470927,key-to-lit-arena-tour-2026-neo-classics,2026-08-21,18:00,有明アリーナ,paper,female,当日手渡し,あ,5.0,,番手,2026-07-01 00:24:30,2026-07-01 01:01:42,,listing,2,30000,"4名義中2番手
すり替え無し/下3桁掲示可/該当/初期当選
公演中止以外キャンセル不可",True,2026-07
