ticket_id,created_at_unix,event_id,perf_date,perf_time,venue,ticket_type,name_type,delivery_method,seller_name,seller_rating,order_num,ticket_tags,first_observed_at,last_observed_at,sold_at,status,quantity,price,raw_description,details_fetched,year_month
kh1dxnrk4x,1782873731581,naniwa-danshi-nd5,2026-07-19,17:30,マリンメッセ福岡A館,electronic,female,公演2日前にログイン情報共有,ca,5.0,,QR,2026-07-01 02:42:11,2026-07-01 07:01:43,,deleted,1,62048,,True,2026-07
ob4bgvrx6w,1782877951240,naniwa-danshi-nd5,2026-07-11,18:00,[北海道] 北海道立総合体育センター（北海きたえーる）,electronic,female,同行,ゆ,5.0,,同行,2026-07-01 03:52:31,2026-07-01 21:01:47,,listing,1,60000,"2連中1枚
当方との同行です。
大西担不可
初期当選/すり替えなし/下3桁提示可/重複なし/着ブロ指定なし/FC×FC/同一クレカ支払い無し/発送物戻り無し/最終当選歴ポプモ天井席
当日は開演1時間15分前を目安に集合し、同時入場いたします。
連番内の座席は当方が先に選びますのでご了承ください。
半券お渡し後は自由にサイチェン等していただいて構いません。
ランダムエラーや本人確認、交通機関の遅延や体調不良、メンバー不在などいかなる場合もキャンセル、返金はできかねます。
公演中止の場合に限り全額返金いたします。
日本語のわかる成人済みの女性のみ申請をお願いいたします。",True,2026-07
5nq71i6gl5,1782877392407,naniwa-danshi-nd5,2026-08-05,18:00,横浜アリーナ,electronic,female,前日までにログイン情報提示,NUTS,5.0,,QR,2026-07-01 03:43:12,2026-07-01 21:01:47,,listing,2,67000,"FC先行/重複すり替えなし/QRごとお譲り/下3桁提示可能/クレカ払いなし
・公演前日にログイン情報の方お伝えいたします。ご自身の端末でログインの上ご入場ください。
・入場後は速やかなログアウト、受け取り連絡をお願いいたします。
・お席のクレームは一切お受けできません。
・盗撮や録音などのマナー違反行為はNGです。
・公演中止の場合のみ手数料分を引いた全額を返金いたします。
・遅刻、体調不良、本人確認、システムエラーなどでご入場いただけなかった場合も返金対応致しかねますので、ご了承ください。
購入後は上記の全てに同意したものとみなしますので、ご理解いただける方のみご購入お願いいたします。",True,2026-07
sys68iupsa,1782880824005,naniwa-danshi-nd5,2026-07-11,18:00,[北海道] 北海道立総合体育センター（北海きたえーる）,electronic,female,同行,K,5.0,,番手,2026-07-01 04:40:24,2026-07-01 21:01:47,,listing,2,53000,"初期当選×2/有効期限内名義/下3桁提示可能/すり替えなし/着ブロ希望なし/
2連2番手でのお譲りになります。
公演当日こちらが指定した時間に会場付近にて待ち合わせのうえ、同時入場していただきます。お連れ様と別れて入場していただきますがチケットは2連でお渡しします。
入場後、一度チケットを回収し座席選択させていただきます。座席を選ぶ為少々お時間をいただきます。
チケットお渡し後その場で受取連絡をお願いします。
体調不良、交通トラブル、メンバーの欠員、ランダムエラー等その他いかなる場合でも返金、キャンセル対応はいたしません。入場できなかった場合でも受取連絡はしていただきます。
公演中止の場合のみ手数料を差し引いた金額を返金致します。
チケット、座席についてのクレームは一切受け付けません。
トラブル防止のため、日本語での円滑なやり取り可能な方のみご購入をお願い致します。代理での落札や入場等もご遠慮ください。
プライベート出品に変更しますのでお手数ですが購入前にコメントお願い致します🙇🏻‍♀️",True,2026-07
tfz7vuwz21,1782880442992,naniwa-danshi-nd5,2026-07-19,17:30,マリンメッセ福岡A館,electronic,female,公演前日にログイン情報共有,♡,5.0,,QR,2026-07-01 04:34:02,2026-07-01 21:01:47,,listing,2,65000,"初期当選/座席未定/下3桁提示可能/有効期限内名義/重複・すり替えなし/着ブロ希望なし/郵便物戻りなし
公演日前日にログイン情報をメッセージにて提示します。QR毎のお譲りですので、入場後に速やかに受け取り評価をお願いします。
なお、座席に関するクレーム・キャンセル等は一切お受けできかねますので、あらかじめご了承ください。
また、ランダムエラー・本人確認・交通機関の遅延・出演者変更など、いかなる理由におきましても返金・キャンセル対応はいたしかねます。公演中止の場合のみ、送料・手数料を差し引いた分を返金いたします。
同意チェックは買い手様でお願いします。
ご購入いただいた時点で上記内容全てにご同意いただいたものとみなします。
何かございましたらメッセージお願いします。",True,2026-07
sold_1782879467328,1782879467328,naniwa-danshi-nd5,2026-08-15,18:00,セキスイハイムスーパーアリーナ,electronic,female,公演日前日までにログイン情報お伝えします,,,,,2026-07-01 04:17:47,2026-07-01 21:01:47,2026-07-01 05:01:39,sold,2,55000,"QR毎/FC先行/座席未定/復活当選/着ブロなし/重複すり替えなし/郵便物戻り無し/下3桁提示可

同行者登録はご自身でお願いします。入場後は速やかにログアウト...",False,2026-07
90zfsdv57t,1782883652393,naniwa-danshi-nd5,2026-07-28,18:00,大阪城ホール,electronic,female,同行,❤︎Y,5.0,,同行,2026-07-01 05:27:32,2026-07-01 21:01:47,,listing,1,84000,"座席未定　QRごと　下3桁提示可能　Pay-easy支払い　有効期限内名義　初期当選　着ブロ指定なし　発送物戻りなし
前回、前々回共にスタンド名義。
当方と同行になります。
すり替え、重複無し。
2連×1名義当選です。
ご入金後、会員番号の下3桁ご連絡可能です。
当日は開場の15〜30分位前に会場付近待ち合わせ後、同時入場して頂きます。時間に余裕がある方のみご購入願います。
・時間厳守出来る方
・日本国籍の20歳以上の女性の方
・盗撮等の迷惑行為を絶対にしない方
・サイドチェンジ不可
・速やかに受取連絡して頂ける方
・2連中のお席はこちらで選ばせて頂きます。
・指定した時間に遅刻の際は理由にかかわらず先に入場する場合がありますがその際でも受取連絡はして頂きます。
＊当日の体調不良、出演者の変更があった場合でもキャンセルはお受け出来ません。また遅刻、各種エラー、本人確認等で入場出来なかった場合でも受取連絡して頂きます。
プラベル出品に切り替えますので購入前にコメントお願い致します。",True,2026-07
sold_1782885844251,1782885844251,naniwa-danshi-nd5,2026-07-11,13:30,[北海道] 北海道立総合体育センター（北海きたえーる）,electronic,female,同行,,,,,2026-07-01 06:04:04,2026-07-01 21:01:47,2026-07-01 07:01:43,sold,2,10342,☆様専用,False,2026-07
ojnowdfatg,1782889125098,naniwa-danshi-nd5,2026-07-11,13:30,[北海道] 北海道立総合体育センター（北海きたえーる）,electronic,female,公演前日にログイン情報お伝え,あ,5.0,,QR,2026-07-01 06:58:45,2026-07-01 21:01:47,,listing,1,71355,"本人確認対応不可/下3桁提示可/有効期限内名義
前日20時までにマイページにてログイン情報をお送りします。当日入場されましたら速やかにログアウト+受け取り確認を行ってください。
公演中止以外いかなる理由でもキャンセル・返金対応は致しかねます。",True,2026-07
sold_1782873731581,1782873731581,naniwa-danshi-nd5,2026-07-19,17:30,マリンメッセ福岡A館,electronic,female,公演2日前にログイン情報共有,,,,,2026-07-01 02:42:11,2026-07-01 21:01:47,2026-07-01 07:01:43,sold,1,60000,,False,2026-07
lp3z4nlh7z,1782892431096,naniwa-danshi-nd5,2026-07-11,13:30,[北海道] 北海道立総合体育センター（北海きたえーる）,electronic,none,公演日1日前までにQRコード共有,た,4.9,,QR,2026-07-01 07:53:51,2026-07-01 21:01:47,,listing,2,60000,"QRコードごと 有効期限内 買い手様の方で同行者登録をお願いします
プライベート出品させていただきますので購入前にメッセージをお願いします",True,2026-07
7r673suhxq,1782892593077,naniwa-danshi-nd5,2026-07-11,18:00,[北海道] 北海道立総合体育センター（北海きたえーる）,electronic,none,公演日1日前までにQRコード共有,た,4.9,,QR,2026-07-01 07:56:33,2026-07-01 10:01:41,,deleted,2,47000,"QRコードごと 有効期限内 買い手様の方で同行者登録をお願いします
プライベート出品させていただきますので購入前にメッセージをお願いします",True,2026-07
1k7r7d66qq,1782892029703,naniwa-danshi-nd5,2026-07-19,17:30,マリンメッセ福岡A館,electronic,female,同時入場,M,5.0,,番手,2026-07-01 07:47:09,2026-07-01 21:01:47,,listing,2,45000,"3名義中3番手/着ブロ希望なし / 下3桁提示可能/すり替えなし
3名義のうち3番手のチケットをお渡し致します。
3名義分の下3桁の提示可能です。
また、3名義とも発送物の戻りはありません。
公演当日、こちらの指定した時間、集合場所にて待ち合わせのうえ、同時入場させていただきます。待ち合わせ時間厳守でお願致します。時間に余裕をもって集合していただくようお願いいたします。
デジタルチケットのため、お座席に関するクレーム・キャンセル・返金には一切対応いたしかねます。トラブル防止のため、代理購入はご遠慮ください。
買い手様の体調不良・交通機関の乱れ・天候不良・メンバー欠員等、公演中止以外のいかなる場合においても返金いたしませんのでご了承ください。",True,2026-07
p5tj7nteyd,1782893267488,naniwa-danshi-nd5,2026-07-11,13:30,[北海道] 北海道立総合体育センター（北海きたえーる）,electronic,female,同行,♡,5.0,,ランダム,2026-07-01 08:07:47,2026-07-01 21:01:47,,listing,1,22000,"ランダム配布
中相場買取可
開場30分前に会場入場口付近にて待ち合わせを予定しております。また詳細なお時間や待ち合わせ場所につきましては、当日の朝までに改めてご連絡致します。
お譲りさせていただくものは『ランダム配布』になります。座席はお選びいただけません。
同時入場後一旦解散いただき、座席確定次第再度指定の場所にお集まりいただきチケットをお渡しします。開演5~15分前までにはお渡ししますので、「まだですか？」など催促のご連絡、お電話はお控えください。
チケットお渡し後はサイドチェンジ等お好きにしていただいて構いません。また、当方の引いた席を相場で買取頂くことも可能です。
当日、チケットお渡しした際に受け取り通知をお願いいたします。
また大変恐れ入りますが、ドタキャンや大幅な遅刻、ランダムエラー、本人確認等で入場できない場合など、公演中止以外での返金対応は一切致しかねますのでご了承お願いいたします。",True,2026-07
ovggqfo2hj,1782893326513,naniwa-danshi-nd5,2026-07-12,14:00,[北海道] 北海道立総合体育センター（北海きたえーる）,electronic,female,同行,♡,5.0,,ランダム,2026-07-01 08:08:46,2026-07-01 21:01:47,,listing,1,22000,"ランダム配布
中相場買取可
開場30分前に会場入場口付近にて待ち合わせを予定しております。また詳細なお時間や待ち合わせ場所につきましては、当日の朝までに改めてご連絡致します。
お譲りさせていただくものは『ランダム配布』になります。座席はお選びいただけません。
同時入場後一旦解散いただき、座席確定次第再度指定の場所にお集まりいただきチケットをお渡しします。開演5~15分前までにはお渡ししますので、「まだですか？」など催促のご連絡、お電話はお控えください。
チケットお渡し後はサイドチェンジ等お好きにしていただいて構いません。また、当方の引いた席を相場で買取頂くことも可能です。
当日、チケットお渡しした際に受け取り通知をお願いいたします。
また大変恐れ入りますが、ドタキャンや大幅な遅刻、ランダムエラー、本人確認等で入場できない場合など、公演中止以外での返金対応は一切致しかねますのでご了承お願いいたします。",True,2026-07
aa0ptdfgsb,1782893376536,naniwa-danshi-nd5,2026-08-07,18:00,横浜アリーナ,electronic,female,2名義中2番手,M,5.0,,番手,2026-07-01 08:09:36,2026-07-01 18:01:40,,deleted,2,15000,"+当日手渡し分4.0/枚
2名義中2番手/初期当選/下3桁提示可/すり替えなし/サイチェン可/有効期限内/FC×FC
公演当日、開場時間前（15分前）に会場付近にて待ち合わせをし、当方と同時入場していただきます。遅刻された場合は待たずに入場いたしますが、その場合でも受取評価はしていただきます。ご了承の上、ご購入よろしくお願いいたします。
詳しい待ち合わせ場所は、公演日前日までに取引メッセージにてお伝えいたします。
合流できたらその際に手渡し分の代金を頂戴いたします。サイト通し分は、チケットをお渡しした際に受取評価をお願いいたします。
当日入場時のみお連れ様と分かれてご入場いただきますが、必ず連番のチケットをお渡しいたします。
入場後、座席を選ぶために少々お時間いただく場合がございますが、すり替えはいたしません。
当方が座席選択後、選ばなかったほうのチケットをお渡しいたしますので、その際に受取評価をお願いしたします。
公演中止の場合以外は、必ず受取評価をしていただきます。公演中止の場合のみ手数料を引いたチケット代を返金させていただきます。
上記の内容をすべてご理解いただいた上で、日本語の通じる女性のみご購入をお願いいたします。",True,2026-07
uqzpad2r2h,1782899228990,naniwa-danshi-nd5,2026-07-19,17:30,マリンメッセ福岡A館,electronic,female,開演時間までにログイン情報お渡し,あ,5.0,,QR,2026-07-01 09:47:08,2026-07-01 12:01:41,,deleted,1,57000,"初期当選/すり替えなし/下3桁提示可/有効期限内/過去エラー無し/サイチェン可/
アルファ、ボンボヤスタンド名義
トラブルの元になりかねますので、ご購入は成人済みの日本人女性に限定させていただきます。
また、座席に関するクレームはご遠慮ください。
公演中止以外のいかなる場合でも返金対応は致しません。
上記全てご了承の上、ご購入下さい。",True,2026-07
sold_1782899228990,1782899228990,naniwa-danshi-nd5,2026-07-19,17:30,マリンメッセ福岡A館,electronic,female,公演日当日ログイン情報共有,,,,,2026-07-01 09:47:08,2026-07-01 21:01:47,2026-07-01 12:01:41,sold,1,55000,"初期当選/すり替えなし/下3桁提示可/有効期限内/過去エラー無し/サイチェン可/
アルファ、ボンボヤスタンド名義

トラブルの元になりかねますので、ご購入は成人...",False,2026-07
sfx6b466gv,1782909622262,naniwa-danshi-nd5,2026-07-11,18:00,[北海道] 北海道立総合体育センター（北海きたえーる）,electronic,female,同時入場,にだ,5.0,,番手,2026-07-01 12:40:22,2026-07-01 21:01:47,,listing,2,50000,"3名義中2番手/すり替えなし/下3桁提示可/FC先行/3名義全て初期当選/有効期限内名義/郵送物戻りなし/コンビニ決済/着ブロなし/プライベート出品可能
公演当日開場10分前頃に会場付近で集合し同時入場していただきます。
詳しい場所や時間は前日にお伝えします。
入場後一度チケットを回収し座席を選ばせていただきます。
座席選択にお時間いただく可能性がございます。
当方が座席を選択した後チケットをお渡しし、受け取り通知をしていただき解散とします。
解散後はご自由にしていただいてかまいません。
ランダムエラー、交通事情、大幅な遅刻、体調不良、自担が出演しないなどの理由での返金・キャンセルは致しかねます。
その場合でも受け取り通知はしていただきますのでよろしくお願いいたします。
また、座席に関するクレームはお受けできません。
公演中止の場合のみ手数料を引いた金額を返金させていただきます。
上記ご了承いただけた方は購入をお願いいたします。",True,2026-07
8ywsb8psue,1782912358217,naniwa-danshi-nd5,2026-07-11,13:30,[北海道] 北海道立総合体育センター（北海きたえーる）,electronic,female,番手,おこめ,5.0,,番手,2026-07-01 13:25:58,2026-07-01 21:01:47,,listing,2,40000,"FC先行/座席未定/番手/初期当選/復活当選含む/有効期限内名義
3名義中3番手になります。",True,2026-07
pxin1w7dd1,1782914550359,naniwa-danshi-nd5,2026-07-11,18:00,[北海道] 北海道立総合体育センター（北海きたえーる）,electronic,female,同行,かずらぶ,5.0,,同行,2026-07-01 14:02:30,2026-07-01 21:01:47,,listing,1,21800,"ランダム配布
入場後1度チケットを回収させていただきます。
入場後チケットお渡しまでの時間会場内でお待ち頂きますが、必ず開演時間までにはお渡しいたします。
半券受取り後ご確認頂けましたら、その場で受取通知をお願い致します。
買い手様による座席選択の権利はございません。座席に関するクレーム等一切お受けいたしません。
当日の体調不良・大幅な遅刻・ランダムエラー・本人確認等の公演中止以外の場合の返金は一切致しかねます。
開場20分前を目安に会場付近にて集合を予定しております。詳しい待ち合わせ時間・場所は前日までに連絡ボードにてお伝えします。
公演当日集合時間に柔軟に対応できる方、公演日前日と当日はこまめに連絡を取れる方のみでお願いします。
以上の内容に全てご了承頂ける日本人女性のみご購入お願いいたします。",True,2026-07
8xrmbasii0,1782912613521,naniwa-danshi-nd5,2026-07-12,14:00,[北海道] 北海道立総合体育センター（北海きたえーる）,electronic,female,同行,きょへニャン,5.0,,同行番手,2026-07-01 13:30:13,2026-07-01 21:01:47,,listing,1,32000,,True,2026-07
9mviv0o7e9,1782913653749,naniwa-danshi-nd5,2026-07-18,13:30,マリンメッセ福岡A館,electronic,female,2名義中2番手,こまめ,5.0,,番手,2026-07-01 13:47:33,2026-07-01 18:01:40,,deleted,2,10350,"2名義中2番手／初期当選/有効期限内/下3桁提示可/サイチェン可
即5.5（サイト1＋手数料、残り4.5当日手渡し）
※プライベート出品に切り替えますので、購入前にコメントをお願いします。
〇当日連絡が取りやすいように電話番号のご提示をお願いしております。
•チケット持ち逃げ防止のため、身分証をお預かりする場合がございます。お借りした身分証はその場で封筒に入れ、トラブルがない限り拝見することはございません。
•発券後1度チケットを回収させていただき、こちらが座席選択後に残りのチケットをお渡しいたします。
チケット受け取り次第その場で受け取り連絡をお願いいたします。
•大幅な遅刻をされた場合、先に入場させていただきますが、受取連絡していただきます。
・トラブル防止のため、代理購入不可。
日本人女性でコミュニケーションの取れる方のみ購入お願いいたします。
・遅刻や欠席、ランダムエラー、場内での本確など買い手様都合での返金は対応いたしません。公演中止の場合のみ返金対応致します。
・集合場所等は当日メッセージボードにてご連絡させていただきます。",True,2026-07
vehaece4s4,1782915267758,naniwa-danshi-nd5,2026-07-11,18:00,[北海道] 北海道立総合体育センター（北海きたえーる）,electronic,female,番手,おこめ,5.0,,番手,2026-07-01 14:14:27,2026-07-01 21:01:47,,listing,2,42000,"2名義中2番手のお譲りになります。
初期当選×②/下3桁提示可/
有効期限内/発送物戻りなし/すり替えなし
会場付近にて開場10〜15分前に集合いただき、同時入場予定となります。
※集合についての詳細は前日もしくは当日にご連絡いたします。
※時間厳守でお願いいたします。
入場後は座席確認を行うため、1度チケットを回収いたします。チケットをお渡しするまでには少しお時間をいただく場合がございます。
お座席によるクレームは一切受付致しかねます。
体調不良・公共交通機関の遅延・ランダムエラー・本人確認等 如何なる場合でも返金対応出来かねますので予めご了承ください。
よろしくお願いいたします。",True,2026-07
nq13khkp3m,1782918072943,naniwa-danshi-nd5,2026-07-19,13:00,マリンメッセ福岡A館,electronic,female,QRコード共有,みじゅまる,5.0,,QR,2026-07-01 15:01:12,2026-07-01 16:01:42,,deleted,2,0,初期当選/有効期限内/すり替え重複なし,True,2026-07
l0zc6e4xoy,1782920004531,naniwa-danshi-nd5,2026-07-12,14:00,[北海道] 北海道立総合体育センター（北海きたえーる）,electronic,female,同時入場,a,5.0,,番手,2026-07-01 15:33:24,2026-07-01 21:01:47,,listing,2,50000,"2名義中2番手サイチェン可
すり替えなし 下3桁提示可能有効期限内
プライベート出品致しますので、ご購入希望の方は必ず購入前にメッセージをお願い致します。
日会場付近にて待ち合わせし、同時入場お願い致します。
待ち合せ時間、待ち合せ場所の詳細は公演当日までに取引メッセージにてご連絡させていただきます。
入場後は一度チケットを回収し、選ばなかったチケットをお渡しさせていただきます。
お渡し後、速やかに受取評価をお願いします。
座席確認のためお時間いただく可能性もございますが、入場からチケット受け渡しまでできる限り迅速に対応させていただきます。
当日は時間厳守で集合
出演者変更、入場時のランダムエラー、本人確認、交通機関の遅延、体調不良、座席などへのクレームでの返金は一切致しかねます。代表者として入場していただく可能性がございます。
ご購入者様の端末をお借りしてログインさせていただく場合もございますのでご承知ください。
公演中止以外ではいかなる理由でもキャンセル、返金は承れません、必ず受取評価をお願いします。",True,2026-07
vgt5u12a5h,1782919228136,naniwa-danshi-nd5,2026-08-06,13:00,横浜アリーナ,electronic,female,同行,み,5.0,,同行記載あり,2026-07-01 15:20:28,2026-07-01 21:01:47,,listing,1,65000,"同行/初期当選/重複・すり替えなし/高橋担不可/
・連番内のお座席の選択は出来ません。座席選択後チケットをお渡ししますので、その場で受取連絡お願い致します。
・公演当日、会場付近に待ち合わせし同時入場して頂きます。前日までに連絡ボードで待ち合わせのご連絡をいたします。
・連絡なしの遅刻や交通機関、ご自身によるトラブル体調不良などありましたら、先に入らせて頂きます。その際も受取連絡は必ずして頂きます。
・公演中止以外はランダムエラー含み、いかなる理由であっても受取連絡は必ずして頂きます。また購入後のキャンセル、返金は致しかねます。ご了承ください。",True,2026-07
