ticket_id,created_at_unix,event_id,perf_date,perf_time,venue,ticket_type,name_type,delivery_method,seller_name,seller_rating,order_num,ticket_tags,first_observed_at,last_observed_at,sold_at,status,quantity,price,raw_description,details_fetched,year_month
luhwl6v3va,1782923045855,naniwa-danshi-nd5,2026-07-11,13:30,[北海道] 北海道立総合体育センター（北海きたえーる）,electronic,female,同行,k,5.0,,同行,2026-07-01 16:24:05,2026-07-01 21:01:47,,listing,1,83000,"2名義中1番手同行 初期当選のみ すり替えなし 有効期限内 下3桁表示可能
2名義中1番にて当方が選ばなかった席をお渡しします。当方が席を選び次第チケットをお渡しする予定です。高橋担不可。
公演当日開場の30分前を目安に集合して頂きます。公演前日になりましたら集合時間集合場所等を連絡ボードにてご連絡致しますのでよろしくお願い致します。
個人情報を交換する場合がございますのでよろしくお願い致します。
本人確認、ランダムエラー、購入者様のご都合等により入場ができなかった場合の返金は致しますのでご了承ください。",True,2026-07
9y3hxp3yll,1782925836861,naniwa-danshi-nd5,2026-07-18,18:00,マリンメッセ福岡A館,electronic,female,公演日1日前までにログイン情報のお渡し,り,5.0,,QR,2026-07-01 17:10:36,2026-07-01 21:01:47,,listing,2,83000,初期当選/QRごと/下3桁提示可/買い手で代表者チェック可/過去エラーなし/発送物等戻りなし/公演中止以外の返金一切不可,True,2026-07
g99q2wc7wq,1782933921929,naniwa-danshi-nd5,2026-07-11,13:30,[北海道] 北海道立総合体育センター（北海きたえーる）,electronic,female,前日にログイン情報共有,れ,5.0,,QR,2026-07-01 19:25:21,2026-07-01 21:01:47,,listing,2,62000,"QR毎｜復活当選｜重複すり替えなし｜着ブロ希望なし｜下3桁提示可能｜有効期限内｜発送物戻りなし
公演前日夜にログインに必要な情報をお伝えします。
入場後は速やかにログアウト･受取報告をお願いいたします。
座席に関するクレームや返金は一切受け付けません。
公演中止の場合のみ手数料を引いた金額を返金します。
その他、体調不良･交通機関の乱れ･本人確認･ランダムエラーで入場できなかったなど、如何なる場合もキャンセル･返金いたしません。
購入された時点で了承いただけたものとします",True,2026-07
