ticket_id,created_at_unix,event_id,perf_date,perf_time,venue,ticket_type,name_type,delivery_method,seller_name,seller_rating,order_num,ticket_tags,first_observed_at,last_observed_at,sold_at,status,quantity,price,raw_description,details_fetched,year_month
eh4nfin3f2,1780468524702,west-live-tour-yuitsumuni,2026-06-26,18:00,[千葉県] ららアリーナ 東京ベイ,electronic,female,ログイン情報のお伝え,A,5.0,,QR,2026-06-03 06:35:24,2026-06-24 02:01:15,,deleted,2,45000,"ログイン情報をお伝えしますのでご自身の端末でご入場ください。
同行者登録に関しましてはご自身でお手続きください。
入場されましたら必ず開演時刻までにログアウトと受取評価をお願いいたします。
恐れ入りますが日本人の方のみ購入をお願いいたします。
公演中止の場合は全額返金させていただきます。その他の理由(ランダムエラーや本人確認等)での補償は一切できかねますので予めご了承の上で購入をお願いいたします。",True,2026-06
5wplykmvc0,1781422094525,west-live-tour-yuitsumuni,2026-06-26,18:00,[千葉県] ららアリーナ 東京ベイ,electronic,female,公演日前日までにログイン情報共有,ハ,5.0,,QR,2026-06-14 07:28:14,2026-06-26 03:01:19,,deleted,2,60000,"QRごと/初期当選/希望であれば下3桁提示可/着ブロ希望なし/有効期限内名義/過去エラー等不備無し/最終当選歴アワードアリツア
同行者登録および同意チェックは買い手様の方でお願いいたします。座席未定の為お席に関するクレームは受け付けておりません。
また体調不良、ランダムエラー、システムエラー等の入場トラブル、本人確認、交通機関の遅延、出演者の変更、途中退席等のいかなる場合でも返金、キャンセル不可
公演中止の場合のみ手数料を差し引いた金額をお返しします。
入場後速やかにログアウトして頂き公演時間までに必ず受け取り評価できる方のみご購入お願いいたします。
ご購入後の買い手様都合のキャンセルは一切受け付けておりませんのでご了承ください。
撮影 録音等の名義を傷つける行為はお辞めください。
購入していただいだ時点で全ての内容に同意いただいたものとみなします。",True,2026-06
n2euuq9ijs,1781796090576,west-live-tour-yuitsumuni,2026-06-26,18:00,[千葉県] ららアリーナ 東京ベイ,electronic,female,同行,ぴ,5.0,,番手,2026-06-18 15:21:30,2026-06-25 17:01:14,,deleted,2,0,"2名義中2番手/初期当選/有効期限内/下3桁提示可/すり替えなし
お座席の選択権はございません。
ゲート違いの場合、QR毎のお渡しとなります。
・開場10〜15分前までに会場付近に集合し同時入場できる方でお願いします。必ずこちらの指定した時間厳守でお待ち合わせお願い致します。遅刻された場合はお待ち致しかねます。その際の返金は対応致しかねますのでご注意ください。遅刻された場合でもチケテンの受け取りはしていただきます。
・ランダムエラー、本人確認等で入場できなかった場合などいかなる場合も返金不可、チケテンでの受け取り評価も行っていただきます。
・入場の際、QR表示のため端末をお借りする場合がございます。また、同行者様と別れての入場をお願いする可能性がございます。
・入場後、直接座席を確認するためにチケットのお渡しまで少々お時間いただく可能性がございます。ご了承ください。
・公演中止を除いた、いかなる事情がございましても、買い手様都合でのキャンセルは承りかねます。
・日本語の話せる日本人女性のみのご購入をお願いしております。",True,2026-06
06tgcczz88,1781954751074,west-live-tour-yuitsumuni,2026-06-26,18:00,[千葉県] ららアリーナ 東京ベイ,electronic,female,公演前日にQR毎,ｍ,5.0,,QR,2026-06-20 11:25:51,2026-06-26 07:01:13,,deleted,2,45000,"FC初期当選/２連番/QRごと/有効期限内/下3桁提示可/同行者登録可
QRごとのお譲りです。公演前日夜にQR表示に必要なログイン情報をお送りいたしますので、買い手様の端末で同行者登録をしていただき、QRを表示しご入場ください。
入場後は、開演時刻までに速やかに受取通知をお願いいたします。
個人情報になりますので、悪用はご遠慮ください。
公演中止の場合のみ手数料を差し引いた額を返金いたします。それ以外の本人確認、ランダムエラー、交通機関の乱れなど、如何なる場合におきましてもキャンセル、返金等の対応はいたしません。
トラブル防止の為、代理購入や日本語の通じない方はご購入をお断りしておりますのでご了承ください。",True,2026-06
i7fg48yuzc,1781204122697,west-live-tour-yuitsumuni,2026-06-26,18:00,[千葉県] ららアリーナ 東京ベイ,electronic,female,同行,み,5.0,,同行,2026-06-11 18:55:22,2026-06-24 08:01:17,,deleted,1,50000,★17時10分頃集合可能な方のみ/同行/当方重岡担/サイチェン可/FC初期当選/有効期限内,True,2026-06
sold_1781411050990,1781411050990,west-live-tour-yuitsumuni,2026-06-26,18:00,[千葉県] ららアリーナ 東京ベイ,electronic,none,公演日1日前までにQRコード共有,,,,,2026-06-14 04:24:10,2026-06-26 09:01:12,2026-06-20 16:01:09,sold,2,35000,QRコードごと 有効期限内 買い手様の方で同行者登録をお願いします,False,2026-06
qsxd9gi7xw,1781277376837,west-live-tour-yuitsumuni,2026-06-26,18:00,[千葉県] ららアリーナ 東京ベイ,electronic,female,QRごと/公演日前日にFCのログイン情報をお伝えします。,鏡餅,5.0,,同行記載あり,2026-06-12 15:16:16,2026-06-23 03:01:15,,deleted,2,40000,"QRコード毎のお譲り・FC先行初期当選・下3桁提示可能・有効期限内・着ブロなし・座席未定・すり替え重複なし
公演の前日にログイン情報をお伝えいたします。
公演当日は、入場後速やかにFCからのログアウトと取引評価をお願いいたします。
また、同行者登録等はログイン情報の共有後、購入者様ご自身での登録をお願いします。
購入後、購入者様側の事情でのキャンセルは承っておりません。
また、入場エラー、本人確認での入場不可、途中退場、入場前後に関わらず黒服に連れていかれた等、その他諸々のトラブル含め、いかなる場合でも購入後の取引キャンセル、返金対応はできかねます。
購入前に疑問点や質問などありましたらメッセージにてご連絡ください。
以上、すべて了承した日本人女性の方のみご購入をお願いいたします。",True,2026-06
bm8s51djw6,1780827780108,west-live-tour-yuitsumuni,2026-06-26,18:00,[千葉県] ららアリーナ 東京ベイ,electronic,female,同行またはQR,pi,5.0,,,2026-06-07 10:23:00,2026-06-26 01:01:17,,deleted,2,35000,"FC枠 / 座席未定 / 初期当選のみ / 4名義中3名義目またはQRごと / すりかえなし / 下2桁提示可 / 有効期限内 / Pay-easy決済
・出品のチケットは同時入場し座席選択後チケットのお渡し、またはゲートが別れた場合はQRごとのお渡しとなる可能性がございます。ご了承の上ご購入ください。
・同時入場の際お連れ様と別れて入場となることがありますが、入場後は連番のチケットでお渡しいたします。
・座席券は入場スタッフより受け取り後、座席面は裏返しのまま速やかに出品者へ手渡してください。
・チケットお渡し後は速やかに受取連絡をお願いいたします。
・QRごとの際は速やかにログアウトと受取評価をお願いいたします。
・待ち合わせ時間に遅れた際は先に入場することがあります。その場合も受取連絡はしていただきますので、時間には余裕を持ってお越しください。
・購入後は全ての内容に同意したものとみなし、公演中止を除く購入者様都合のキャンセルや誤認による購入、座席のクレーム、エラーによる入場不可には対応致しかねます。",True,2026-06
sold_1781601546869,1781601546869,west-live-tour-yuitsumuni,2026-06-26,18:00,[千葉県] ららアリーナ 東京ベイ,electronic,female,少数名義 同時入場,,,,,2026-06-16 09:19:06,2026-06-26 09:01:12,2026-06-20 16:01:09,sold,1,20700,"【+α‬にて早渡し 中相場買取可】

重複のため当日は同時入場後に座席を選ばせて頂き、ランダムにお渡しいたします。入場後は全てのチケットを当方が回収し、実際の座...",False,2026-06
zldk5xxymk,1780311443143,west-live-tour-yuitsumuni,2026-06-26,18:00,[千葉県] ららアリーナ 東京ベイ,electronic,female,公演2日前までにQRコード共有,na,5.0,,QR,2026-06-01 10:57:23,2026-06-25 13:01:19,,deleted,2,47000,"プライベート出品にしたいため、購入希望の方はメッセージをお願いします。
・QRコード毎でのお譲り、初期当選、下3桁提示可能、WEST.FC先行、有効期限内名義、座席未定、着ブロ希望なし
・公演2日前までにログイン情報を共有いたします。
公演当日は、入場後速やかにログアウト、取引評価をお願いいたします。同行者登録等はログイン情報共有後に購入者様ご自身でご登録をお願いします。（ゲートに関してもこちらからはお伝えしないため、ログイン情報をお伝えした際にご自身でご確認ください。）
・トラブル防止のため代理購入や2次出品不可
・24時間以内に返信可能な日本国籍の方のみ購入をお願いします。（3日以内に必要連絡の反応のない方はキャンセルとみなし返金不可の取引終了とさせていただきます。）
・如何なる場合でもキャンセル、返金対応は出来ません。その場で取引評価をお願いいたします。
・購入後の購入者様側でのキャンセル依頼は承っておりません。
・入場エラー、本人確認で入場できない、途中で退場させられた、入場前後に関わらず売り手買い手含む黒服に連れていかれた等、その他諸々のトラブル含めいかなる場合でも購入後の取引キャンセル、返金対応できかねます。",True,2026-06
sold_1780466906563,1780466906563,west-live-tour-yuitsumuni,2026-06-26,18:00,[千葉県] ららアリーナ 東京ベイ,electronic,female,同行,,,,,2026-06-03 06:08:26,2026-06-26 09:01:12,2026-06-20 16:01:09,sold,1,49000,"
重岡担不可/すり替えなし同行/下3桁提示可/有効期限内/サイチェン可能

開場時間17:00頃に会場付近で待ち合わせし、同時入場していただきます。
詳しい待ち...",False,2026-06
ty3nx0e58c,1781869747231,west-live-tour-yuitsumuni,2026-06-26,18:00,[千葉県] ららアリーナ 東京ベイ,electronic,female,同行,れ,5.0,,番手,2026-06-19 11:49:07,2026-06-25 12:01:12,,deleted,2,40000,"有効期限内/初期当選/2名義中2番手/下3桁提示可/すりかえなし
ゲート次第でQR毎のお渡しになります。
当日指定の時間に待ち合わせをし同時入場いたします。
開場20分前を目処に待ち合わせを行います。
時間前後する場合がございますので、お時間に余裕を持ってお越しいただくようにお願いします。
入場後に1度チケットを回収させて頂き、座席確認・座席選択をした後にお渡しいたします。買い手様に座席選択権はありません。
そのためチケットのお渡しまでお時間頂くことがございますがご了承ください。
チケットをお渡しした際すみやかに受取連絡をお願い致します。
座席等のクレームは一切受け付けておりません。
またお取引決定後のキャンセルは一切お受けできません。
公演中止以外(ランダムエラー・遅刻・当日キャンセル等)の如何なる場合でも返金対応は致しません。
公演中止の際は手数料を差し引いた金額を全額返金いたします。",True,2026-06
sold_1780916994247,1780916994247,west-live-tour-yuitsumuni,2026-06-26,18:00,[千葉県] ららアリーナ 東京ベイ,electronic,female,同行,,,,,2026-06-08 11:09:54,2026-06-26 09:01:12,2026-06-20 16:01:09,sold,1,33000,重複なし、下3桁提示可能、すり替えなし、条件あり,False,2026-06
7b9usvxy3x,1781928755471,west-live-tour-yuitsumuni,2026-06-26,18:00,[千葉県] ららアリーナ 東京ベイ,electronic,female,2名義中2番手,ぴょん,5.0,,QR番手,2026-06-20 04:12:35,2026-06-21 11:01:07,,deleted,2,40000,"初期当選の2名義中2番手/ゲート次第でQR毎のお渡し/すり替えなし/有効期限内名義/下3桁提示可
入場ゲートが異なる場合QR毎のお渡しになります。
入場後に1度チケットを回収させて頂き、座席確認・座席選択をした後にお渡しいたします。買い手様に座席選択権はございません。
そのためチケットのお渡しまでお時間頂くことがございますがご了承ください。
チケットをお渡しした際に受取連絡をお願い致します。
開場15分前に待ち合わせ予定です。
当日は集合時間厳守でお願いします。
公演中止以外の体調不良、交通機関の乱れを含む遅刻、ランダムエラー、本人確認、入場不可等如何なる場合もキャンセル、返金は致しかねますのでご了承ください。
公演中止の際は手数料を差し引いた金額を全額返金いたします。",True,2026-06
sold_1781659924360,1781659924360,west-live-tour-yuitsumuni,2026-06-26,18:00,[千葉県] ららアリーナ 東京ベイ,electronic,female,公演日前日ログイン情報共有,,,,,2026-06-17 01:32:04,2026-06-26 09:01:12,2026-06-20 16:01:09,sold,2,45000,"QR毎のお譲りです。
初期当選/有効期限内/重複・すり替えなし/下3桁提示可/
着ブロ希望なし/変更ボタンあり

公演日前日にログイン情報をお知らせいたします。...",False,2026-06
qnsyeqbm8g,1780646298521,west-live-tour-yuitsumuni,2026-06-26,18:00,[千葉県] ららアリーナ 東京ベイ,electronic,female,同時入場、座席選択後のお渡し,は,5.0,,ランダム記載あり,2026-06-05 07:58:18,2026-06-23 23:01:20,,deleted,1,33500,"開場20分前を目処に待ち合わせを行います。
時間前後する場合がございますので、お時間に余裕を持ってお越しいただくようにお願いします。
当日の座席に関してはQRのため未定です。
入場口がアリーナ階とスタンド階等で別れてしまった場合にはこちらの友人との入場をお願いする可能性もございます。ご了承ください。
入場後に1度チケットを回収させて頂き、座席確認・座席選択をした後にお渡しいたします。買い手様に座席選択権はありません。
そのためチケットのお渡しまでお時間頂くことがございますがご了承ください。
チケットをお渡しした際すみやかに受取連絡をお願い致します。
10分以上の遅刻の場合待たずに入場させて頂きます。その際も受取連絡はして頂きます。
落札後のキャンセル、座席等のクレームは一切受け付けておりません。
またお取引決定後のキャンセルは一切お受けできません。当日のランダムエラーや体調不良、出演者の変更等、いかなる理由があっても、公演中止以外の理由でのキャンセル・返金は一切対応できません。
当日QRコードの表示にご協力いただく可能性があります。
ご購入いただいた時点で上記にご理解いただいているものと判断いたします。
入金後にメッセージにて電話番号の提示をお願いいたします。",True,2026-06
3tz9ujh8ih,1780827942968,west-live-tour-yuitsumuni,2026-06-26,18:00,[千葉県] ららアリーナ 東京ベイ,electronic,female,同行またはQR,pi,5.0,,,2026-06-07 10:25:42,2026-06-26 00:01:20,,deleted,2,33000,"FC枠 / 座席未定 / 初期当選のみ / 4名義中4名義目またはQRごと / すりかえなし / 下2桁提示可 / 有効期限内 / Pay-easy決済
・出品のチケットは同時入場し座席選択後チケットのお渡し、またはゲートが別れた場合はQRごとのお渡しとなる可能性がございます。ご了承の上ご購入ください。
・同時入場の際お連れ様と別れて入場となることがありますが、入場後は連番のチケットでお渡しいたします。
・座席券は入場スタッフより受け取り後、座席面は裏返しのまま速やかに出品者へ手渡してください。
・チケットお渡し後は速やかに受取連絡をお願いいたします。
・QRごとの際は速やかにログアウトと受取評価をお願いいたします。
・待ち合わせ時間に遅れた際は先に入場することがあります。その場合も受取連絡はしていただきますので、時間には余裕を持ってお越しください。
・購入後は全ての内容に同意したものとみなし、公演中止を除く購入者様都合のキャンセルや誤認による購入、座席のクレーム、エラーによる入場不可には対応致しかねます。",True,2026-06
sold_1781450298735,1781450298735,west-live-tour-yuitsumuni,2026-06-26,18:00,[千葉県] ららアリーナ 東京ベイ,electronic,female,少数名義 同時入場,,,,,2026-06-14 15:18:18,2026-06-26 09:01:12,2026-06-20 16:01:09,sold,1,20700,"【+α‬にて早渡し 中相場買取可】

重複のため当日は同時入場後に座席を選ばせて頂き、ランダムにお渡しいたします。入場後は全てのチケットを当方が回収し、実際の座...",False,2026-06
ywvn004clb,1781004373773,west-live-tour-yuitsumuni,2026-06-26,18:00,[千葉県] ららアリーナ 東京ベイ,electronic,female,公演日前日共有QR毎,h,5.0,,QR,2026-06-09 11:26:13,2026-06-25 13:01:19,,deleted,2,40000,"QRコード毎でのお譲り、初期当選、下3桁提示可能、WEST.FC先行、有効期限内名義、座席未定、着ブロなし、すり替え重複なし
公演前日にログイン情報をお伝えいたします
公演当日は、入場後速やかにログアウト、取引評価をお願いいたします。同行者登録等はログイン情報共有後に購入者様ご自身でご登録をお願いします。
日本人の女性のみ購入お願いいたします。
※ 如何なる場合でもキャンセル、返金対応は出来ません。その場で取引評価をお願いいたします。
購入後の購入者様側でのキャンセル依頼は承っておりません。入場エラー、本人確認で入場できない、途中で退場させられた、入場前後に関わらず売り手買い手含む黒服に連れていかれた等、その他諸々のトラブル含めいかなる場合でも購入後の取引キャンセル、返金対応できかねます。",True,2026-06
sold_1780887829016,1780887829016,west-live-tour-yuitsumuni,2026-06-26,18:00,[千葉県] ららアリーナ 東京ベイ,electronic,female,公演３日前にQRコード共有,,,,,2026-06-08 03:03:49,2026-06-26 09:01:12,2026-06-20 16:01:09,sold,2,37000,交換・条件・同行なしのQRごとのお譲りです。初期当選・有効会員・コンビニ支払い・着ブロ希望なしです。同行者登録は買い手様でお願いします。ご購入後会員番号下３桁連...,False,2026-06
sold_1780586304871,1780586304871,west-live-tour-yuitsumuni,2026-06-26,18:00,[千葉県] ららアリーナ 東京ベイ,electronic,female,前日18時以降にお伝えさせていただきます。,,,,,2026-06-04 15:18:24,2026-06-26 09:01:12,2026-06-20 16:01:09,sold,2,45000,"QR毎、前日の18時以降QRコードが配信され次第情報をお伝えさせて頂きます。

ランダムエラーや本人確認があった場合キャンセル不可となります。
",False,2026-06
oyibjp2vkc,1781613242312,west-live-tour-yuitsumuni,2026-06-26,18:00,[千葉県] ららアリーナ 東京ベイ,electronic,female,同行,にし,5.0,,同行,2026-06-16 12:34:02,2026-06-25 11:01:14,,deleted,1,40000,"有効期限内/すり替えなし/本人確認不可
重複なし、同行(神山担)でのお取引となります。
同行者登録もこちらでおこないます。
当日は開場10〜15分前頃に会場付近にて待ち合わせの上、同時入場をお願いいたします。時間厳守でお願いいたします。万が一遅刻された場合は先に入場いたしますが、その際の返金は出来かねますのでご了承ください。
チケットお渡しの際は、その場で受取評価をお願いしております。
ランダムエラーや体調不良等いかなる理由でも、公演中止以外の返金は対応いたしかねます。録音・録画等の迷惑行為は禁止とさせていただきます。
全てご了承いただいた上で、日本語が理解できる日本人の成人女性のみご購入をお願いいたします。ご購入後はスムーズなお取引のため、電話番号のご共有をお願いしております。",True,2026-06
bluwsk1o4o,1781939559863,west-live-tour-yuitsumuni,2026-06-26,18:00,[千葉県] ららアリーナ 東京ベイ,electronic,female,少数名義 同時入場,☆,5.0,,同行記載あり,2026-06-20 07:12:39,2026-06-25 15:01:23,,deleted,2,26000,"【+α‬にて早渡し 中相場買取可】
重複のため当日は同時入場後に座席を選ばせて頂き、ランダムにお渡しいたします。入場後は全てのチケットを当方が回収し、実際の座席位置を確認するため、半券のお渡しまでお時間を頂く場合がございます。開演時刻までには必ずお渡しいたしますので、ランダム配布の意味がわかる方のみご購入ください。所持名義数に関するご質問はお答え出来かねますのでご了承ください。代理購入不可。
当日は指定入場時刻の20-30分前までに入場口付近にて待ち合わせし、全員揃った状態で同時入場いたします。大幅な遅刻は待たずに入場しますので必ずこちらの指定した集合時間をお守り頂ける時間に余裕のある方のみご購入ください。またスムーズに連絡の取れる日本人女性のみでお願いいたします。
※入場時、半券の持ち逃げ防止のため一時的に中身の見えない封筒に身分証をお預かりする場合がございます。
当日まで座席未定のためお渡しする座席の善し悪し、感染症への罹患や発熱･体調不良(本人･同行者･身内の不幸等含む)交通機関の遅れ、本人確認、ランダムエラーなど、いかなる場合でも返金やキャンセルはお受け出来かねますのでご了承ください。
お渡ししたチケットについてに何かご質問がある際は、必ず半券受け取り時にその場でお申し出ください。取引終了後並びに解散後の対応は一切いたしません。
ご購入頂いた方は上記内容に全て同意したものとみなし、条件記載通りのお取引を必ずしていただきますようお願いいたします。その他ご質問のある方は事前にメッセージにてお問い合わせください。",True,2026-06
j7906w4dqp,1781868419599,west-live-tour-yuitsumuni,2026-06-26,18:00,[千葉県] ららアリーナ 東京ベイ,electronic,female,公演日1日前までにQRコード共有,m,4.8,,QR,2026-06-19 11:26:59,2026-06-25 10:01:16,,deleted,2,48000,"・必要なログイン情報をご連絡いたします。その後、同行者登録は購入者様ご自身で行って頂きます。ご協力お願いいたします。
・同行者登録と同意チェックはご自身で全員様分必ず行ってください。当日はご自身で表示し、ご入場して下さい。
・公演中止以外のいかなる場合でも返金は致しません。
ご自身の体調不良、赤線エラー、ランダムエラー、その他のエラー、本人確認、交通機関の乱れによる遅刻等、いかなるトラブルの場合もキャンセルできません。必ず受取通知をしていただきます。
・公演中止の場合のみ、手数料を引いた金額をご返金致します。
・入場後の不正キャンセル防止の為、ログイン確認できましたら必ずご連絡お願い致します。
・入場後は速やかにログアウト、受取通知をお願い致します。
・落札前に説明をよくお読みになり、ご理解ご了承いただけた方のみ、ご入札下さい。
・購入された場合は上記すべてに同意したとみなします。",True,2026-06
