ticket_id,created_at_unix,event_id,perf_date,perf_time,venue,ticket_type,name_type,delivery_method,seller_name,seller_rating,order_num,ticket_tags,first_observed_at,last_observed_at,sold_at,status,quantity,price,raw_description,details_fetched,year_month
uh04yx3ma6,1782567189440,west-live-tour-yuitsumuni,2026-06-28,12:00,[千葉県] ららアリーナ 東京ベイ,electronic,female,同行,ぷりん,5.0,,番手,2026-06-27 13:33:09,2026-06-28 04:01:22,,deleted,2,25000,"4名義中3番手/指定席のみ/すり替えなし/下3桁提示可能/FC初期当選/座席確認後すぐにお渡し
・開場時間の約30分前頃に会場付近にてお待ち合わせ、同時入場して頂きます。詳しい場所や時間などは連絡ボードにてご連絡致します。
・必ず時間厳守でお願い致します。万が一集合時間に遅れた場合は、先に入場させて頂く場合がございます。その際の返金には対応致しかねます。
・入場の際に身分証をお預かりする場合がございます。本人確認ができる公的身分証を必ずお持ちください。
お預かりした身分証は、チケットお渡しの際、受け取り連絡を確認後にご返却致します。問題がない限り、個人情報を控えることは一切致しませんのでご安心ください。
・複数名義所持の為同時入場した後、一旦チケットを回収させて頂き、座席確認した後すぐにお渡しいたします。
・チケットを受け取りの際に、必ずその場で受け取り連絡をお願いします
・会場内、電波が悪い可能性も考えられるため、通話ができる携帯電話を必ずご持参下さい
・代理購入不可、ご購入されたご本人様が必ずご入場ください。
・公演中止の際には定価＋手数料を引いた金額をお返し致します。ランダムエラー、本人確認、体調不良、交通機関の遅れなど、公演中止以外のいかなる場合でも返金致しません。
・ご入金以降は上記の説明事項に同意されたものとみなします。ご購入者様からの条件の提示にはお受け出来ません。（公演中止・延期の場合は除く）
上記内容に理解し承諾いただけた方のみご購入お願いします。",True,2026-06
n2tuuu7li9,1782566528423,west-live-tour-yuitsumuni,2026-06-28,12:00,[千葉県] ららアリーナ 東京ベイ,electronic,female,同行,り！,5.0,,同行,2026-06-27 13:22:08,2026-06-27 16:01:22,,deleted,1,45000,"全てFゲート/2名義中の1番手同行/初期当選分/2名義分の下3桁提示可/有効期限内/着ブロ申込なし/郵送物戻りなし/サイチェン可/桐山担不可/ジュニア担可
・公演当日、10時50分（予定）に会場周辺にて待ち合わせを予定しております。
また詳しい場所などは連絡ボードにてお知らせ致します。
・購入者様の端末にてQRコード表示の協力をお願いする場合もございますのでご了承ください。顔付き身分証をお借り致しますのでご準備お願い致します。
・お預かりした身分証は、チケットお渡しの際、受け取り連絡を確認後にご返却致します。
・2名義中の1番手同行になります。連番内の席と座席に関しては購入様は選べません。サイチェンは可能です。
・問題がない限り、個人情報を控えることは一切致しませんので、ご安心ください。
・当日顔写真付き身分証をご用意いただけない場合は入場できません。その場合でも受取評価はしていただきます。
・同行者登録は出品者側でさせて頂きます。
・ランダムエラー、遅刻、体調不良、本確等、公演中止以外の如何なる場合も返金は一切出来かねますのでご了承ください。その場合でも受け取り完了連絡はしていただきます。
・当日までスムーズに連絡の取れる方でお願いします。
上記に全てご承諾いただけたものとして、お取引をさせていただきます。",True,2026-06
sold_1781533329441,1781533329441,west-live-tour-yuitsumuni,2026-06-28,12:00,[千葉県] ららアリーナ 東京ベイ,electronic,female,ログイン情報共有,,,,,2026-06-15 14:22:09,2026-06-28 03:01:23,2026-06-27 14:01:15,sold,2,20000,"Fゲート/QRごと/初期当選分/有効期限内/着ブロ申込なし
郵送物戻りなし
購入後会員番号下3桁提示可 下記事項にご了承いただける方のみ申請をお願いいたします。...",False,2026-06
8ugqwst4pm,1782567480184,west-live-tour-yuitsumuni,2026-06-28,12:00,[千葉県] ららアリーナ 東京ベイ,electronic,female,入金後24時間以内にQRコード共有,np,5.0,,QR,2026-06-27 13:38:00,2026-06-28 01:01:18,,deleted,2,30000,"Fゲート　座席未定　初期当選　期限内　発送物戻りなし　同行者登録可
・ランダムエラー、本人確認等で入場できなかった場合や体調不良、出演者欠席などによるキャンセル、返金は致しません。如何なる場合でも受け取り連絡はしていただきます。
公演中止の際のみ手数料を差し引いた金額を返金致します。",True,2026-06
ceol7jq9d7,1782568353100,west-live-tour-yuitsumuni,2026-06-28,12:00,[千葉県] ららアリーナ 東京ベイ,electronic,female,入金後すぐにQRコード共有,ユカ,5.0,,QR,2026-06-27 13:52:33,2026-06-28 03:01:23,2026-06-27 17:01:19,sold,2,29000,"入場口F WEST FC先行 初期当選 2枚申し込み 指定席 QRごとのお譲り 条件ございません 座
席未定
WEST FC先行 ２枚申込みでの当選
１回目の申し込みで当選、
入場口：F　席種：指定席になります。
復活当選、制作開放、立見指定ではございません。
WEST. LIVE TOUR 2025 A.H.O. -Audio Hang Out-公演は
仕事が忙しく申し込みをしませんでした。
WEST. DOME TOUR AWARD ～10th Anniversary～2024
東京ドーム公演はスタンド席でした。
（過去の履歴を調べるため確認をして商品説明記載の履歴は確認したのですが
２０２６年４月１日１６時までにチケットホルダーの登録をしなかったため
現在は確認ができない状態です。）
有効会員です。複数当選ございません。
当選公演はこの公演のみになります。
支払い方法ペイジー選択にて
銀行ATMにて現金でお支払いも完了しております。
QRコードごとのお譲りになります。条件もございません。
同行者登録は購入者様のほうでお願い致します。
QRコード表示に必要な会員番号、パスワードをお知らせさせていただきます。
公演中止以外での返金は致しかねます。ご了承ください。
公演中止の場合は、手数料を差し引いたを金額を返金させていただきます。",True,2026-06
77w3sulo5r,1782568473599,west-live-tour-yuitsumuni,2026-06-28,12:00,[千葉県] ららアリーナ 東京ベイ,electronic,female,入金後24時間以内にQRコード共有,f,5.0,,QR,2026-06-27 13:54:33,2026-06-27 15:01:23,,deleted,2,20000,"Yゲート/指定席/QR毎/制作開放席/有効期限内/着ブロ申込なし/郵送物戻りなし
下記事項にご了承いただける方のみ購入申請をお願いいたします。 購入後、公演前日にQRコード表示に必要なログイン情報をメッセージにてお知らせいたします。
当日入場後は速やかにログアウト、受取完了のご連絡をお願いいたします。
同行者登録はログイン情報共有後ご自身でお願いいたします。
公演中止以外は如何なる場合も返金いたしかねますのでご了承ください。",True,2026-06
1srsm65ts9,1782567357700,west-live-tour-yuitsumuni,2026-06-28,12:00,[千葉県] ららアリーナ 東京ベイ,electronic,female,同行,ぷりん,5.0,,ランダム,2026-06-27 13:35:57,2026-06-28 04:01:22,,deleted,2,12000,"指定席のみランダム配布、座席未定になります。
・開場時間の約30分前頃に会場付近にてお待ち合わせ、同時入場して頂きます。詳しい場所や時間などは連絡ボードにてご連絡致します。
・必ず時間厳守でお願い致します。万が一集合時間に遅れた場合は、先に入場させて頂く場合がございます。その際の返金には対応致しかねます。
・入場の際に身分証をお預かりする場合がございます。本人確認ができる公的身分証を必ずお持ちください。
お預かりした身分証は、チケットお渡しの際、受け取り連絡を確認後にご返却致します。問題がない限り、個人情報を控えることは一切致しませんのでご安心ください。
・複数名義所持の為同時入場した後、一旦チケットを回収させて頂き、座席確認などお時間を頂戴致します。
・チケットを受け取りの際に、必ずその場で受け取り連絡をお願いします
・会場内、電波が悪い可能性も考えられるため、通話ができる携帯電話を必ずご持参下さい
・代理購入不可、ご購入されたご本人様が必ずご入場ください。
・公演中止の際には定価＋手数料を引いた金額をお返し致します。ランダムエラー、本人確認、体調不良、交通機関の遅れなど、公演中止以外のいかなる場合でも返金致しません。
・ご入金以降は上記の説明事項に同意されたものとみなします。ご購入者様からの条件の提示にはお受け出来ません。（公演中止・延期の場合は除く）
上記内容に理解し承諾いただけた方のみご購入お願いします。",True,2026-06
bfnfa0wx43,1782568772143,west-live-tour-yuitsumuni,2026-06-28,12:00,[千葉県] ららアリーナ 東京ベイ,electronic,female,入金後すぐにQRコード共有,ユカ,5.0,,QR,2026-06-27 13:59:32,2026-06-28 02:01:15,,deleted,2,120000,"入場口C 制作開放席当選枠 WEST FC先行 2枚申し込み 指定席 QRごとのお譲り 条件ご
ざいません 座席未定
制作開放席当選枠の指定席になります。
都合により行くことができなくなりました。
WEST FC先行 ２枚申込みでの当選しました。
入場口：C　席種：指定席になります。
WEST. LIVE TOUR 2025 A.H.O. -Audio Hang Out公演は
仕事が忙しく申し込みをしませんでした。
WEST. DOME TOUR AWARD～10th Anniversary～2024
東京ドーム公演はスタンド席でした。
（過去の履歴を調べるため確認をして商品説明記載の履歴は確認したのですが
２０２６年４月１日１６時までにチケットホルダーの登録をしなかったため
現在は確認ができない状態です。）
有効会員です。複数当選ございません。
当選公演はこの公演のみになります。
お支払いも完了しております。
QRコードごとのお譲りになります。条件もございません。
同行者登録は購入者様のほうでお願い致します。
QRコード表示に必要な会員番号、パスワードをお知らせさせていただきます。
公演中止以外での返金は致しかねます。ご了承ください。
公演中止の場合は、手数料を差し引いたを金額を返金させていただきます。",True,2026-06
r2ekde6y3p,1782565727012,west-live-tour-yuitsumuni,2026-06-28,12:00,[千葉県] ららアリーナ 東京ベイ,electronic,female,入金後24時間以内にQRコード共有,a,5.0,,同行記載あり,2026-06-27 13:08:47,2026-06-28 03:01:23,,deleted,2,50000,"Fゲート
QR毎お譲り/初期当選/指定席(着ブロや制作開放席ではありません。)条件なし/すり替えなし/有効期限内下3桁提示可
QRコード表示に必要な情報をマイページにてご連絡申し上げます。
同行者登録は買い手様にてお願い致します。
同行者登録のミス、出演者の変更、ランダムエラー、本人確認等如何なる理由にも返金対応致しません。ログアウト、受け取り通知を速やかにお願いします。
以上をすべてご承諾頂ける方のみご購入ください。",True,2026-06
n8y796w7as,1782232860182,west-live-tour-yuitsumuni,2026-06-28,12:00,[千葉県] ららアリーナ 東京ベイ,electronic,female,アリーナゲート同時入場,ヒカリ,5.0,,同行番手,2026-06-23 16:41:00,2026-06-27 18:01:17,,deleted,1,100000,"1番手同行/すり替えなし/男性×/サイチェン‪✕‬/リセール取得 代行使ってません、重複電話番号無し、情報変更無し、過去多数入場していますが本確、エラー出たことありません（ランエラがでない保証は出来かねます。）即購入◎
＊追記＊
J×2  F×4所持しております。
アリーナゲートのみの2名義中1番手同行。
当方が選んだチケットの同行になります。
連番内はお選びいただけません。
価格交渉は9.0まで検討可それ以外は返信出来かねます。
＊＊＊
開演1時間前頃に集合予定です。詳細はメッセージボードにて連絡します。
1番手 当方と同行
同時入場後にチケットを回収しますので座席面を裏にして速やかに渡してください。
当方の選んだチケットの同行になります。
サイチェン不可のため入場後はチケットを回収し公演終了後ご希望でしたらお渡しします。席を離れる際にチケットが必要な場合は顔写真付き身分証をお預かりしますのでご了承の上ご購入お願いいたします。サイチェン希望の方は購入をお控えください。
目の前で受取評価して頂けない場合はチケットのお渡しはできません。
受取評価後チケットをお渡しします。すり替えはありません。連番内は選べません。
当日は顔写真付き身分証を必ずお持ちください。
お預かりした身分証は、チケットお渡しの際、受け取り連絡を確認後にご返却致します。
問題がない限り、個人情報を控えることは一切致しませんので、ご安心ください。
当日顔写真付き身分証をご用意いただけない場合は入場できません。その場合でも受取評価はしていただきます。
購入者様の端末にてQRコード表示の協力をお願いする場合もございますのでご了承ください。
ランダムエラー、遅刻、体調不良、本確等、公演中止以外の如何なる場合も返金は一切出来かねますのでご了承ください。その場合でも受け取り完了連絡はしていただきます。
当日までスムーズに連絡の取れる方でお願いします。
上記に全てご承諾いただけたものとして、お取引をさせていただきます。",True,2026-06
sold_1782552296801,1782552296801,west-live-tour-yuitsumuni,2026-06-28,12:00,[千葉県] ららアリーナ 東京ベイ,electronic,female,入金後24時間以内にQRコード共有,,,,,2026-06-27 09:24:56,2026-06-28 03:01:23,2026-06-27 14:01:15,sold,2,160000,"QRごとのお譲り 入場口:J 席種:指定 前回後方席名義
FC枠で初期当選したもので、復活当選・制作開放席ではございません。
着席ブロックには申込みしておりませ...",False,2026-06
tpahcxez5s,1782565957792,west-live-tour-yuitsumuni,2026-06-28,12:00,[千葉県] ららアリーナ 東京ベイ,electronic,female,入金後24時間以内にQRコード共有,m,5.0,,QR,2026-06-27 13:12:37,2026-06-28 03:01:23,2026-06-27 15:01:23,sold,1,26000,"制作開放/有効期限内/Yゲート/指定
連絡ボードにてログインに必要な情報をお伝えします。
公演当日は入場次第ログアウトいただき、受取完了通知をお願い致します。
公演中止の場合のみ、手数料を差し引いた金額を返金します。その他体調不良や本人確認、エラー等、如何なる場合でも返金はできかねますのでご了承ください。",True,2026-06
gyheky1jyi,1782567895123,west-live-tour-yuitsumuni,2026-06-28,12:00,[千葉県] ららアリーナ 東京ベイ,electronic,female,公演日7日前までにQRコード共有,ぴ,5.0,,QR,2026-06-27 13:44:55,2026-06-27 15:01:23,,deleted,2,40000,初期当選 Fゲートになります。ご自身で同行者登録お願い致します。,True,2026-06
p2ia7mqasy,1782567529721,west-live-tour-yuitsumuni,2026-06-28,12:00,[千葉県] ららアリーナ 東京ベイ,electronic,female,同行,あ,5.0,,ランダム,2026-06-27 13:38:49,2026-06-27 22:01:16,,deleted,2,13000,"【ランダム、中相場買取､＋で早渡しも可能】
公演当日当方と同時入場をしていただきます。
10:30までに会場付近でお待ち合わせ。
集合場所は当日までにお知らせいたします。
全てのチケットを発券後、一度全てのチケットを回収させていただきます。回収後、座席選択のため入場してからチケットをお渡しするまでにお時間を頂きます。チケットは開演時間までには間に合うようお渡しさせていただきます。もしくはログイン情報をお伝えいたしますので、ご自身で入場していただきそのままそちらのお席で鑑賞させていただく場合もございます。お渡ししたチケットの座席に対するクレーム、待ち時間に関するクレームなどは一切お受けいたしかねますので予めご了承ください。どのお座席となりましてもチケットをお渡し時には必ずその場で速やかに受取連絡をお願いいたします。
同行者登録はこちらで全て事前に行います。
ご購入後、連絡ボードにて電話番号をお知らせをお願いいたします。お伺いした電話番号は当日チケットをお渡しする際の連絡に使わせていただきます。
キャリーケースなど大きなお荷物はロッカーなどにお預けになられてから会場へお越しください。
遅刻、体調不良、ランダムエラー、入場時の表示トラブル、本人確認等で入場が出来なかった場合など公演中止以外は如何なる理由でもご返金対応やキャンセルは致しかねます。発送連絡後のキャンセルも致しかねます。主催者側による公演中止の場合のみ手数料を差し引いて速やかに返金いたします。
トラブル防止のため代理購入はご遠慮ください。
ご入金以降は上記の説明文に同意されたものとみなし、ご購入者様からの条件の提示等はお受けできません。
日本語で不自由なく会話ができ、スムーズ入場に柔軟かつ協力的にご対応いただける方のみご購入ください。
以上の内容にすべてご理解いただける方のみご購入お願いいたします。",True,2026-06
sold_1782566192140,1782566192140,west-live-tour-yuitsumuni,2026-06-28,12:00,[千葉県] ららアリーナ 東京ベイ,electronic,female,同行,,,,,2026-06-27 13:16:32,2026-06-28 03:01:23,2026-06-27 14:01:15,sold,2,13000,"Fゲート/FC枠/座席未定/3名義中の3名義目/すり替えなし/初期当選

購入希望者はプライベート出品させて頂きますので、事前にご連絡お願いいたします。


全...",False,2026-06
qovxz34ujf,1782568174585,west-live-tour-yuitsumuni,2026-06-28,12:00,[千葉県] ららアリーナ 東京ベイ,electronic,female,FC2名義中2番手,t,5.0,,番手,2026-06-27 13:49:34,2026-06-27 16:01:22,,deleted,2,22000,"FC2名義中2番手 すり替えなし
全て 初期当選/有効会員/郵送戻りなし/下三桁開示可/サイチェン可
・11:00頃会場集合
・大幅な遅刻はお待ちできません
・座席クレームお受けできません
・席での録音盗撮行為等 禁止
・買手都合のキャンセル不可(間違えた、行けなくなった、体調不良等)
・公演中止と入場できなかった場合のみ返金します
・買い手不備での退場は責任を負えません
⚠️希望の方はプラベ出品に切り替えますのでコメントお願いします
上記全て了承頂ける日本語に不自由のない女性のみ、スムーズに連絡が取れるようご協力頂ける方でお願い致します",True,2026-06
q1hjcroapm,1782565626174,west-live-tour-yuitsumuni,2026-06-28,12:00,[千葉県] ららアリーナ 東京ベイ,electronic,female,同行,あ,5.0,,ランダム記載あり,2026-06-27 13:07:06,2026-06-28 04:01:22,,deleted,1,175000,"プラベルにて出品します。
初期当選/Jゲート/有効期限内/すり替え重複なし/下3桁提示可/代理購入不可
連番内の座席はお選びいただけません。
10:50ごろに会場周辺で待ち合わせし、同時入場して頂きます。集合場所の詳細は公演当日に連絡ボードにてご連絡致します。こまめに連絡が取れるようお願い致します。
入場の際、トラブル防止のため身分証をお預かりする場合がございますので必ずお待ちください。
本人確認、遅刻、体調不良、ランダムエラー等如何なる場合でも返金はできかねます。主催者側の公演中止の場合のみ手数料を引いた金額を返金致します。
待ち合わせ時間に遅刻された場合は先に入場しますが受取通知はして頂きます。
当日まで座席未定の為、座席に関するクレームや返金は対応できません。ご了承の上ご購入お願い致します。
チケットをお渡しする際その場で速やかに受け取り連絡をお願い致します。
成人済み、日本語を話せる日本国籍の女性のみ購入お願い致します。",True,2026-06
prnssaeajx,1782568224671,west-live-tour-yuitsumuni,2026-06-28,12:00,[千葉県] ららアリーナ 東京ベイ,electronic,female,同行,Ｓ,5.0,,番手同行,2026-06-27 13:50:24,2026-06-27 15:01:23,,deleted,1,23000,"2名義中2番手、指定のみ、初期当選(Ｆゲート×2)、有効期限内名義、Pay-easy払。すり替えなし。サイチェン不可。
当日、10:50頃に会場付近にてご集合予定です。詳細はメッセージにてお知らせします。
本人確認、ランダムエラー対応できません。
公演中止の場合のみ、規約に基づき自動キャンセル(返金)されます。公演中止以外の理由でのキャンセル・返金は一切承れませんのでご了承ください。
大幅な遅刻をされた場合は待たずに先に入場いたします。早めに座席券をお渡ししたいので、当日はお時間に余裕をもってお越しください。
同時入場し2名義分の座席確認後、なるべく早くチケットをお渡しします。
日本語が話せる女性方のみ、代理購入不可です。
入場後は速やかに受取連絡をお願いいたします。",True,2026-06
te3n0u8zwy,1782566403896,west-live-tour-yuitsumuni,2026-06-28,17:00,[千葉県] ららアリーナ 東京ベイ,electronic,female,同行,ま,5.0,,ランダム番手,2026-06-27 13:20:03,2026-06-28 09:01:21,,deleted,1,0,"Uゲート
2名義中2番手 すり替えなし 事前に下3桁提示可能。初期当選、有効期限内、着ブロは含みません。全てPay-easy決済
※連番内の座席はお選びいただけません
ゲート予想が外れた場合でも返金できません。
ランダムエラー、体調不良、本人確認、出演者の体調不良による欠席、座席のクレーム、交通機関の遅れ等による返金キャンセルはお受け出来かねますのでご了承ください。公演中止又は延期の場合は、仲介手数料を差し引いた金額を返金致します。
以上、ご了承いただける方のみご購入下さい。
※日本人女性のみの購入てお願い致します。",True,2026-06
jq4dvu4hnz,1782566420354,west-live-tour-yuitsumuni,2026-06-28,17:00,[千葉県] ららアリーナ 東京ベイ,electronic,female,同行,yu,5.0,,同行番手,2026-06-27 13:20:20,2026-06-27 16:01:22,,deleted,1,33000,"初期当選/2名義中1番手/すり替えなし/サイチェン可/有効期限内/下3桁提示可/着ブロ指定なし/Bゲート/本人確認可
バックアンビ岡担不可
いかなる理由でも公演中止以外の理由での返金対応は致しませんのでご了承ください。
ご購入後当日の集合場所や集合時間などのご連絡をさせて頂きます。",True,2026-06
bgpke5t4um,1782568076823,west-live-tour-yuitsumuni,2026-06-28,17:00,[千葉県] ららアリーナ 東京ベイ,electronic,female,入金後すぐにQRコード共有,チ,5.0,,QR,2026-06-27 13:47:56,2026-06-28 08:01:24,2026-06-27 15:01:23,sold,1,25000,"QR毎/制作開放(Tゲート)/有効期限内/下3桁掲示可/過去エラー無し/郵送物戻りなし
入金確認後、デジタルチケット表示に必要な情報をお伝えいたします。
同意チェックはご自身にてお願いいたします。
入場後は速やかに、FCからのログアウトと受取評価をお願いいたします。
本人確認/ランダムエラー/公共交通機関の遅れによる遅刻等、公演中止以外のいかなる場合でも返金いたしかねます。
公演中止の場合のみ、手数料を除いた全額返金いたします。",True,2026-06
