ticket_id,created_at_unix,event_id,perf_date,perf_time,venue,ticket_type,name_type,delivery_method,seller_name,seller_rating,order_num,ticket_tags,first_observed_at,last_observed_at,sold_at,status,quantity,price,raw_description,details_fetched,year_month
s8svd52q32,1782466131009,west-live-tour-yuitsumuni,2026-06-27,18:00,[千葉県] ららアリーナ 東京ベイ,electronic,female,同行 重複なし2連中の1枚 Wゲート,オ,5.0,,同行,2026-06-26 09:28:51,2026-06-27 04:01:19,,deleted,1,50000,"Wゲート
全てFC枠初期当選、有効期限内、クレカ払いなし、着ブロ希望なし
重複なしの2連中の1枚。
すり替えなし、下3桁ご希望であればお伝えいたします。
2連中の席はお選びいただけません。
中間担との連番になる可能性があります。ご購入後、コメントにて担当をご教示ください。
公演当日、開場15～20分前頃に会場付近にて待ち合わせし、同時入場していただきます。詳しい集合場所・時間は連絡ボードにてお伝えいたします。
遅刻された場合はお待ちせず先に入場いたします。その際も受取連絡はしていただきますので、お時間に余裕を持ってお越しください。
チケットお渡しの際はその場で必ず受取連絡・評価をお願いいたします。受取評価後はサイチェン等ご自由にしていただいて構いませんが、名義に傷がつくような行為はお辞めください。
公演中止の場合のみ、サイト規約に基づき自動キャンセル・返金となります。それ以外はいかなる理由でも返金は一切いたしません。購入後のキャンセルもお受けいたしません。
代理購入はトラブル防止のためお断りしております。必ず入場されるご本人様がご購入ください。
購入された時点で上記全てご了承いただいていることといたします。日本語でのやり取りが可能な方のみご購入ください。",True,2026-06
d3n1k6ur4p,1782467491997,west-live-tour-yuitsumuni,2026-06-27,18:00,[千葉県] ららアリーナ 東京ベイ,electronic,female,ご入金確認後にQR共有,もも,5.0,,QR,2026-06-26 09:51:31,2026-06-27 09:01:20,2026-06-26 12:01:15,sold,2,19000,座席未定/Wゲート/初期当選/QRごと/有効期限内名義/Pay-easy決済/発送物戻りなし/重複なし/下３桁提示可能/公演中止の際のみ全額返金致します。その他のいかなる理由でも返金いたしかねます。,True,2026-06
2j1gzb6qnj,1782465256119,west-live-tour-yuitsumuni,2026-06-27,18:00,[千葉県] ららアリーナ 東京ベイ,electronic,female,少数名義同時入場,う,5.0,,ランダム,2026-06-26 09:14:16,2026-06-27 03:01:23,,deleted,1,17000,"指定席のみランダム
入場後はチケットを回収し、選べさせていただきます。買い様は座席を選べません。
入場後は一旦解散する場合もあります。
チケットをお渡しするのにお時間を頂く可能性がございます。
チケットをお渡しした際にその場で受取通知をお願いいたします。
開場15分前(予定)に会場付近で待ち合わせし、同時入場して頂きます。
詳しい時間、場所は前日メッセージボードからお伝えいたします。
開演10分前を目安に再度集合し、半券をお渡し致します。その時に受け取り通知をお願い致します。
ランダム配布のため、お座席をお選びすることはできません。ご理解宜しくお願い致します。
一度解散するため、電話番号を伺う場合があります。
複数人で待ち合わせを致しますので遅刻厳禁でお願いいたします。
公演中止の場合のみ手数料を差し引いた金額を返金します。
当日の体調不良、本人確認やシステムエラーなどの返金は致しませんので、ご了承下さい。
座席等のクレームは一切お受け致しませんので、ご了承いただける方のみご購入をお願いします。",True,2026-06
1doud3ebf6,1782465334869,west-live-tour-yuitsumuni,2026-06-27,18:00,[千葉県] ららアリーナ 東京ベイ,electronic,female,同行,ち,5.0,,ランダム記載あり,2026-06-26 09:15:34,2026-06-26 14:01:13,,deleted,1,100000,"Lゲートランダム　早渡し不可
中相場買取可能です。神山担不可
中止の場合返金",True,2026-06
x049b3ptfx,1782467679433,west-live-tour-yuitsumuni,2026-06-27,18:00,[千葉県] ららアリーナ 東京ベイ,electronic,female,2連中1枚 同行,ま,5.0,,同行記載あり,2026-06-26 09:54:39,2026-06-26 11:01:12,,deleted,1,24000,"重複すり替えなし/下3桁提示可能
同行でのお譲りです。
中川担不可
開場20分前を目安に集合予定です。
当日お時間のある方のみ購入お願い致します。
集合時間に遅刻された場合は到着を待たずに入場します。その場合でも受取連絡をしていただきます。
速やかな集合のため、電話番号のご提示をお願いする予定です。
公演中止以外の返金は一切致しかねますのでご了承ください。
チケットお渡し次第、その場で受け取り連絡お願い致します。
上記すべてご理解いただける女性の方のみ購入お願い致します。",True,2026-06
a5yg4jhugk,1782467040135,west-live-tour-yuitsumuni,2026-06-27,18:00,[千葉県] ららアリーナ 東京ベイ,electronic,female,同行,み,5.0,,同行,2026-06-26 09:44:00,2026-06-26 16:01:58,,deleted,1,30000,"制作開放/Kゲート/指定/すり替え無し
17時頃に会場付近集合で考えております。
公演中止の場合に限り、返金対応をさせていただきます。それ以外による返金は対応いたしかねますので、あらかじめご了承ください。",True,2026-06
5mvq4v3ibr,1782466090747,west-live-tour-yuitsumuni,2026-06-27,18:00,[千葉県] ららアリーナ 東京ベイ,electronic,female,同行,3150,5.0,,同行,2026-06-26 09:28:10,2026-06-27 02:01:20,,deleted,1,20000,"リセール取得、サイチェン可、Wゲート
当日の待ち合わせ時間、場所などは追ってご連絡させて頂きますが時間厳守でお願い致します。座席の良し悪しでのクレーム、ランダムエラーや本人確認、体調不良、交通機関の遅れ等公演中止以外いかなる理由でも返金は致しかねます。
上記をご了承ください。",True,2026-06
qnbub0pwea,1782465602826,west-live-tour-yuitsumuni,2026-06-27,18:00,[千葉県] ららアリーナ 東京ベイ,electronic,female,同行,♡,5.0,,ランダム記載あり,2026-06-26 09:20:02,2026-06-27 04:01:19,,deleted,1,16000,"複数名義所持しているため、同時入場後一旦チケットを回収し解散、座席選択後ランダムでチケットをお渡し致します。会場の電波が悪い時の為に電話番号をお伺いする場合がございます。また座席を選ぶのにお時間頂くと思いますがご了承下さい。
当日の待ち合わせ時間、場所などは追って連絡ボードにてご連絡させて頂きますが時間厳守でお願い致します。座席の良し悪しでのクレーム、ランダムエラーや本人確認、体調不良、交通機関の遅れ等公演中止以外いかなる理由でも返金は致しかねます。
上記をご理解頂ける方のみご購入下さい。",True,2026-06
1m8eybdwjy,1782467885660,west-live-tour-yuitsumuni,2026-06-27,18:00,[千葉県] ららアリーナ 東京ベイ,electronic,female,同行,r,5.0,,同行,2026-06-26 09:58:05,2026-06-27 03:01:23,,deleted,1,35000,"Wゲート
2連中1枚
初期当選/有能期限内/下3桁提示可
開場時間15分前に会場付近で待ち合わせし、同時入場していただきます。
詳しい待ち合わせ時間・場所等は、ご入金後にマイページの連絡ボードでお知らせします。
本人確認、ランダムエラー、公共交通機関の遅延、体調不良、座席等のクレームなど如何なる理由でも返金いたしかねます。公演中止の場合のみ返金いたします。",True,2026-06
0a6rh0lsjb,1782468959528,west-live-tour-yuitsumuni,2026-06-27,18:00,[千葉県] ららアリーナ 東京ベイ,electronic,female,入金後24時間以内にQRコード共有,ty,5.0,,QR,2026-06-26 10:15:59,2026-06-26 14:01:13,,deleted,2,18000,"WゲートQR毎2連のお譲りです。購入後、ログイン情報をお伝えいたします。同行者登録は買い手様でお願い致します。ご自身の端末で入場していただき、発券後にすぐログアウトし、開演までに受け取り連絡していただきます。初期当選、着ブロ制作開放なし。有効期限内。すり替えなし。体調不良（コロナ感染含む）や検温での入場不可、本人確認やQR読み取りエラー、ランダムエラーなどによる入場トラブルに返金対応致しかねます。
デジタルチケットのため、座席に関するクレームは一切お受けしません。仕事や法事、急用、交通機関トラブルなどいかなる理由でもキャンセルできません。録画録音などマナー違反しない方、日本語が通じる方でお願いします。充電不足や速度制限などによる受け取り連絡遅延はお受けできませんのでご了承ください。お渡し後はサイドチェンジ等ご自由にしてください。最後まで責任持ってお取引頂ける方、お待ちしてます。",True,2026-06
zhu7jjl8e9,1782468133069,west-live-tour-yuitsumuni,2026-06-27,18:00,[千葉県] ららアリーナ 東京ベイ,electronic,female,同行,りぼん,5.0,,ランダム,2026-06-26 10:02:13,2026-06-26 12:01:15,,deleted,1,15000,"座席未定/ランダム配布
当日は開場20分前に集合をお願いいたします。
一定時刻を過ぎた遅刻は待たずに入場しますが、その場合も受け取り評価まで行っていただきます。
複数名義所持しておりますので、当方の座席選択後にランダムで配布いたします。
入場時に端末をお借りすることもありますのでご協力ください。
チケットお渡しと同時に受け取り評価をお願いいたします。
公式発表による公演中止の場合のみ、手数料を差し引いた金額の返金を行います。体調不良･公共交通機関の乱れ･ランダムエラー等により入場不可能な場合もキャンセル対応いたしません。必ず受け取り評価していただきます。
デジタルチケットに理解のある日本人女性のみご購入をお願いいたします。代理購入は御遠慮ください。
購入後のキャンセル･クレームは受け付けませんので、上記すべての内容にご理解のうえ購入をお願いいたします。
当日の集合等、詳細は購入後お伝えいたします。
購入後、当日連絡のとれる電話番号をお送りください。",True,2026-06
ym153e2j5f,1782468339089,west-live-tour-yuitsumuni,2026-06-27,18:00,[千葉県] ららアリーナ 東京ベイ,electronic,female,同行,ゆ,4.8,,ランダム,2026-06-26 10:05:39,2026-06-27 05:01:26,,deleted,2,90000,"【条件あり】一度チケットを回収しこちらがチケットを選択した後にランダムで配布致します。以下の条件を了承された方のみご購入ください。
【集合・受け取りまで】
会場付近にて集合し、同時入場させて頂きます。集合時間は開場の20分前を予定しています。
遅刻された場合先に入場致しますが、その際も受取り連絡はさせて頂きます。時間に余裕を持って会場へお越し頂きますようお願い致します。
・重複当選の為、座席選択をさせて頂きます。ご購入者様に座席の選択権は御座いません。デジタルチケットの為、座席は未定です。
・当日購入者様の端末をお借りさせて頂き、チケットの発券を手伝って貰う場合がございます。
・入場後一度チケットを全て回収し、一度解散し、再度集合してチケットをお渡しします。
・チケットお渡しと引き換えにその場で受取り連絡させて頂きます。その場で行って頂けない場合は、チケットをお渡しすることは出来ませんのでご了承ください。
【その他注意事項】
・当日如何なる座席でもクレームは一切お受け出来ません。
・公演中止以外の返金は一切できません。公演中止の場合のみ返金致します。",True,2026-06
frah3hclzq,1782470931191,west-live-tour-yuitsumuni,2026-06-27,18:00,[千葉県] ららアリーナ 東京ベイ,electronic,female,入金後すぐにQRコード共有,ユカ,5.0,,QR,2026-06-26 10:48:51,2026-06-26 13:01:12,,deleted,2,29000,"入場口W WEST FC先行 初期当選 2枚申し込み 指定席 QRごとのお譲り 条件ございません 座
席未定
WEST FC先行 ２枚申込みでの当選
１回目の申し込みで当選、
入場口：W　席種：指定席になります。
復活当選、制作開放、立見指定ではございません。
有効会員です。複数当選ございません。
当選公演はこの公演のみになります。
支払い方法ペイジー選択にて
銀行ATMにて現金でお支払いも完了しております。
QRコードごとのお譲りになります。条件もございません。
同行者登録は購入者様のほうでお願い致します。
QRコード表示に必要な会員番号、パスワードをお知らせさせていただきます。
公演中止以外での返金は致しかねます。ご了承ください。
公演中止の場合は、手数料を差し引いたを金額を返金させていただきます。",True,2026-06
f9ist89mqs,1782470271628,west-live-tour-yuitsumuni,2026-06-27,18:00,[千葉県] ららアリーナ 東京ベイ,electronic,none,購入確認でき次第、ログイン情報をお送りします。,ぽん,5.0,,QR,2026-06-26 10:37:51,2026-06-27 09:01:20,2026-06-26 13:01:12,sold,2,6000,座席未定/Xゲート（立見）/制作開放/QRごと/有効期限内名義/PayPay/発送物戻りなし/重複なし/下３桁提示可能/公演中止の際のみ全額返金致します。その他のいかなる理由でも返金いたしかねます。,True,2026-06
f5e8xlh1h8,1782468603708,west-live-tour-yuitsumuni,2026-06-27,18:00,[千葉県] ららアリーナ 東京ベイ,electronic,female,お待ち合わせ後ログイン情報を入力,つきのちびうさ,5.0,,QR,2026-06-26 10:10:03,2026-06-26 23:01:20,,deleted,2,20000,"スタンドゲートQRごとです。
すり替えなし/会員番号の下3桁提示可
開場20分前に会場付近にてお待ち合わせいただき、こちらで買い手様のスマホにログイン情報を入力させていただきます。
台風や大雨の影響もあるかもしれませんので、必ず入場開始時間の20分前にはお待ち合わせいただけるようにご計画下さい。
ランダムエラー、本人確認、応援されているタレントの出演中止など如何なる場合もキャンセル、返金等はできかねます。
但し公演中止の際はサイト手数料を差し引いた金額を返金いたします。
最後までご不安のないよう対応させていただきます。
よろしくお願い致します。",True,2026-06
sold_1780821422740,1780821422740,west-live-tour-yuitsumuni,2026-06-28,12:00,[千葉県] ららアリーナ 東京ベイ,electronic,female,公演日前日までにログイン情報共有,,,,,2026-06-07 08:37:02,2026-06-28 03:01:23,2026-06-26 11:01:12,sold,2,58000,"QR毎 復活当選 座席未定 有効期限内 変更ボタンあり サイチェン可 同行登録可 下3桁提示可 発送物戻りなし 過去にエラーなし

履歴：AWARDドーム 1階...",False,2026-06
sold_1782381853059,1782381853059,west-live-tour-yuitsumuni,2026-06-28,12:00,[千葉県] ららアリーナ 東京ベイ,electronic,female,同行,,,,,2026-06-25 10:04:13,2026-06-28 03:01:23,2026-06-26 11:01:12,sold,1,25000,"制作開放席になります
同時入場
落札後のキャンセル、ランダムエラー、主催者側の公演中止以外の理由でのキャンセル、取引停止不可。
",False,2026-06
0zgayaca6v,1782472153074,west-live-tour-yuitsumuni,2026-06-27,18:00,[千葉県] ららアリーナ 東京ベイ,electronic,female,入金後、ログイン情報共有,あ,5.0,,QR,2026-06-26 11:09:13,2026-06-26 20:01:14,,deleted,2,0,"Lゲート
・同行者登録はご購入者様がご自身で行なって下さい。
・公演中止以外のいかなる場合でもキャンセル致しかねます。
・公演中止の場合は、手数料を引いた全額返金いたします。
・チケット発券後、速やかにログアウト・受け取り通知お願いいたします。
・日本人女性のみご購入下さい。",True,2026-06
sold_1782472397997,1782472397997,west-live-tour-yuitsumuni,2026-06-27,18:00,[千葉県] ららアリーナ 東京ベイ,electronic,female,入金後24時間以内にQRコード共有,,,,,2026-06-26 11:13:17,2026-06-27 09:01:20,2026-06-26 12:01:15,sold,2,17000,"FC初期当選
有効期限内会員　クレカ支払い（同一なし）
QR毎でのお譲りのため同時入場等の条件はございません。
また制作開放や着ブロでもございません。
公演前日...",False,2026-06
i6i0znx1dl,1782475194757,west-live-tour-yuitsumuni,2026-06-27,18:00,[千葉県] ららアリーナ 東京ベイ,electronic,female,同行,kt,5.0,,同行,2026-06-26 11:59:54,2026-06-26 17:01:17,,deleted,1,0,"初期当選、不備なし名義で重複無し同行
Lゲート
本確対応不可/サイチェン可/下三桁提示可/濵田担不可
連番内の座席選択権はございません。
開場10分前集合を予定しております。
ランダムエラーや交通機関による遅刻、体調不良、一部メンバーの出演不可等公演中止以外の如何なる理由でも返金、キャンセル不可です。
上記理解した日本語の通じる方のみご購入をお願いいたします。",True,2026-06
6maaonk1vg,1782475138757,west-live-tour-yuitsumuni,2026-06-27,18:00,[千葉県] ららアリーナ 東京ベイ,electronic,female,入金後すぐにQRコード共有,ユカ,5.0,,QR,2026-06-26 11:58:58,2026-06-27 03:01:23,,deleted,2,17000,"制作開放席当選枠 入場口K WEST FC先行 2枚申し込み 指定席 QRごとのお譲り 条件ございません 座 席未定
制作開放席当選枠の指定席になります。
WEST FC先行 ２枚申込みでの当選
入場口：K　席種：指定席になります。
有効会員です。複数当選ございません。
当選公演はこの公演のみになります。
お支払いも完了しております。
QRコードごとのお譲りになります。条件もございません。
同行者登録は購入者様のほうでお願い致します。
QRコード表示に必要な会員番号、パスワードをお知らせさせていただきます。
公演中止以外での返金は致しかねます。ご了承ください。
公演中止の場合は、手数料を差し引いたを金額を返金させていただきます。",True,2026-06
tfbnw3rpe5,1782474936416,west-live-tour-yuitsumuni,2026-06-27,18:00,[千葉県] ららアリーナ 東京ベイ,electronic,female,同行,あ,5.0,,ランダム記載あり,2026-06-26 11:55:36,2026-06-27 06:01:20,,deleted,1,210000,"Lゲート/重複すり替えなし/下3桁提示可/小瀧担不可
開場10分前頃に会場付近に集合予定です。詳細はマイページにてご連絡いたします。
公演中止の場合のみ返金いたします。その他ランダムエラー等公演中止以外の返金は致しかねますのでご了承ください。
大幅です遅刻は待たずに入場します。その場合も受取り通知をしていただきます。",True,2026-06
40944l5qr5,1782471711248,west-live-tour-yuitsumuni,2026-06-28,12:00,[千葉県] ららアリーナ 東京ベイ,electronic,none,同行,m,5.0,,番手,2026-06-26 11:01:51,2026-06-27 10:01:20,,deleted,2,30000,"制作開放 2名義中2番手 座席未定
有効期限内 下3桁提示可能
開場時間の10分前を目安にこちらが指定した場所に集合をし同時入場して頂きます。
時間厳守。天候不良等による交通機関の遅れが生じた場合でも、万が一集合時間に遅れた場合は、先に入場させて頂く場合がございます。その際の返金には対応しかねます。
詳しい場所や時間などは連絡ボードにてご連絡いたします。
複数名義所持の為同時入場した後、一旦チケットを回収させて頂き、座席を確認した後お渡しいたします。
チケットを受け取りの際に、必ずその場で受け取り連絡をお願いします
公演中止、延期の場合のみ手数料を引いた金額を返金いたします。
入場時、同行者の方と別れてご入場いただく場合がございますが、必ず連番のチケットをお渡しいたしますので、ご了承ください。
入場時のランダム等によるエラーや購入者様の都合(体調不良を含む)によるキャンセル、返金は一切行いません。
なお座席へのクレームもお受けいたしません。
以上全てにご了承いただける方のみ購入お願いいたします。",True,2026-06
sold_1782448333694,1782448333694,west-live-tour-yuitsumuni,2026-06-28,12:00,[千葉県] ららアリーナ 東京ベイ,electronic,none,公演日1日前までにQRコード共有,,,,,2026-06-26 04:32:13,2026-06-28 03:01:23,2026-06-26 12:01:15,sold,2,30000,QRコードごと 有効期限内 買い手様の方で同行者登録をお願いします,False,2026-06
dlt0zfkfh4,1782474801224,west-live-tour-yuitsumuni,2026-06-28,12:00,[千葉県] ららアリーナ 東京ベイ,electronic,none,公演日1日前までにQRコード共有,た,4.9,,QR,2026-06-26 11:53:21,2026-06-28 02:01:15,,deleted,2,36000,QRコードごと 有効期限内 買い手様の方で同行者登録をお願いします,True,2026-06
fuss0ufn6b,1782475054006,west-live-tour-yuitsumuni,2026-06-28,17:00,[千葉県] ららアリーナ 東京ベイ,electronic,none,同行,た,4.9,,ランダム,2026-06-26 11:57:34,2026-06-28 07:01:20,,deleted,1,14500,"【開演25分前までに半券お渡し:1枚37500円、アリーナ階にて半券お渡し:1枚90000円にて対応可能です。ご希望の場合は編集しますので必ずコメントください。ご希望がない場合はこのままご購入ください】
複数名義分のチケットを所持しております。
当日は開場30分前を目安に会場付近でお待ち合わせさせていただきます。ご一緒に入場後、チケットは一度回収し、その後ご連絡のうえでお渡しいたします。
※お座席に関するクレーム・ご要望は一切お受けできませんので、あらかじめご了承ください。 ※待ち合わせ時間に遅れた場合も、受け取り連絡（評価）はお願いしております。その際のご返金はできかねますのでご注意ください。
複数名義分を所持している都合上、チケットの選定にお時間をいただく場合がございます。あらかじめご理解のほどお願いいたします。
来られなくなった場合もキャンセルは不可のため受取連絡をお願いします
日本語の通じる、日本で通話可能な電話番号をお持ちの方のみ購入をお願いします",True,2026-06
w48cu84gfi,1782472416599,west-live-tour-yuitsumuni,2026-06-28,17:00,[千葉県] ららアリーナ 東京ベイ,electronic,female,同行,Uuu,5.0,,同行,2026-06-26 11:13:36,2026-06-27 21:01:25,,deleted,1,50000,"FC初期当選/着ブロ指定なし/重複なし同行/すり替えなし/下3桁提示可
プライベート出品に切り替えさせていただく場合ございます。
・連番内の座席はこちらで決めさせていただきます。お選びいただくことはできませんのでご承知おきください。
・入場後速やかに受け取り連絡をお願い致します。
・当日は開演時間の30分前を目安に会場付近にて集合を予定しております。
・公演中止以外いかなる場合もキャンセル返金対応は一切致しかねます。
公演中止の場合のみ手数料を引いた額を返金致します。
・交通機関の乱れを含み大幅に遅刻される場合はお待ちせずに入場する場合もありますが、その場合でも受け取り評価はしていただきます。",True,2026-06
sold_1780910673405,1780910673405,west-live-tour-yuitsumuni,2026-06-28,17:00,[千葉県] ららアリーナ 東京ベイ,electronic,female,公演前日にログイン情報共有,,,,,2026-06-08 09:24:33,2026-06-28 08:01:24,2026-06-26 12:01:15,sold,2,38000,"初期当選　QRごと2連のお譲り
仕事の都合で行けなくなってしまい、出品いたします。
他FC含め今までエラー無し　郵便物戻りなし　
Pay-easy支払い済　有効...",False,2026-06
