ticket_id,created_at_unix,event_id,perf_date,perf_time,venue,ticket_type,name_type,delivery_method,seller_name,seller_rating,order_num,ticket_tags,first_observed_at,last_observed_at,sold_at,status,quantity,price,raw_description,details_fetched,year_month
azocwmogf5,1782177541065,west-live-tour-yuitsumuni,2026-06-28,12:00,[千葉県] ららアリーナ 東京ベイ,electronic,female,ログイン情報共有,な,5.0,,同行記載あり,2026-06-23 01:19:01,2026-06-27 13:01:22,,deleted,2,58000,"QRごと/初期当選分/有効期限内/着ブロ申込なし
郵送物戻りなし
購入後会員番号下3桁提示可 下記事項にご了承いただける方のみ申請をお願いいたします。 購入後、公演前日にQRコード表示に必要なログイン情報をメッセージにてお知らせいたします。
当日入場後は速やかにファンクラブログアウト、受取完了のご連絡をお願いいたします。 名義人の身分証明書の貸し出しはいたしません。
同行者登録はログイン情報共有後ご自身でお願いいたします。
用意されたお座席に納得がいかない、希望するお座席ではなかった等の理由でのキャンセル、返金要請、送金停止依頼などの迷惑行為はお辞めください。 お座席に納得がいかなかった場合はご自身でサイドチェンジ等行ってください。
その場合、こちらでは責任を負いませんのですべて自己責任でお願いいたします。 ログイン後、マイページの登録情報や公演申込履歴などQRコード表示、該当公演に関するページ以外へのアクセスはお控えください。
購入後のキャンセル、座席等のクレーム、買い手様の急な体調不良や公共交通機関の遅延等でのキャンセルや公演中止以外での返金はいたしません。 やむを得ず公演に参加できない場合はご自身で代わりに入場される方を探してください。
その場合も必ず受取完了の手続きをお願いいたします。 ランダムエラーで入場できなかった場合も自己責任のため返金はいたしません。
買い手様ご自身の違反行為で退場となった場合もこちらには何の責任もございませんので返金対応はいたしません。 不明な点や質問等は購入申請前に必ずお問合せください。 値下げ要請や過去の当選履歴等に関する非常識なコメントは削除、ブロックいたしますのでご了承ください。
コンビニ払いの申請通しておりませんのでご了承ください。 上記をよくお読みいただき、すべてご了承いただける日本人の方のみ申請をお願いいたします。",True,2026-06
sold_1781277376837,1781277376837,west-live-tour-yuitsumuni,2026-06-26,18:00,[千葉県] ららアリーナ 東京ベイ,electronic,female,QRごと/公演日前日にFCのログイン情報をお伝えします。,,,,,2026-06-12 15:16:16,2026-06-26 09:01:12,2026-06-23 03:01:15,sold,2,30000,"QRコード毎のお譲り・FC先行初期当選・下3桁提示可能・有効期限内・着ブロなし・座席未定・すり替え重複なし

公演の前日にログイン情報をお伝えいたします。
公演...",False,2026-06
brn1mkoxd4,1782181707150,west-live-tour-yuitsumuni,2026-06-28,12:00,[千葉県] ららアリーナ 東京ベイ,electronic,female,入金後24時間以内にQRコード共有,S,5.0,,QR,2026-06-23 02:28:27,2026-06-28 03:01:23,2026-06-23 04:01:11,sold,2,22000,"リリーフ取得／2連番／QR毎
プライベート出品に切り替え希望の方はお声がけくださいませ。
同一クレカ・回線・名義等一切御座いません。
・公演前日に必要な情報を連絡ボードにてお知らせいたします。
・座席に関するクレーム等は一切受け付けません。
・公演中止以外のいかなる場合でも返金は致しません。
ご自身の体調不良、ランダムエラー、その他のエラー、本人確認、交通機関の乱れによる遅刻等、いかなるトラブルの場合もキャンセルできません。必ず受取通知をしていただきます。
・公演中止の場合のみ手数料等引いた額を返金いたします。
・購入後は、上記の全てに同意したものとみなしますので、ご理解いただける方のみご購入お願いいたします。
取得実績100件以上、エラー報告現時点で無し。
保証は出来かねますがご参考くださいませ。
またプライベート出品に切り替え後は6時間以内のお支払いをお願いしております。
特別出品に変更の場合は3時間以内のお支払いで設定致します。
※購入後は、「上記の全てに同意したもの」とみなしますので、ご理解いただける方のみご購入お願いいたします。
No.70",True,2026-06
nchadg0u1x,1782181587953,west-live-tour-yuitsumuni,2026-06-28,12:00,[千葉県] ららアリーナ 東京ベイ,electronic,female,入金後24時間以内にQRコード共有,S,5.0,,QR,2026-06-23 02:26:27,2026-06-28 03:01:23,2026-06-23 14:01:21,sold,2,22000,"リリーフ取得／2連番／QR毎
プライベート出品に切り替え希望の方はお声がけくださいませ。
同一クレカ・回線・名義等一切御座いません。
・公演前日に必要な情報を連絡ボードにてお知らせいたします。
・座席に関するクレーム等は一切受け付けません。
・公演中止以外のいかなる場合でも返金は致しません。
ご自身の体調不良、ランダムエラー、その他のエラー、本人確認、交通機関の乱れによる遅刻等、いかなるトラブルの場合もキャンセルできません。必ず受取通知をしていただきます。
・公演中止の場合のみ手数料等引いた額を返金いたします。
・購入後は、上記の全てに同意したものとみなしますので、ご理解いただける方のみご購入お願いいたします。
取得実績100件以上、エラー報告現時点で無し。
保証は出来かねますがご参考くださいませ。
またプライベート出品に切り替え後は6時間以内のお支払いをお願いしております。
特別出品に変更の場合は3時間以内のお支払いで設定致します。
※購入後は、「上記の全てに同意したもの」とみなしますので、ご理解いただける方のみご購入お願いいたします。
No.69",True,2026-06
16r2v69ga3,1782181399186,uma-stage-2026,2026-08-08,18:00,[大阪府] ＳｋｙシアターＭＢＳ,paper,female,郵送or🌈千葉手渡し,n,5.0,,,2026-06-23 02:23:19,2026-06-28 17:01:50,,listing,1,20000,"FC該当枠/単番
レターパックライトにて発送いたしますので、ご購入後、メッセージにて送付先と電話番号をご提示下さい。
🌈アリツア千葉全日程いますので、そちらでの手渡しも可能です。
メッセージを頂けましたら、プラベルでの出品も可能です。(1.9/枚での出品)
公演中止以外、如何なる場合もキャンセル/返金不可です。よろしくお願いいたします。",True,2026-06
sold_1781761290741,1781761290741,west-live-tour-yuitsumuni,2026-06-27,18:00,[千葉県] ららアリーナ 東京ベイ,electronic,female,公演当日午前中にログイン情報共有,,,,,2026-06-18 05:41:30,2026-06-27 09:01:20,2026-06-23 04:01:11,sold,2,33000,"【本日20時まで】QRごとお譲り
初期当選 同行者登録可 着ブロ希望なし会員番号下3桁可能 郵便物戻りなどの不備等は一切なし 
 
友人の代理で出品しております...",False,2026-06
sold_1781185084400,1781185084400,west-live-tour-yuitsumuni,2026-06-28,12:00,[千葉県] ららアリーナ 東京ベイ,electronic,female,QRごとのお譲り,,,,,2026-06-11 13:38:04,2026-06-28 03:01:23,2026-06-23 04:01:11,sold,2,40000,"初期当選  下3桁提示可 有効期限内 Pay-easy決済

・ご購入者様ご自身で同行者登録、当日チェックをお願いいたします。

・公演2日前から前日にQR表示...",False,2026-06
dwuzhgvy0a,1782186581620,west-live-tour-yuitsumuni,2026-06-28,17:00,[千葉県] ららアリーナ 東京ベイ,electronic,female,公演日1日前までにQRコード共有,k,5.0,,QR,2026-06-23 03:49:41,2026-06-27 22:01:16,,deleted,2,65000,"QR毎/FC先行/初期当選/座席未定/指定席/着ブロ希望なし/有効期限内/下3桁提示可/同行者登録可/
座席に関する質問あればご連絡ください。
・公演日前日の夜にログイン情報をご連絡します。当日はご自身でQRを表示の上ご入場下さい。
・座席未定、座席のクレーム等はお受けいたしません。
・主催者による公演中止の場合のみ、手数料を差し引いた金額を返金いたします。
・公演中止以外のいかなる理由（本人確認、ランダムエラー、体調不良、交通トラブル、出演者の変更等）で入場出来なかった場合も返金対応は一切致しません。
・入場後は速やかにログアウトの上、必ず開演前に受取連絡をお願い致します。
・ご購入後の買い手様都合のキャンセルは、いかなる理由においてもお受けいたしません。
・録音・撮影等の名義を傷つけるような行為は全ておやめください。",True,2026-06
f5ioe6q7q2,1782188144205,west-live-tour-yuitsumuni,2026-06-28,12:00,[千葉県] ららアリーナ 東京ベイ,electronic,female,公演日前日にQRコード共有,あや,5.0,,QR,2026-06-23 04:15:44,2026-06-23 12:01:13,,deleted,1,22000,"QR毎/1枚/RELIEF Ticket取得
業者取得・重複電話番号・重複クレカ等ございません。
・入場の際のトラブル等は対応致しかねます。
・入場できなかった場合でも受け取り連絡をお願いいたします。
・公演日当日朝までにログイン情報をお伝えします。
・ログイン出来次第受け取り連絡、入場後は速やかにログアウトをお願いいたします。
・公演中止以外如何なる場合も返金不可
・身分証等の貸出不可
・チケットを発券する際に座席が判明するので座席に関するクレームは御遠慮下さい。
・成人済み日本人女性の方のみでお願いいたします。
・こちらの指示に問題なく従っていただける方のみ。
購入後は上記の全てに同意されたものとしますのでご理解頂ける方のみご購入お願いいたします。
プラベルに切り替えますのでご希望の方はご連絡下さい。
URL送付後に音信不通になる方が多い為、6時間以内にご購入手続きをお願いいたします。",True,2026-06
sold_1782131246378,1782131246378,west-live-tour-yuitsumuni,2026-06-26,18:00,[千葉県] ららアリーナ 東京ベイ,electronic,female,QR毎、ログイン情報当日,,,,,2026-06-22 12:27:26,2026-06-26 09:01:12,2026-06-23 06:01:09,sold,2,30000,"QR毎のお譲りになります。
リセール取得のチケットです。

DMにてログイン情報お知らせいたします。当日待ち合わせも可能ですので、希望でしたらお知らせ下さい。...",False,2026-06
9a9dvxv8u6,1782193423696,roll-cake-time,2026-07-10,13:00,東京グローブ座,pickup_number,female,ご自身で発券,cocco,5.0,,QR,2026-06-23 05:43:43,2026-06-28 17:01:50,,listing,1,11000,"プレイガイド先行抽選分/単番
未発券の為、座席不明です。
発券番号毎お譲りいたしますので、ご自身で発券お願いいたします。
(発券まで座席は分かりませんので、ご自身でお確かめ下さい)
発券開始は6/29(月)14時〜
発券開始日に発券番号をお伝えいたしますので、コンビニで発券お願いいたします。
発券の際に手数料が発生する場合がございます。
チケット受け取り後は速やかに受取評価をよろしくお願いいたします。
座席についてのクレーム等一切受け付けません。
いかなる場合もキャンセル不可です。
公演中止の際にのみ、手数料を差し引いた額を返金いたします。
よろしくお願いいたします。",True,2026-06
tan4q1dqvx,1782193541893,roll-cake-time,2026-07-23,18:00,東京グローブ座,pickup_number,female,ご自身で発券,cocco,5.0,,QR,2026-06-23 05:45:41,2026-06-28 17:01:50,,listing,1,11000,"プレイガイド先行抽選分/単番
未発券の為、座席不明です。
発券番号毎お譲りいたしますので、ご自身で発券お願いいたします。
(発券まで座席は分かりませんので、ご自身でお確かめ下さい)
発券開始は6/29(月)14時〜
発券開始日に発券番号をお伝えいたしますので、コンビニで発券お願いいたします。
発券の際に手数料が発生する場合がございます。
チケット受け取り後は速やかに受取評価をよろしくお願いいたします。
座席についてのクレーム等一切受け付けません。
いかなる場合もキャンセル不可です。
公演中止の際にのみ、手数料を差し引いた額を返金いたします。
よろしくお願いいたします。",True,2026-06
7h7eepuy25,1782192849250,uma-stage-2026,2026-07-16,18:00,[東京都] PARCO劇場,paper,female,入金後24時間以内に郵送,cocco,5.0,,,2026-06-23 05:34:09,2026-06-27 09:01:20,,deleted,1,20000,"ご購入後にレターパックライトで郵送いたします。発送先住所をお知らせください。
チケット受け取り後は速やかに受取評価をよろしくお願いいたします。
座席についてのクレーム等一切受け付けません。
いかなる場合もキャンセル不可です。
公演中止の際にのみ、手数料を差し引いた額を返金いたします。
よろしくお願いいたします。",True,2026-06
s88chvp04y,1782197150994,uma-stage-2026,2026-07-23,18:00,[東京都] PARCO劇場,paper,female,入金後速やかに準備し郵送致します。,sa,5.0,,,2026-06-23 06:45:50,2026-06-24 22:01:21,,deleted,1,12500,"FC該当枠/2連中1枚
定価手数料でのお譲りです。
レターパックライトにて発送いたしますので、ご購入後、メッセージにて送付先と電話番号をご提示下さい。
公演中止以外、如何なる場合もキャンセル/返金不可です。よろしくお願いいたします。",True,2026-06
agantpxyg5,1782197363456,uma-stage-2026,2026-07-24,13:00,[東京都] PARCO劇場,paper,female,入金確認後準備出来次第発送致します。,sa,5.0,,,2026-06-23 06:49:23,2026-06-28 17:01:50,,listing,2,12500,"一般一次 2連（バラ可能）
定価手数料でのお譲りです。
レターパックライトにて発送いたしますので、ご購入後、メッセージにて送付先と電話番号をご提示下さい。
🌈アリツア千葉全日程いますので、そちらでの手渡しも可能です。
公演中止以外、如何なる場合もキャンセル/返金不可です。よろしくお願いいたします。",True,2026-06
nvrri4cbnz,1782195091814,uma-stage-2026,2026-08-07,13:00,[大阪府] ＳｋｙシアターＭＢＳ,paper,female,入金後24時間以内に郵送,R♥,5.0,,,2026-06-23 06:11:31,2026-06-23 14:01:21,,deleted,1,25000,"ご購入後すぐにご住所等ご連絡ください。
レターパックプラスにて発送いたします。
座席についてのクレーム等一切受け付けません。
公演中止の際のみ半券を切り離していない状態のチケットをご返送いただきましたら、送料と手数料を差し引いた金額を返金いたします。その他いかなる理由でも返金対応いたしかねます。",True,2026-06
mtk9pkfxuo,1782198485999,roll-cake-time,2026-07-09,18:00,東京グローブ座,paper,female, 6/26.27.28らら手渡し、都内手渡し、郵送,R,5.0,,,2026-06-23 07:08:05,2026-06-28 17:01:50,,listing,1,13000,"6/26.27.28ららアリーナでの事前手渡しもしくは都内事前手渡し。
郵送ご希望の場合はレターパックプラスにて発送します。
公演中止以外の返金不可",True,2026-06
catm2x61lx,1782203289570,west-live-tour-yuitsumuni,2026-06-28,12:00,[千葉県] ららアリーナ 東京ベイ,electronic,female,同行・少数ランダム配布,H,4.5,,ランダム,2026-06-23 08:28:09,2026-06-27 17:01:19,,deleted,1,21000,"【条件あり】
入場後こちらが座席を選んだあとランダムでお渡し致します。
座席はお選びいただけません。
座席に関するクレームは一切受け付けません。
お座席のお渡しは開演の5〜10分前を予定しております。
・開場時間前15〜30分前を目安にこちらが提示した時刻に会場付近で集合し同時入場して頂きます。
・詳しい場所、時間は入金後マイページの連絡ボードにてお知らせ致します。お時間に余裕があり、柔軟に対応できる方のみご購入ください。5分以上遅れますと先に入場します。その場合でも受け取りはしていただきます。
いかなる理由でも送金停止される方はご購入をお控えください。
・入場後チケットを回収し、一度解散いたします。再度ご連絡させていただき指定の場所にて合流しチケットをお渡しさせていただきます。
その際チケットのお渡しに時間がかかりますので予めご了承ください。
・同行者登録に必要な情報をお伺いする場合がございますので、その際はご協力をお願い致します。
・買い手様都合の事情、出演者の変更、本人確認、ランダムエラー等いかなる場合でも返金は致しかねます。
・チケットをお渡しした後は、速やかに受け取り連絡をお願い致します。
・スムーズにお取引させていただきたいので公演当日電話番号の交換をお願いいたします。
・スムーズに連絡が取れる日本人女性のみご購入ください。
・公演中止のみ手数料を差し引いた金額を返金致します。
上記すべてにご了承いただける方のみ、ご購入をお願いいたします。",True,2026-06
sold_1781612552963,1781612552963,roll-cake-time,2026-08-11,18:00,森ノ宮ピロティホール,paper,female,郵送,,,,,2026-06-16 12:22:32,2026-06-28 17:01:50,2026-06-23 09:01:12,sold,2,13000,"FC先行/下3桁提示可能/すり替えなし/
該当名義/有効期限内/公演中止の際のみ手数料と送料を引いた額を返金します。",False,2026-06
aribhno3wk,1782205971893,roll-cake-time,2026-08-24,13:00,[福岡県] キャナルシティ劇場,paper,female,郵送または手渡し,☆,5.0,,,2026-06-23 09:12:51,2026-06-28 17:01:50,,listing,1,0,"※7/6 8/2 東京他日程との交換も可
6/26～28千葉公演での手渡し、当日手渡しも可能です。（購入後ご希望のお取引方法をお知らせ下さい）
郵送希望の場合はレターパックプラスにて発送いたします。
公演中止以外の返金や取引キャンセルは出来かねます。お手元に届き次第速やかに受け取り連絡をお願いいたします。
ご購入頂いた方は上記すべての内容に同意されたものとみなします。",True,2026-06
dl2ny8kd4d,1782209933125,west-live-tour-yuitsumuni,2026-06-26,18:00,[千葉県] ららアリーナ 東京ベイ,electronic,female,2日前までにQRコード共有,n,5.0,,QR,2026-06-23 10:18:53,2026-06-25 16:01:11,,deleted,2,40000,"プライベート出品にしたいため、購入希望の方はメッセージをお願いします。
FC先行/初期当選/座席未定/QR毎/下3桁提示可/有効期限内/発送物戻りなし/着ブロ希望なし/同一クレカ決済なし
公演日3日前までにログインに必要な情報をお伝えします。
QRコード表示画面以外のページを意図的に表示する行為、会員情報の悪用、登録情報の変更、代理購入、QR再転売は一切禁止といたします。
同行者登録はご自身でお願いします。
主催者側からの公演中止の場合のみ、必要な手数料を差し引いた金額を返金します。
ランダムエラー、本人確認、電波環境、体調不良等で入場できなかった場合でも、受取評価はしていただきます。もしも本人確認された場合でもこちらの名義を売るような行為はおやめください。
公演中止以外いかなる場合も返金不可。送金停止依頼等一切応じません。
座席に関するクレームは一切お受けできませんのでご了承ください。
入場後すぐにログアウト、開演前までに必ず受取評価してください。盗撮録音など名義に傷を付ける行為をしないようお願いいたします。
ご購入の時点で上記全ての条件に同意したものとみなします。",True,2026-06
xk1e5siaqv,1782209013365,west-live-tour-yuitsumuni,2026-06-28,12:00,[千葉県] ららアリーナ 東京ベイ,electronic,female,同行,あ,5.0,,同行,2026-06-23 10:03:33,2026-06-24 14:01:23,,deleted,1,30000,"リセールにて2連取得、当方と同行
サイチェン可
連番内の座席選択後、すぐにチケットをお渡しします。
本人確認対応不可
公演中止以外での返金は如何なる場合も返金不可
上記ご了承いただける成人済みの日本人女性のみご購入ください。
質問等あればお問い合わせください。",True,2026-06
l27pzf7co2,1782210634680,roll-cake-time,2026-07-06,18:00,東京グローブ座,paper,none,公演日7日前までに郵送,野崎梅太郎,5.0,,,2026-06-23 10:30:34,2026-06-28 17:01:50,,listing,1,150000,"ららアリーナor大阪市内での事前手渡し可
郵送の場合は手数料＋‪αした上で簡易書留にて発送します。
即決額出せる方のみ✉️返信いたします。",True,2026-06
v5628n4yfu,1782215035342,west-live-tour-yuitsumuni,2026-06-28,12:00,[千葉県] ららアリーナ 東京ベイ,electronic,female,前日18時以降にログインに必要な情報をお伝えします。,Li,5.0,,,2026-06-23 11:43:55,2026-06-23 15:01:24,,deleted,2,26000,"リセール取得チケットとなります。
前日18時以降にログイン情報をお伝えさせて頂きます。
お座席やゲートのクレーム等いかなる理由でもお取引後のキャンセルは致しかねます。",True,2026-06
sknk0rq1u9,1782212793859,roll-cake-time,2026-07-25,13:00,東京グローブ座,paper,female,公演日7日前までに郵送,み,5.0,,,2026-06-23 11:06:33,2026-06-28 17:01:50,,listing,1,23000,"FC先行/有効期限内/該当名義
レターパックプラスにて発送
到着後は速やかに受取通知をお願いいたします
如何なる理由でも公演中止以外での返金不可
プラベ出品させて頂きます",True,2026-06
655fmsk7av,1782212969281,roll-cake-time,2026-08-02,13:00,東京グローブ座,paper,female,公演日7日前までに郵送,み,5.0,,,2026-06-23 11:09:29,2026-06-28 17:01:50,,listing,1,20000,"FC先行/有効期限内/該当名義
※配送時のトラブルの為、チケットが少々曲がっております。気にされる方はご購入をご遠慮ください。
レターパックプラスにて発送
到着後は速やかに受取通知をお願いいたします
如何なる理由でも公演中止以外での返金不可
プラベ出品させて頂きます",True,2026-06
6abgyl1n5j,1782217225057,akechico,2026-07-11,12:30,[東京都] EX THEATER ARIAKE (東京ドリームパーク内),paper,female,公演日7日前までに郵送,a🎀,5.0,,,2026-06-23 12:20:25,2026-06-28 17:01:50,,listing,1,0,WESTꓸFC先行のチケットで、神山客降り通路真横です。,True,2026-06
jvna6v9ok8,1782222311640,west-live-tour-yuitsumuni,2026-06-27,18:00,[千葉県] ららアリーナ 東京ベイ,electronic,female,入金後24時間以内にQRコード共有,S,5.0,,QR,2026-06-23 13:45:11,2026-06-27 09:01:20,2026-06-23 22:01:18,sold,2,21500,"リリーフ取得／2連番／QR毎
プライベート出品に切り替え希望の方はお声がけくださいませ。
同一クレカ・回線・名義等一切御座いません。
・公演前日に必要な情報を連絡ボードにてお知らせいたします。
・座席に関するクレーム等は一切受け付けません。
・公演中止以外のいかなる場合でも返金は致しません。
ご自身の体調不良、ランダムエラー、その他のエラー、本人確認、交通機関の乱れによる遅刻等、いかなるトラブルの場合もキャンセルできません。必ず受取通知をしていただきます。
・公演中止の場合のみ手数料等引いた額を返金いたします。
・購入後は、上記の全てに同意したものとみなしますので、ご理解いただける方のみご購入お願いいたします。
取得実績100件以上、エラー報告現時点で無し。
保証は出来かねますがご参考くださいませ。
またプライベート出品に切り替え後は6時間以内のお支払いをお願いしております。
特別出品に変更の場合は3時間以内のお支払いで設定致します。
※購入後は、「上記の全てに同意したもの」とみなしますので、ご理解いただける方のみご購入お願いいたします。
No.71",True,2026-06
