ticket_id,created_at_unix,event_id,perf_date,perf_time,venue,ticket_type,name_type,delivery_method,seller_name,seller_rating,order_num,ticket_tags,first_observed_at,last_observed_at,sold_at,status,quantity,price,raw_description,details_fetched
tw5bdjw7pp,1778223594111,are-you-red-y,2026-07-26,18:00,東京ドーム,electronic,female,同行,☆,5.0,,ランダム,2026-05-08 06:59:54,2026-06-21 20:01:03,,listing,1,10000,"有効期限内名義／初期当選／ペイジー決済
・公演当日、開場時間の約30分前を目安に会場付近にて集合し、同時入場して頂きます。集合時間のご要望は承りませんので、時間に余裕の無い方は御遠慮ください。交通機関の遅延や運休など含め、いかなる事情でも遅刻はお待ちできません。遅刻した場合でも受け取り連絡をしていただきますのでご了承ください。
・購入後、公演当日繋がる電話番号を連絡ボードにてご提示ください。
・チケット回収後は、座席選択にお時間いただきますので一度解散いたします。開演前までに再度合流し、チケットをお渡しします。買い手様に座席はお選びいただけません。座席に関するクレームはご遠慮ください。
・トラブル防止のため、代理購入は不可とさせていただきます。必ず当日入場される方がご購入するようお願いいたします。
・体調不良、遅刻、ランダムエラー、公演中断、メンバーの欠席など、公演中止以外のいかなる場合もキャンセル、返金対応はいたしません。送金停止も受け付けません。
以上ご了承いただける成人済み日本人女性の方のみご購入よろしくお願いいたします。
公演中止の場合のみ、手数料を差し引いた金額を返金いたします。",True
gw708txrvz,1779631606697,are-you-red-y,2026-07-26,18:00,東京ドーム,electronic,none,3名義中1番手  当方と同行,ゆ,5.0,,同行番手,2026-05-24 14:06:46,2026-06-21 20:01:03,,listing,1,25000,"FC先行／2連中1枚／有効期限内／下3桁提示可
当方との連番になります。
公演当日、開場時間に会場付近にて集合し、同時入場して頂きます。詳しい待ち合わせ時間、場所については購入後取引連絡にてお伝えします。大幅な遅刻をされた場合は待たずに入場致します。入場出来なかった場合でも受取連絡はして頂きます。
連番内のお席は当方で選択させていただきます。サイドチェンジ等はご自由にしていただいて構いませんが、名義を傷つける行為はお控えください。
出演者変更、ご購入者様の体調不良、ランダムエラー等、公演中止以外、如何なる場合でもキャンセルや返金対応は致しかねます。
公演中止の際は手数料を差し引いた金額を返金させて頂きます。
全ての記載内容にご納得いただける20歳以上の日本人女性の方、こまめに連絡の取れる方のみ、ご購入をお願い致します。
代理落札等はご遠慮ください。
記載内容以外のご希望には対応できかねますので、予めご了承ください。",True
sold_1778240162554,1778240162554,are-you-red-y,2026-07-26,18:00,東京ドーム,electronic,female,同行,,,,,2026-05-08 11:36:02,2026-06-21 20:01:03,2026-06-20 16:01:09,sold,2,13000,"初期当選/該当名義/2名義中2番手/すり替えなし/有効期限内名義/下3桁提示可能

2名義中2番手となるため、お座席はお選びいただけません。
場合によっては実際...",False
sold_1779332386924,1779332386924,are-you-red-y,2026-07-26,18:00,東京ドーム,electronic,female,同行,,,,,2026-05-21 02:59:46,2026-06-21 20:01:03,2026-06-20 16:01:09,sold,2,8000,"5名義中すり替えなしランダム/すり替え無し下3桁提示/全て有効期限内山田名義/前回スタンド名義のみ

公演当日、開場時間の30分前に集合して同時入場して頂きます...",False
7wxzz3fbr4,1779797947470,are-you-red-y,2026-07-26,18:00,東京ドーム,electronic,female,同行,さ,5.0,,ランダム,2026-05-26 12:19:07,2026-06-21 20:01:03,,listing,2,7000,"すり替えなしランダム配布 fc先行
およそ開演1時間前にお渡しできる見込み
下3桁提示可
開場30分前集合予定です。集合時間は厳守でお願いいたします。公共交通機関の遅延でも待つことはできかねます。
詳しい時間・場所は3日前までに連絡ボードにてお伝えいたします。
同時入場後全てのチケットを回収した後に、こちらでチケットを選んでからお渡しします。見込みよりもお時間がかかる場合がございますが、開演までには必ずお渡しします。
お座席に関してのクレームはお応えできかねます。
公演中止の場合以外の返金は不可とさせていただきます。ランダムエラーの際にも返金はできかねますのでご了承ください。
上記全てをご理解頂けた方のみご購入ください。ご購入された時点で全て合意頂けたものとみなします。",True
lb1smpt6v7,1781762634401,are-you-red-y,2026-07-26,18:00,東京ドーム,electronic,female,同行,y♡,5.0,,番手,2026-06-18 06:03:54,2026-06-21 20:01:03,,listing,2,11000,"ペンライト代行可能（別途料）
2名義中2番手/初期当選/重複すり替えなし/下3桁提示可
・2名義中2番手のお譲りになります。
・入場時のみ同行者様と分かれて入場して頂く場合もございますが、お渡しするチケットは必ず2連番になります。
・同時入場後、一度チケットを回収させて頂き、当方の座席より選択致しますので少しお時間を頂く場合がございます。その際、再度合流しチケットをお渡しするのをスムーズにする為に電話番号をお聞きし会場内でやり取りする場合がございますのでご協力お願い致します。
また、座席のクレームはお受けしかねます。
・当日は会場付近で待ち合わせ後、同時入場頂く予定です。そのため、時間厳守できる方でお願い致します。詳しくは日にちが迫り次第連絡ボードにてご連絡致します。
・公演中止以外の本人確認、システムエラー、検温等で入場出来ない等、いかなる場合でも返金は一切致しませんのでご了承ください。",True
hh0n5wveh0,1780311104303,are-you-red-y,2026-07-26,18:00,東京ドーム,electronic,female,当日発券,♥️,5.0,,同行,2026-06-01 10:51:44,2026-06-21 20:01:03,,listing,1,0,"6名義重複しており、同名義数出して1番手で連番出来る方を探しております。
買い足し等可能です。
お心当たりのある方はメッセージいただけると嬉しいです。
よろしくお願いいたします。",True
mhyno20bz4,1778223044857,are-you-red-y,2026-07-26,18:00,東京ドーム,electronic,female,同行,☆,5.0,,ランダム,2026-05-08 06:50:44,2026-06-21 20:01:03,,listing,1,10000,"有効期限内名義／初期当選／ペイジー決済
・公演当日、開場時間の約30分前を目安に会場付近にて集合し、同時入場して頂きます。集合時間のご要望は承りませんので、時間に余裕の無い方は御遠慮ください。交通機関の遅延や運休など含め、いかなる事情でも遅刻はお待ちできません。遅刻した場合でも受け取り連絡をしていただきますのでご了承ください。
・購入後、公演当日繋がる電話番号を連絡ボードにてご提示ください。
・チケット回収後は、座席選択にお時間いただきますので一度解散いたします。開演前までに再度合流し、チケットをお渡しします。買い手様に座席はお選びいただけません。座席に関するクレームはご遠慮ください。
・トラブル防止のため、代理購入は不可とさせていただきます。必ず当日入場される方がご購入するようお願いいたします。
・体調不良、遅刻、ランダムエラー、公演中断、メンバーの欠席など、公演中止以外のいかなる場合もキャンセル、返金対応はいたしません。送金停止も受け付けません。
以上ご了承いただける成人済み日本人女性の方のみご購入よろしくお願いいたします。
公演中止の場合のみ、手数料を差し引いた金額を返金いたします。",True
bc81vhvedw,1778315154891,are-you-red-y,2026-07-26,18:00,東京ドーム,electronic,female,同時入場,にゃん,5.0,,番手,2026-05-09 08:25:54,2026-06-21 20:01:03,,listing,2,20000,"初期当選3名義中3番手／該当名義／有効期限内／すり替えなし／下3桁掲示可能／座席未定
公演当日、開演2時間前（変動する可能性あり）に会場付近にて待ち合わせし、同時入場していただきます。
3名義中3番手をお渡しします。
・座席に対するクレーム等は一切受け付けません。
・入場する前にその場で受け取りのご連絡をしていただきます。
・同行者登録、また、QRコードのログインをお願いする場合がございます。
・ランダムエラー、体調不良、交通機関の遅延等入場などにより入場出来なかった場合でも返金は致しません。必ず受け取りのご連絡をしていただきますのでご了承ください。
・公演中止場合のみサイトから返金をお待ちください。
プライベート出品にて対応させていただきたいため、購入をご希望の方はまずメッセージをお願いいたします。
トラブル防止の為、以上の内容に全てご了承頂ける日本語が通じる女性のみご購入をお願い致します。",True
ernj1y7lbz,1780982113341,are-you-red-y,2026-07-26,18:00,東京ドーム,electronic,female,同行,こ,5.0,,,2026-06-09 05:15:13,2026-06-21 20:01:03,,listing,1,10000,"5名義中5番手/初期当選/下3桁提示可能/すり替えなし/山田名義
公演当日こちらが指定した時間、場所に来て頂き同時入場して頂きます。複数名義所持しておりますので、入場後チケットを回収させて頂き座席選択後5番目にチケット選んでいただきます。お時間かかる場合がございます。
開演10分前までには必ずお渡し致します。
場合がございますのでご了承ください。
チケット持ち逃げ防止のため一時的に身分証をお預かりする場合がございますので必ずご持参をお願い致します。
・待ち合わせに遅刻
・体調不良
・座席に関するクレーム
・入場時のエラー等
公演中止以外の上記に対する返金は対応致しませんのでご了承ください。
ご購入頂きました時点で、上記条件を全て御理解、ご承知をして頂いたとみなし、お取引を進めさせて頂きます。
日本人女性の方のみご購入お願いいたします。",True
sold_1778220114980,1778220114980,are-you-red-y,2026-07-26,18:00,東京ドーム,electronic,female,同行,,,,,2026-05-08 06:01:54,2026-06-21 20:01:03,2026-06-20 16:01:09,sold,2,8000,"アリーナorスタンド下段（1階席）確約ランダム配布/入場名義は全て有効期限内山田名義エラー経験･郵送物戻り無し
公演当日、開場時間の20分前に集合して同時入場し...",False
nb9nq28x3s,1778225115362,are-you-red-y,2026-07-26,18:00,東京ドーム,electronic,female,ランダム配布,3,5.0,,ランダム,2026-05-08 07:25:15,2026-06-21 20:01:03,,listing,2,8000,"公演当日、開場の30分前に会場付近にて待ち合わせ、同時入場をお願いします。詳細な時間・場所につきましては、当日までに連絡ボードにてお知らせいたします。
※必ず時間厳守をお約束いただける方のみご購入下さい。交通機関の乱れ、体調不良や電波不良等いかなる理由でも、大幅に遅刻された場合は先に入場しますが、受取連絡はしていただき返金対応は一切いたしません。
複数所持しているため、同時入場し一度全てのチケットを回収します。座席をこちらで選ばせていただいた後、残ったチケットをお渡しします。ご自身でお席を選んでいただくことはできません。
チケットお渡し後は好きに過ごしていただいて問題ございません。
また座席選択にお時間を頂戴する可能性がございますので予めご了承ください。
チケットのお渡し後はその場で速やかに受取連絡をお願い致します。
お席に関するクレームや送金停止は受け付けません。
代理購入は禁止させていただきます。必ずご購入者様本人がお越しください。トラブル防止と円滑なお取引のため、成人済みの日本人女性のみのご購入をお願いします。撮影や録音等の禁止行為をされる方、身体に障害のある方、ご高齢の方も購入をお控え下さい。
システムエラーや本人確認、検温等、その他いかなる理由でも、入場・観覧不可の際の責任は一切負いかねますのでご了承ください。返金対応もいたしかねます。ご購入者様都合での遅刻やキャンセルも受け付けません。上記全てに同意いただける方のみ、ご購入下さい。",True
1t2to54732,1780479135548,are-you-red-y,2026-07-26,18:00,東京ドーム,electronic,female,同行　ランダム,むむ,5.0,,QR同行ランダム,2026-06-03 09:32:15,2026-06-21 20:01:03,,listing,2,8000,"★ランダムエラー返金不可
・公演日はこちらの指定する時間と場所にて待ち合わせし同時入場していただきます。（開場時間30～45分前に集合予定・詳細は前日に連絡ボードにご連絡いたします。）
・QRの発券をお願いする場合がございます。その際に持ち逃げ防止の為、QRを表示することが可能である端末・顔写真付き身分証を一時的にお預かりする場合がございます。
・入場の際、連番でご購入いただいた方は、お連れ様と分かれて入場いただく場合がございますが必ず連番のチケットをお渡しいたします。
・同時入場後、一度チケットを回収し座席を選ばせていただきます。入場後、お席を選んでからの配布までにお時間を頂く可能性もございますのでご了承ください。（開演時間までには必ずお渡しします。）
・チケットをお渡ししたタイミングで受け取り連絡をお願いいたします。
★ご購入後はこちらの連絡を待たずに【お名前（偽名可）とお電話番号】をご連絡をお願いいたします。当日のご連絡のみ使用させていただきます。
・代理購入はお控えください。
・座席未定のため座席に関するクレームは受け付けません。
・成人済の方、日本語が話せる方、約束事、マナーを守って下さる方でお願いいたします。
・時間厳守できる方でお願いたします。（遅刻された場合、先に入場しますが、その場合の返金等には対応できかねます。）
・こまめに連絡を取れる方でお願いいたします。
・如何なる場合（ランダムエラーや本人確認等）でもキャンセル、返金は出来かねますのでご了承ください。
・公演中止になった場合のみ、手数料などを差し引いた金額を返金いたします。",True
sold_1779867367774,1779867367774,are-you-red-y,2026-07-26,18:00,東京ドーム,electronic,female,公演前日までにログイン情報共有(QRごと),,,,,2026-05-27 07:36:07,2026-06-21 20:01:03,2026-06-20 16:01:09,sold,2,15000,"QRごと
FC初期当選
該当名義ボタンあり
下3桁提示可能
同行者登録可能
有効期限内名義
クレカ支払い(同一なし)

公演前日夜までにログイン情報をお伝えしま...",False
zrg703axy0,1778558954148,are-you-red-y,2026-07-26,18:00,東京ドーム,electronic,female,同行,❤️,5.0,,番手,2026-05-12 04:09:14,2026-06-21 20:01:03,,listing,2,0,"5名義中2番手
重複すり替えなし、下3桁提示可
ランダムエラー、本人確認、体調不良等いかなる理由でも公演中止以外の返金不可
待ち合わせの詳細についてはご購入いただいた後に連絡ボードにてご連絡いたします。
遅刻された場合は待たずに先に入場しますが
その場合でも受け取り通知はしていただきますのでお時間に余裕を持ってお越しください。
お席に関するクレームはお受け致しません。
代理購入不可
日本語のわかる日本人女性のみご購入お願いいたします。",True
sold_1778815462952,1778815462952,are-you-red-y,2026-07-26,18:00,東京ドーム,electronic,female,ランダム,,,,,2026-05-15 03:24:22,2026-06-21 20:01:03,2026-06-20 16:01:09,sold,2,4200,"・公演当日、開場時間の30分前(前後する場合あり)にこちらが指定した場所に集まっていただき、同時入場いたします。
当日、交通機関等遅刻された場合は先に入場します...",False
qk6x8wdver,1779754594951,are-you-red-y,2026-07-26,18:00,東京ドーム,electronic,female,同行,r,5.0,,番手,2026-05-26 00:16:34,2026-06-21 20:01:03,,listing,2,10500,"🌟4名義中3番手！入場後すぐにお渡し！
初期当選/有効期限内/該当名義
・開場30分前に集合お願いいたします。
・複数名義所持している為、同時入場後、チケットを一度回収し、こちらで座席を選択後チケットをお渡しいたします。
・入場の際に端末のご協力をお願いする場合がございます。
その際一時的に身分証をお預かりする場合がございます。入場後チケットと交換で返却いたします。
・チケットお渡し時に受取評価をお願いいたします。
お渡し前の座席の開示やお渡し後のクレームは一切お受けできません。ご了承ください。
・同時入場の為時間は必ず厳守でお願い致します。集合時間に遅れた場合先に入場しますが、受け取り評価は必ずして頂きます。
・体調不良や交通機関の乱れによる遅刻、本人確認などで入場出来なかった場合でも買い手様都合によるキャンセルや返金は一切いたしかねます。
・公演中止の場合のみ手数料を差し引いた金額を返金します。
・代理購入はお控えください。
・成人済み、日本語の通じる方のみご購入ください。
以上をご確認の上、ご購入をお願いいたします。",True
6qdj5iiwv4,1778231860886,are-you-red-y,2026-07-26,18:00,東京ドーム,electronic,none,同行,な,5.0,,番手,2026-05-08 09:17:40,2026-06-21 20:01:03,,listing,2,15000,"2名義中2番手(男性名義あり)/すり替えなし/下3桁提示可能/初期当選/有効期限内/発送物戻りなし/山田名義
当日は開場時間までに会場の指定の場所へ集合し同時入場していただきます。集合時間・待ち合わせ場所につきましては、公演日が近づきましたら連絡ボードにて連絡いたします。時間厳守ですが、万が一遅刻される場合は必ずお早めにご連絡ください。
同行者登録はこちらで行います。
入場時にチケット表示のため端末をお借りする場合がございますので、必ず電源の入る端末をご用意ください。また、電波の状況により連絡が取れない場合に備え、念のためお電話番号をご提示いただきます。
入場後はチケットを一度回収し、こちらで座席を選択させていただきます。チケットお渡し後は、その場で受取確認をお願いいたします。座席に関するクレームやお渡しの催促は一切お受けできません。
ご購入は成人済みの日本人女性の方のみお願いいたします。
当日の交通機関の遅延、ランダムエラー、本人確認、体調不良等による入場不可など、公演中止以外の理由によるキャンセルは一切受け付けません。
公演中止の場合に限り、定価＋手数料を差し引いた金額を返金いたします。
以上をご理解いただける方のみご購入をお願いいたします。気持ちの良いお取引を心がけます。",True
pt8atnpiow,1778236005109,are-you-red-y,2026-07-26,18:00,東京ドーム,electronic,female,【少人数ランダム】当日手渡し,み,5.0,,ランダム,2026-05-08 10:26:45,2026-06-21 20:01:03,,listing,2,0,"条件あり【FC先行・初期当選・会員有効期限内・複数クレジット支払い無し】
※トラブル防止のため日本人女性以外購入禁止※
・複数名義所持の為、同時入場後チケットは全て回収させて頂きます。
入場後一旦解散、当方が座席を選ばせて頂きランダムでチケットをお渡しいたします。
・入場後座席を見に行く為チケットのお渡しまでにお時間を頂く可能性がございますのでご了承ください。
・当日はこちらが指定した時間、場所にお集まり頂きます。集合時間は開場15分前を目安に予定しております。
詳細につきましては公演間近になりましたら連絡ボードにてお知らせします。
集合時間は変更する場合もございますので当日はお時間に融通がきく方のみお願いします。
・交通機関の遅れや体調不良など、ご購入者様の都合で集合時間に遅刻された場合、いかなる理由でもお待ちすることは出来ません。ご購入者様の都合で入場出来なかった場合でも受け取り完了連絡はして頂きますので必ず時間厳守でお願いします。
・当日入場の際にQRコードの表示にご協力頂く可能性があります。パスワード入力等、ご購入者様のスマートフォンを操作させて頂く場合もございますのでご協力お願い致します。また、身分証を一時的にお預かりさせて頂く場合がございますが、その際は入場後すぐにお返しさせて頂きます。
・2枚ご購入の方は入場の際同行者様と別々でご入場していただく場合がございます。その際はご協力お願い致します。
・当日待ち合わせや会場内チケット配布連絡の際に必要な為、氏名、携帯番号をあらかじめ交換させて頂きます。
・代理購入は禁止させていただきます必ずご購入者様がお越しください。日本語が理解できる方のみご購入ください。
・主催者側から公演中止発表の場合、本サイトに基づき返金対応となります。公演中止以外(遅刻、体調不良、ランダムエラー、本人確認、検温での入場不可等)での返金は一切出来ませんのでご了承ください。
・ご購入後の個人的なご要望等にはお応えできません。
ご購入者様が座席を選択することは出来ません。
座席未定の為、座席のクレームについても一切お受けできかねます。また、所持名義に関する質問もお答えできかねます。
・今までにデジタルチケットのコンサートお取引経験がある方のみお願いします。
・当日チケットお渡し後に受け取り完了連絡を速やかにして頂ける方、受け取り後に送金停止をしないとお約束頂ける方でお願いします。
・ご購入後から公演当日まで連絡ボードでのやり取りがスムーズに出来る方、音信不通にならない方でお願いします。
ご協力して頂くことが多くあり申し訳ございませんが、全てご理解ご協力頂ける方のみご購入ください。
ご購入頂いた時点で記載事項全てに同意して頂けたものとみなします。よろしくお願い致します。",True
y1o0kwpdbt,1781714449340,are-you-red-y,2026-07-26,18:00,東京ドーム,electronic,female,公演日1日前までにQRコード共有,ラ,5.0,,QR,2026-06-17 16:40:49,2026-06-21 20:01:03,,listing,2,20000,"FC初期当選
有効期限内会員　クレカ支払い（同一なし）
QR毎でのお譲りのため同時入場等の条件はございません。
また制作開放や着ブロでもございません。
公演前日までにログイン情報をお伝えしますので
同行者登録はそちらで行って頂いて構いません。
購入者都合でのキャンセル(体調不良含む)、ランダムエラーや本人確認で入場出来なかった場合など、いかなる場合も返金キャンセルはお受けしませんのでいかなる場合も必ず受け取り通知していただきます。",True
