ticket_id,created_at_unix,event_id,perf_date,perf_time,venue,ticket_type,name_type,delivery_method,seller_name,seller_rating,order_num,ticket_tags,first_observed_at,last_observed_at,sold_at,status,quantity,price,raw_description,details_fetched
vyercl5n7r,1778223381563,are-you-red-y,2026-07-25,18:00,東京ドーム,electronic,female,同行,☆,5.0,,ランダム,2026-05-08 06:56:21,2026-06-21 20:01:03,,listing,1,10000,"有効期限内名義／初期当選／ペイジー決済
・公演当日、開場時間の約30分前を目安に会場付近にて集合し、同時入場して頂きます。集合時間のご要望は承りませんので、時間に余裕の無い方は御遠慮ください。交通機関の遅延や運休など含め、いかなる事情でも遅刻はお待ちできません。遅刻した場合でも受け取り連絡をしていただきますのでご了承ください。
・購入後、公演当日繋がる電話番号を連絡ボードにてご提示ください。
・チケット回収後は、座席選択にお時間いただきますので一度解散いたします。開演前までに再度合流し、チケットをお渡しします。買い手様に座席はお選びいただけません。座席に関するクレームはご遠慮ください。
・トラブル防止のため、代理購入は不可とさせていただきます。必ず当日入場される方がご購入するようお願いいたします。
・体調不良、遅刻、ランダムエラー、公演中断、メンバーの欠席など、公演中止以外のいかなる場合もキャンセル、返金対応はいたしません。送金停止も受け付けません。
以上ご了承いただける成人済み日本人女性の方のみご購入よろしくお願いいたします。
公演中止の場合のみ、手数料を差し引いた金額を返金いたします。",True
iyy8rx6jpf,1780037713500,are-you-red-y,2026-07-25,18:00,東京ドーム,electronic,female,同行,Saki,5.0,,QR同行,2026-05-29 06:55:13,2026-06-21 20:01:03,,listing,1,27500,"⭐️入場後10分以内すぐにお渡しできます⭐️サイチェン可
FC先行/重複すり替えなし/着ブロ指定なし/下3桁提示可/有効期限内名義/該当名義
※サイチェン可能ですので、お取引後は自由にしていただいて構いません。
友人が行けなくなった為出品いたします。
当方との同行になります。
連番内のお席はこちらが先に選ばせて頂きますのでご了承下さい。チケットをお渡し後は速やかに受取連絡をお願いいたします。座席に関するクレームは一切受け付けておりません。
当日は開場10分前ほどに会場付近にて待ち合わせし、同時入場して頂きます。
公演日が近づきましたら詳細を連絡ボードにてお伝え致します。
公共交通機関の遅延含め、待ち合わせ時間にご遅刻された場合は待たずに先に入場させていただきます。その場合でも受取連絡をお願いいたします。
また、当日の体調不良、公共交通機関の遅延、ランダムエラー、本人確認、出演者変更等如何なる理由であっても返金は不可となっております。公演中止の際には、手数料を差し引いた金額を返金致します。公演中止以外は受取連絡をして頂きますのでご了承いただける方のみご購入下さい。代理購入、急なキャンセルもおやめ下さい。
上記を全て理解、同意していただける日本人女性の方のみご購入をお願いいたします。",True
a180p7ioh2,1778222197062,are-you-red-y,2026-07-25,18:00,東京ドーム,electronic,none,同行,c,5.0,,番手,2026-05-08 06:36:37,2026-06-21 20:01:03,,listing,2,21800,"初期当選/すり替えなし/下3桁/3名義中2番手/有効期限内／ペイジー/山田名義のみ
★購入の方はプラベ出品にしますのでコメントお願いします。
【以下、必ずお読みください】
開場時間頃に会場付近で待ち合わせをし、同時入場していただきます。
待ち合わせの詳細については購入頂いた後に連絡ボードにてご連絡致します。
同時入場後一度チケットを回収し、こちらが先に座席を選んだ後、
3名義中2番目にお選び頂きます。
すり替え等は致しません。
連番で購入の方は、必ず連番でお選び頂きます。
お席に関するクレームはお受け致しません。
着ブロ指定ではございません。
遅刻された場合は待たずに先に入場しますが
その場合でも受け取り通知はして頂きますのでお時間に余裕を持ってお越しください。
遅延など購入者の都合、出演者変更、本人確認、ランダムエラーなど公演中止以外の如何なる場合も返金は致しません。
当日端末をお借りする場合がございます。
代理購入不可
日本語のわかる日本人女性のみ",True
5o2bmb8i1o,1778217406001,are-you-red-y,2026-07-25,18:00,東京ドーム,electronic,none,同行,c,5.0,,ランダム,2026-05-08 05:16:46,2026-06-21 20:01:03,,listing,1,3300,"初期当選/有効期限内/ペイジー/発送戻りなし/山田名義のみ
☆購入の方はプラベ出品にしますのでコメントでお知らせください。
【以下、必ずお読みください】
開場時間10分前頃に会場付近で待ち合わせをし、
同時入場後一度チケットを回収、
こちらで座席確認後ランダムで配布致します。
待ち合わせの詳細については購入頂いた後に連絡ボードにてご連絡致します。
少数名義でのランダム配布ですのでなるべく早くお渡しさせて頂くようにしますがお時間をいただく場合もございます。
お席に関するクレームはお受け致しません。
遅刻された場合は待たずに先に入場しますが
その場合でも受け取り通知はして頂きますので
お時間に余裕を持ってお越しください。
遅延など購入者の都合、出演者変更、本人確認、
ランダムエラーなど公演中止以外の如何なる場合も返金は致しません。
携帯の端末をお借りする場合がございます。
代理購入不可
日本語のわかる日本人女性のみ",True
sold_1780284751117,1780284751117,are-you-red-y,2026-07-25,18:00,東京ドーム,electronic,female,ランダム,,,,,2026-06-01 03:32:31,2026-06-21 20:01:03,2026-06-20 16:01:09,sold,2,2600,"着ブロ含むランダム配布/全て有効期限内名義/女性名義/全てPay-easy決済/該当名義のみ/5名義以下での入場

・公演当日、開場時間の30分前(前後する場合...",False
fjg2oebj56,1778837295898,are-you-red-y,2026-07-25,18:00,東京ドーム,electronic,female,同行,m,5.0,,番手,2026-05-15 09:28:15,2026-06-21 20:01:03,,listing,2,2000,"2番手:〜即1.5
初期当選/すり替えなし/下3桁提示可/2名義中2番手/有効期限内/山田名義のみ
・開演2時間前ごろ、会場付近で待ち合わせをし、同時入場していただきます。
・待ち合わせの詳細については購入後、公演が近づきましたらに連絡ボードにてご連絡いたします。
・同時入場後一度チケットを回収し、こちらが先に座席を選び、その後2番手でお渡しいたします。
・すり替え等は致しません。
※連番で購入の方は、必ず連番でお渡しいたします。
・お席に関するクレームはお受け致しません。
・着ブロ指定ではございません。
・ゲート不明のためビスタ席の可能性もございます。
※遅刻された場合は待たずに先に入場しますが
その場合でも受け取り通知はして頂きますのでお時間に余裕を持ってお越しください。
遅延など購入者の都合、出演者変更、本人確認、ランダムエラーなど公演中止以外の返金は致しません。
代理購入不可
日本語のわかる日本人女性のみ",True
clq5m398n3,1779205131126,are-you-red-y,2026-07-25,18:00,東京ドーム,electronic,female,ランダム配布 同時入場,こ,5.0,,ランダム,2026-05-19 15:38:51,2026-06-21 20:01:03,,listing,2,4000,"・複数名義所持の為、同時入場後チケットを回収させていただき一度解散し、こちらが指定する場所に再度お集まりいただきこちらで座席選択後のチケットをランダムでお渡しさせていただきます。
座席確認の為、お渡しまでお時間をいただく可能性がございすが、開演までにお渡ししますので催促のご連絡はお控え下さい。
・当日はこちらが指定させていただく時間、場所にお越しいただき同時入場となります。
詳細は連絡ボードにてご連絡させていただきます。
交通機関の遅れ等による遅刻や体調不良、音信不通の場合は待つことなく入場することがございます。その際の返金対応は致しかねますのでご了承ください。
・2連で購入の方は、入場時に分かれて入場していただく場合もございますが、必ず連番のチケットをお渡しいたします。
・入場時にQRコード表示のため端末の貸出にご協力いただく場合がございます。その際、身分証明書を一度お預かりさせていただく場合ございますが、入場後にログアウト、チケットと引き換えに身分証は早急にご返却いたします。ご了承ください。
・入場時のトラブルや座席へのクレームなどは一切お受けできかねますのでご了承ください。
遅刻、体調不良、音信不通、ランダムエラー、本人確認、検温での入場不可など如何なる場合も公演中止以外でのご返金は一切致しかねますのでご了承ください。",True
0li1b5dkbp,1778220990090,are-you-red-y,2026-07-25,18:00,東京ドーム,electronic,female,同行,🦋,5.0,,同行,2026-05-08 06:16:30,2026-06-21 20:01:03,,listing,1,25000,"FC先行 当方と同行 初期当選 該当名義 有効期限内 重複すり替えなし
・公演当日会場付近で待ち合わせし、当方と同時入場していただきます。入場後、一度チケットを回収し、当方が選ばなかった方のチケットをお渡しいたします。
・詳しい待ち合わせ時間・場所等はご入金後にマイページのボードにてご連絡いたします。
・チケット、座席に関してのクレームは一切受け付けません。
・チケットお渡し時に受取連絡までの処理を完了していただきます。
応じていただけない場合にはチケットをお渡しいたしませんのでご了承ください。
＜その他注意事項＞
・当日指定した時間までに会場付近で待ち合わせ可能な方。
・こまめに連絡がとれる方。事前の連絡についてもご返信ください。
・成人日本人女性の方のみご購入ください。
・時間厳守でお願いいたします。当日は会場付近の混雑が予想されますのでお時間に余裕を持ってお越しください。
・ご購入後、ご購入者様のいかなる理由でもキャンセルはできません。
・公演中止を除き、ご購入者様の体調不良、遅刻、端末エラー、出演者変更等いかなる場合により入場ができなかった場合でも必ず受取連絡はしていただき、返金はいたしかねます。
・公演中止の場合のみ、仲介手数料を引いた金額を全額返金いたします。",True
zo6piyz80p,1778415057142,are-you-red-y,2026-07-25,18:00,東京ドーム,electronic,female,同行,みるく,5.0,,同行番手,2026-05-10 12:10:57,2026-06-21 01:01:06,,deleted,2,7500,"⭐️4名義中4番手のお譲りとなります⭐️下3桁提示可
ファンクラブ先行
※同時入場後全てのチケットを一度回収し、こちらで座席を選んでから4番目にチケットをお渡しします。
※詳しい時間と集合場所は連絡ボードにてお伝えします。必ず時間厳守でお願いします。
当日は必ずお時間に余裕を持って集合場所までお越しください。
※チケットのお渡しまで時間を要する可能性がございますので、会場内へ入ってからは一旦解散とさせていただく予定です。チケット受け取りの際に受取通知をお願いします。
※購入者様は座席を選べませんのでチケットに関するクレームは一切お受けできません。名義数等の質問にも一切お答えしません。
※デジタルコードのエラー、本人確認、体調不良等による入場の際のトラブルに関しましては一切の責任を負いかねます。
返金などの対応もできませんのでご了承ください。公演中止の場合のみ手数料を差し引いた額を返金いたします。
※入金後の公演中止以外の購入者様都合によるキャンセルは一切お受けできません。
※女性名義の為女性以外の方は購入をご遠慮ください。代表者、同行者共に日本語の通じる方に限ります。
上記すべての内容を理解いただけた方のみ購入をお願いいたします。購入された時点で全て合意いただいたものとみなします。",True
fm0srxejcl,1778224227928,are-you-red-y,2026-07-25,18:00,東京ドーム,electronic,female,同行,はち,5.0,,ランダム記載あり,2026-05-08 07:10:27,2026-06-21 20:01:03,,listing,1,9000,"ランダムエラー等で入場不可な場合は返金いたします
【条件あり】
複数名義所持の為、発券後一度チケットを回収し選ばせていただきます。座席を選ぶのにお時間いただく場合がございます。座席券はこちらで決めてお渡ししますのでお選びいただけませんご了承ください。
【集合時間/待ち合わせ】
当日開演2時間半前前後に指定場所(会場周辺)に集合していただきます。
詳しい場所は決まり次第ご連絡させていただきます。
当日買い手様のご都合でご連絡が取れない場合や交通機関の遅延含め指定集合時間に遅れてしまう場合はご入場いただけません。その際、こちらからのキャンセル処理はせず受取通知をしていただき返金等は致しませんので、お時間には余裕をもってお越しください。
【注意】
・ご入場される方は日本人女性の方でお願い致します。(代理購入不可)
・身分証の預かりはございませんが、ご購入者様の端末をお借りしてQRを表示させていただく場合がございます。
・お席に関するクレームは一切お受けできません。
・名義数などチケットに関する情報はお答え致しません。
・公演中止の際は規約に従い手数料を引いた金額を返金致します。
またその他ランダムエラーなどで入場不可な場合は返金いたします。
その他体調不良、交通事情を含む待ち合わせ遅刻等の如何なる理由でも返金は一切致しませんのでご了承ください。
以上、全て納得ご了承いただいた方のみご購入お願い致します",True
sbmwnq8dod,1778416247692,are-you-red-y,2026-07-25,18:00,東京ドーム,electronic,female,2名義中1番手 当方と同行,aks,5.0,,同行,2026-05-10 12:30:47,2026-06-21 20:01:03,,listing,1,35000,"・2名義中1番手、当方との同行です。
・すり替えなし。下3桁提示可能。
・入場時、購入者様の端末でQRの表示にご協力いただきます。
・クレカ払いではありません。
・受取後はその場で受取完了連絡お願い致します。
・詳しい待ち合わせ時間・場所等は公演日が近くなりましたらお知らせします。
公演中止の際は手数料などを差し引いた金額を返金させて頂きます。
その他いかなる理由(ランダムエラー、交通機関の遅延等)でご入場出来なかった場合でも受取はして頂きますのでご了承ください。",True
chbbolhsv1,1779420387683,are-you-red-y,2026-07-25,18:00,東京ドーム,electronic,female,同行,☺︎,5.0,,ランダム同行,2026-05-22 03:26:27,2026-06-21 20:01:03,,listing,2,4000,"ランダム配布/初期当選/有効期限内/発送物戻りなし/開演15分前までのお渡し
・当日はこちらが指定させていただく時間、場所にお越しいただき同時入場となります。
詳細は連絡ボードにてご連絡させていただきます。
・複数名義所持の為、同時入場後チケットを回収させていただき一度解散し、こちらが指定する場所に再度お集まりいただきこちらで座席選択後のチケットをランダムでお渡しさせていただきます。
座席確認の為、お渡しまでお時間をいただく可能性がございすが、開演までにお渡ししますので催促のご連絡はお控え下さい。
・交通機関の遅れ等による遅刻や体調不良、音信不通の場合は待つことなく入場することがございます。その際の返金対応は致しかねますのでご了承ください。
・2連で購入の方は、入場時に分かれて入場していただく場合もございますが、必ず連番のチケットをお渡しいたします。
・入場時にQRコード表示のため端末の貸出にご協力いただく場合がございます。その際、身分証明書を一度お預かりさせていただく場合ございますが、入場後にログアウト、チケットと引き換えに身分証は早急にご返却いたします。ご了承ください。
・入場時のトラブルや座席へのクレームなどは一切お受けできかねますのでご了承ください。
遅刻、体調不良、音信不通、ランダムエラー、本人確認、検温での入場不可など如何なる場合も公演中止以外でのご返金は一切致しかねますのでご了承ください。
・日本語が分かる日本人のみご購入お願いいたします
・代理購入不可",True
4lqaev0y1u,1778222871605,are-you-red-y,2026-07-25,18:00,東京ドーム,electronic,female,同行,☆,5.0,,ランダム,2026-05-08 06:47:51,2026-06-21 20:01:03,,listing,1,9500,"有効期限内名義／初期当選／ペイジー決済
・公演当日、開場時間の約30分前を目安に会場付近にて集合し、同時入場して頂きます。集合時間のご要望は承りませんので、時間に余裕の無い方は御遠慮ください。交通機関の遅延や運休など含め、いかなる事情でも遅刻はお待ちできません。遅刻した場合でも受け取り連絡をしていただきますのでご了承ください。
・購入後、公演当日繋がる電話番号を連絡ボードにてご提示ください。
・チケット回収後は、座席選択にお時間いただきますので一度解散いたします。開演前までに再度合流し、チケットをお渡しします。買い手様に座席はお選びいただけません。座席に関するクレームはご遠慮ください。
・トラブル防止のため、代理購入は不可とさせていただきます。必ず当日入場される方がご購入するようお願いいたします。
・体調不良、遅刻、ランダムエラー、公演中断、メンバーの欠席など、公演中止以外のいかなる場合もキャンセル、返金対応はいたしません。送金停止も受け付けません。
以上ご了承いただける成人済み日本人女性の方のみご購入よろしくお願いいたします。
公演中止の場合のみ、手数料を差し引いた金額を返金いたします。",True
40hcdjcc2t,1778219564972,are-you-red-y,2026-07-25,18:00,東京ドーム,electronic,none,同行,あ,5.0,,ランダム,2026-05-08 05:52:44,2026-06-21 20:01:03,,listing,2,12000,"・ランダム配布
・集合時間、集合場所等は連絡ボードにてお伝えいたします。
・必ず時間厳守でお願い致します。集合時間に遅れた際は先に入場させて頂きますが受取連絡はして頂きます。
・同時入場後、全てのチケットを回収し、一度解散させて頂きます。その際は自由に行動して頂いて構いません。会場内にて再集合して頂きチケットをお渡し致します。チケットお渡しまでにお時間がかかることを予めご了承ください。開演5分前までにはチケットをお渡しいたします。
・再集合の際はお電話にてご連絡させていただくため、お電話番号とお名前を教えてください。お名前は偽名で構いません。
・同行者登録は全てこちらで管理させていただきます。同行者登録に必要な情報をお伺いする場合がございます。予めご了承ください。
・チケットお渡しした際にその場で受取連絡をお願いいたします。
・チケットはランダムにお渡し致しますので購入者様はお選び頂けません。
・トラブル防止のため、日本人女性の方のみでお願い致します。代理購入、常識がない方、男性の方、日本語が不自由な方のご購入は御遠慮ください。
・座席に関するクレーム等一切受け付けません。
・ランダムエラーや本人確認などで入場出来なかった場合や体調不良、遅刻等いかなる場合でも返金致しません。必ず受取連絡をしていただきます。
・公演中止の場合のみ手数料を差し引いた金額を返金いたします。
上記全てをご了承いただけた方のみご購入お願いいたします。",True
lt6j0kx8bn,1778248713292,are-you-red-y,2026-07-25,18:00,東京ドーム,electronic,female,同時入場,あ,5.0,,番手,2026-05-08 13:58:33,2026-06-21 20:01:03,,listing,2,15000,"3名義中2番手/すり替えなし/下3桁提示可
公演当日は、開場15~20分前を目安に会場付近で待ち合わせし、同時入場していただきます。（集合時間や場所、服装等の詳細は、当日メッセージにてお伝えいたします）時間厳守でお願いいたします。
同時入場の際は、お連れ様と別れて入場していただく可能性がございますが、必ず連番のチケットをお渡しいたします。入場後は一度チケットを回収し、座席確認後に改めてお渡しいたします。座席確認のためお時間をいただく場合がございますが、なるべく短時間でお渡しできるよう努めます。チケットお渡しと同時に受け取り確認を行っていただきますので、あらかじめアプリのご準備をお願いいたします。
チケット発券の際に端末をお借りする場合がございます。
また、スムーズなお取引、会場の電波状況に備えて電話番号をご提示していただける方のみご購入ください。
※ランダムエラー、本人確認、体調不良、交通機関の遅延など、公演中止以外の如何なる理由によるキャンセルや返金対応は致しかねます。
座席に関するクレームは一切お受けできませんのでご了承ください。
公演中止時のみ、手数料を差し引いた金額を返金いたします。
集合時間に遅刻された場合は、先に入場いたしますが、その際も受け取り確認は必ずしていただきます。
上記の内容を全てご理解、ご了承いただいた日本語が通じる成人女性のみご購入をお願いいたします。",True
