ticket_id,created_at_unix,event_id,perf_date,perf_time,venue,ticket_type,name_type,delivery_method,seller_name,seller_rating,order_num,ticket_tags,first_observed_at,last_observed_at,sold_at,status,quantity,price,raw_description,details_fetched
sold_1778220031113,1778220031113,are-you-red-y,2026-06-28,15:00,京セラドーム大阪,pickup_number,female,公演日7日前までに発券番号共有,,,,,2026-05-08 06:00:31,2026-06-21 20:01:03,2026-06-20 16:01:09,sold,2,15000,"1番手です。
QR提示
詳しくはメッセージ送ってください。
下3桁提示可能。
公演中止以外の返金お断りしています",False
sold_1779631039632,1779631039632,are-you-red-y,2026-06-28,15:00,京セラドーム大阪,electronic,female,3名義中3番手,,,,,2026-05-24 13:57:19,2026-06-21 20:01:03,2026-06-20 16:01:09,sold,2,7000,"FC先行／すり替えなし／有効期限内／下3桁提示可

公演当日、開場時間に会場付近にて集合し、同時入場して頂きます。詳しい待ち合わせ時間、場所については購入後取引...",False
sold_1778238795262,1778238795262,are-you-red-y,2026-06-28,15:00,京セラドーム大阪,electronic,female,同行,,,,,2026-05-08 11:13:15,2026-06-21 20:01:03,2026-06-20 16:01:09,sold,2,11000,"2名義中2番手のお譲り
FC初期当選/座席未定/すり替えなし/有効期限内名義/該当名義(変更ボタンあり)/同一クレカ決済無し

公演当日、会場付近にてこちらが指...",False
t4g511ayn3,1781017037558,are-you-red-y,2026-06-28,15:00,京セラドーム大阪,electronic,female,当日手渡し,ka,5.0,,番手,2026-06-09 14:57:17,2026-06-21 20:01:03,,listing,2,10000,"初期当選/重複すり替えなし/下3桁提示可/3名義中3番手/有効期限内/山田名義
開場時間の15分前に会場付近で待ち合わせをし、同時入場していただきます。
待ち合わせの詳細については購入頂いた後に連絡ボードにてご連絡致します。
同時入場後一度チケットを回収し、こちらが先に座席を選び次第、3名義中3番手をお渡しいたします。
すり替え等は致しません。
お席に関するクレームはお受け致しません。
着ブロ指定ではございません。
ゲート不明のためビスタ席の可能性もございます。
遅刻された場合は待たずに先に入場しますが
その場合でも受け取り通知はして頂きますのでお時間に余裕を持ってお越しください。
遅延など購入者の都合、出演者変更、本人確認、ランダムエラーなど公演中止以外の如何なる場合も返金は致しません。
当日端末をお借りする場合がございます。
日本語のわかる日本人女性のみ",True
wb5j6chlhh,1780325342763,are-you-red-y,2026-06-28,15:00,京セラドーム大阪,electronic,female,同行,りり,5.0,,ランダム,2026-06-01 14:49:02,2026-06-21 20:01:03,,listing,2,10800,"少数ランダム配布。
重複のため当日は同時入場後に座席を選ばせて頂き、ランダムにお渡しいたします。入場後は全てのチケットを当方が回収し、実際の座席位置を確認するため、半券のお渡しまでお時間を頂く場合がございます。開演時刻までには必ずお渡しいたしますので、ランダム配布の意味がわかる方のみご購入ください。所持名義数に関するご質問はお答え出来かねますのでご了承ください。代理購入不可。
当日は指定入場時刻の20分前に入場口付近にて待ち合わせし、全員揃った状態で同時入場いたします。大幅な遅刻は待たずに入場しますので必ずこちらの指定した集合時間をお守り頂ける時間に余裕のある方のみご購入ください。またスムーズに連絡の取れる日本人のみでお願いいたします。
※入場時、半券の持ち逃げ防止のため一時的に中身の見えない封筒に身分証をお預かりする場合がございます。
購入後、公演当日繋がる電話番号を連絡ボードにてご提示ください。
当日まで座席未定のためお渡しする座席の善し悪し、感染症への罹患や発熱･体調不良(本人･同行者･身内の不幸等含む)交通機関の遅れ、本人確認、ランダムエラーなど、いかなる場合でも返金やキャンセルはお受け出来かねますのでご了承ください。
お渡ししたチケットについてに何かご質問があ
ご購入頂いた方は上記内容に全て同意したものとみなし、条件記載通りのお取引を必ずしていただきますようお願いいたします。その他ご質問のある方は事前にメッセージにてお問い合わせください。",True
sold_1781584379548,1781584379548,are-you-red-y,2026-06-28,15:00,京セラドーム大阪,electronic,female,同行,,,,,2026-06-16 04:32:59,2026-06-21 20:01:03,2026-06-20 16:01:09,sold,2,2000,"ランダム配布
開演15分前のお渡し
ランダムエラー、遅刻等いかなる理由でも返金不可",False
sold_1779867268634,1779867268634,are-you-red-y,2026-06-28,15:00,京セラドーム大阪,electronic,female,公演前日までにログイン情報共有(QRごと),,,,,2026-05-27 07:34:28,2026-06-21 20:01:03,2026-06-20 16:01:09,sold,2,18000,"QRごと
FC初期当選
該当名義ボタンあり
下3桁提示可能
同行者登録可能
有効期限内名義
クレカ支払い(同一なし)

公演前日夜までにログイン情報をお伝えしま...",False
nuo9gjfkrs,1779637819454,are-you-red-y,2026-06-28,15:00,京セラドーム大阪,electronic,female,同時入場 5名義中5番手,こ,5.0,,番手,2026-05-24 15:50:19,2026-06-21 20:01:03,,listing,2,8000,"5名義中5番手
すり替えなし/下3桁掲示可/該当名義/有効期限内
・複数名義所持の為、同時入場後チケットを回収させていただき一度解散し、こちらが指定する場所に再度お集まりいただき、チケットをお渡しさせていただきます。
座席確認の為、お渡しまでお時間をいただく可能性がございすが、開演までにお渡ししますので催促のご連絡はお控え下さい。
・当日はこちらが指定させていただく時間、場所にお越しいただき同時入場となります。
詳細は連絡ボードにてご連絡させていただきます。
交通機関の遅れ等による遅刻や体調不良、音信不通の場合は待つことなく入場することがございます。その際の返金対応は致しかねますのでご了承ください。
・2連で購入の方は、入場時に分かれていただく場合がございますが、必ず連番のチケットをお渡しいたします。
・入場時にQRコード表示のため端末の貸出にご協力いただく場合がございます。その際、身分証明書を一度お預かりさせていただく場合ございますが、入場後にログアウト、チケットと引き換えに身分証は早急にご返却いたします。ご了承ください。
・入場時のトラブルや座席へのクレームなどは一切お受けできかねますのでご了承ください。
遅刻、体調不良、音信不通、ランダムエラー、本人確認、検温での入場不可など如何なる場合も公演中止以外でのご返金は一切致しかねますのでご了承ください。",True
uednhrde0d,1781507104277,are-you-red-y,2026-06-28,15:00,京セラドーム大阪,electronic,female,4名義中4番手/すり替えなし,り,5.0,,同行記載あり,2026-06-15 07:05:04,2026-06-21 20:01:03,,listing,2,6000,"・入場後、一度チケットを回収し、こちらが座席選択した後4番目にチケットをお渡しします。
・当日座席選択の際に実際に座席を見に行くお時間をいただく場合がございます。
その際の同行や座席の提示は一切いたしかねます。
・チケットお渡し時に受取評価をお願い致します。
座席に関するご要望、クレームは一切お受けできません。
・同時入場の為、時間は必ず厳守でお願い致します。
集合時間に遅れた場合先に入場しますが、受け取り評価は必ずして頂きます。
・公演中止以外の理由（出演者変更、ランダムエラー、本人確認等）で入場出来なかった場合や買い手様の都合によるキャンセルなどいかなる場合も返金は致しかねます。
・公演中止の場合のみ手数料を差し引いた金額を返金します。
・代理購入はお控えください。
・成人済み、日本語の通じる方のみご購入ください。
以上をご確認の上、ご購入をお願いいたします。",True
esc4p214yx,1779967880181,are-you-red-y,2026-06-28,15:00,京セラドーム大阪,electronic,none,3名義中3番手,らむ,5.0,,番手QR同行,2026-05-28 11:31:20,2026-06-21 20:01:03,,listing,2,11900,"⭐️3名義中3番手⭐️
初期当選/該当名義/有効期限内/着ブロ指定なし/下3桁提示可能
集合時間は12時45分頃を予定してます。
あくまでも予定ですので前後する可能性ございますが時間厳守でお願いします。
・キャンセル防止のために予めのゲート、席種開示不可です。(申し込み時着ブロ希望なし)
万が一着ブロ、立ち見、ビスタなどが出てしまってもキャンセルやご返金等受け付けておりません。
・入場の際QR表示で端末をお借りする場合がございます。
・チケット発券の際持ち逃げ防止のため、同行者様共に身分証をお預かりさせていただく可能性ございます。
・入場後は1度チケットを回収して解散し、ランダムの方は開演〜10分前までにお渡し致しますので催促せずお待ちください。
場合により開演ぎりぎりになる可能性ございますのでご了承ください。
番手または同行の場合も座席確認のため1度解散しお時間頂く場合ございます。
・座席に対するクレームは一切受け付けておりません。
・ランダムエラー、本人確認、体調不良、交通機関の運行状況、メンバー不在など如何なる理由でも公演中止以外の返金致しかねます。
・入場後速やかに受け取り評価お願いします。
・キャンセル防止のために予めのゲート、席種開示不可です。(申し込み時着ブロ希望なし)
万が一着ブロ、立ち見、ビスタなどが出てしまってもキャンセルやご返金等受け付けておりません。
・入場の際QR表示で端末をお借りする場合がございます。
・チケット発券の際持ち逃げ防止のため、同行者様共に身分証をお預かりさせていただく可能性ございます。
・入場後は1度チケットを回収して解散し、ランダムの方は開演〜10分前までにお渡し致しますので催促せずお待ちください。
場合により開演ぎりぎりになる可能性ございますのでご了承ください。
番手または同行の場合も座席確認のため1度解散しお時間頂く場合ございます。
・座席に対するクレームは一切受け付けておりません。
・ランダムエラー、本人確認、体調不良、交通機関の運行状況、メンバー不在など如何なる理由でも公演中止以外の返金致しかねます。
・万が一遅刻や体調不良で来れない場合も受け取り評価お願いします。
・入場後速やかに受け取り評価お願いします。",True
dlcre0vho6,1778500228297,are-you-red-y,2026-06-28,15:00,京セラドーム大阪,electronic,female,同行,s,5.0,,同行番手,2026-05-11 11:50:28,2026-06-21 20:01:03,,listing,2,11500,"FC先行/3名義中3番手/すり替えなし/下3桁提示可/有効期限内
公演当日、会場付近にて集合し、同時入場していただきます。
発券後一旦チケットを回収させていただき、座席選択後にチケットをお渡しいたします。
座席に関するクレーム等お受けできません。
大幅な遅刻の場合は先に入場する可能性がございます。
その際も受取連絡していただきますのでご了承ください。
公演中止の際は手数料などを差し引いた金額を返金いたします。
また公演中止以外のいかなる理由がございましてもキャンセル・返金・クレーム等の対応はいたしませんのでご了承ください。
成人済み日本人女性の方のみご購入ください。代理購入はお控えください。
上記全て確認の上、ご購入ください。",True
sold_1781605441721,1781605441721,are-you-red-y,2026-06-28,15:00,京セラドーム大阪,electronic,female,開演30分前に開場付近にて集合し同時入場,,,,,2026-06-16 10:24:01,2026-06-21 20:01:03,2026-06-20 16:01:09,sold,2,1000,"全名義コンビニ決済済み。会員期限内
条件あり 複数所持のため同時入場後こちらで座席を選ばせてもらいます。

入場の際に落札者様の端末をお借りしてQRコードの表示...",False
fdy7jgzkji,1781695808940,are-you-red-y,2026-06-28,15:00,京セラドーム大阪,electronic,female,公演日前日にQRコード共有,a,5.0,,QR,2026-06-17 11:30:08,2026-06-21 20:01:03,,listing,1,32000,"QR毎/初期当選/下3桁掲示可/有効期限内/着ブロ指定無し
・公演前日に詳細をご連絡します。
・座席未定の為、お席に関するクレームは受け付けません。
・当日ご入場後はすみやかに入場連絡をお願いいたします。
・公演中止以外はいかなる理由でも返金いたしかねます。お取引に不慣れな方はご遠慮ください。
以上のことを同意していただける日本人成人女性のみご購入をお願いいたします。",True
sold_1778450647549,1778450647549,are-you-red-y,2026-06-28,15:00,京セラドーム大阪,paper,female,当日手渡し,,,,,2026-05-10 22:04:07,2026-06-21 20:01:03,2026-06-20 16:01:09,sold,1,8000,"ランダム配布/入場時全て有効期限内山田名義/入場時全て女性名義
公演当日、開場時間の15〜20分前に集合して同時入場して頂きます。
入場後はチケットを回収、一度...",False
y884rv7rgw,1781939054083,are-you-red-y,2026-06-28,15:00,京セラドーム大阪,electronic,female,同行,ki,4.8,,ランダム,2026-06-20 07:04:14,2026-06-21 20:01:03,,listing,1,3000,"FC先行/少人数ランダム配布(2名義入場)/座席未定
当日こちらが指定する時間に集合し、同時入場をしていただきます。入場後はチケットを回収し、当方が座席選択をした後、ランダムで配布いたします。
ご購入者様は座席をお選びいただけません。
座席選択にお時間を頂くため一旦解散し、再集合をお願いする場合がございます。
チケットは開演20分前までにお渡しいたします。チケットお渡しの際、その場で受取連絡をお願いいたします。
本人確認、ランダムエラー、体調不良、遅刻等、公演中止以外の如何なる理由での返金対応はいたしません。また、座席のクレームについては一切対応いたしかねます。必ず受取連絡をお願いいたします。
上記すべてご了承の上、20歳以上の日本語で不自由なくやり取りができる女性の方のみご購入ください。",True
jo7d2xjuoe,1780912367524,are-you-red-y,2026-06-28,15:00,京セラドーム大阪,electronic,female,6名義3番手,RRR,5.0,,ランダム番手同行QR,2026-06-08 09:52:47,2026-06-21 20:01:03,,listing,2,15000,"FC先行/初期当選/6名義中3番手/すり替えなし/下3桁提示可/座席未定
・公演当日、開場時間の30分前(前後する場合あり)にこちらが指定した場所に集まっていただきます。
当日、遅刻された場合は先に入場します。
・入場時お連れ様と分かれて入場していただく場合がございます。
・入場後全てのチケットを回収し、こちらが座席選択後チケットをお渡しします。
チケットを回収後、一旦解散し再度待ち合わせをしてチケットをお渡しする形になります。
・入場の際、QRコード表示のため購入者様のお手持ちのスマートフォンをお借りさせていただく場合がございます。ログイン、ログアウトはこちらでします。
・お渡ししたチケットについてのクレームはお受けできかねます。また、遅刻、体調不良、ランダムエラー、本人確認、交通機関の運休、遅延等のトラブルで入場できなかった場合の返金対応はできかねます。
※公演中止の場合のみ返金対応します。
・取引確定後のキャンセルは受け付けておりません。
やむを得ない事情で当日来れなくなった場合も受け取り通知は行っていただきます。
※無断キャンセルはご遠慮ください。直前でキャンセルされる場合も必ずご連絡ください。
・公演中の盗聴や盗撮など名義が傷つくような行為はお辞め下さい。
・購入後、お名前(仮名可)のご提示をお願いします。お日にち近づいたタイミングで電話番号交換していただきます。
・日本語が理解出来る日本人女性のみご購入ください。代理購入はご遠慮ください。
上記内容にご了承いただける方のみ、ご購入をお願いいたします。",True
x4jafk7qbf,1780920073658,are-you-red-y,2026-06-28,15:00,京セラドーム大阪,electronic,none,同行,tmoktkt,5.0,,ランダム,2026-06-08 12:01:13,2026-06-21 20:01:03,,listing,1,5000,"少人数ランダム｜開演45分前チケットお渡し｜ランダム理解ありの方のみご購入ください
※購入の方はプラベ出品にしますのでコメントでお知らせください。
【以下、必ずお読みください】
・当日指定時間に会場付近で集合し、同時入場します。必ず時間厳守でお願い致します。大幅に遅刻された場合先に入場することもあります。その場合でも受取確認をお願い致します。返金対応は致しかねませんのでご了承ください。
・半券をお渡しする際にその場で受取連絡をお願い致します。その後サイチェンなど自由にしていただいても構いませんが、名義を潰すような迷惑行為はお控えください。座席に関するクレームは受け付けません。
・公演中止以外、本人確認、体調不良やランダムエラーによる入場不可など、如何なる場合も返金対応致しませんのでご了承ください。
・代理購入、日本語が通じない方の購入はご遠慮ください。
・上記全てご理解いただける方・こまめに連絡を取れる方のみでお願い致します。",True
3hqb60p5zc,1781737952277,are-you-red-y,2026-06-28,15:00,京セラドーム大阪,electronic,female,同行,あ,5.0,,番手,2026-06-17 23:12:32,2026-06-21 20:01:03,,listing,2,7000,"3名義中3番手/初期当選/すり替え無し/下3桁提示可能/有効期限内/同一クレカ支払い無し/全て山田名義/着ブロ指定無し/サイチェン可
当日は開場15分前に集合予定です。詳しい集合時間、場所は前日までにお伝えします。遅刻された場合のキャンセルは致しかねます。お時間には余裕を持ってお越しください。
当日は会場付近にて待ち合わせ後、同時入場していただきチケットを一度回収させていただいた後こちらで座席を選ばせていただいてから、3番手のお席をお渡しいたします。
座席確認の為、一度解散する可能性もございますが、必ず開演までにお渡し致します。
連番の場合、入場のみ同行者様と別々に入って頂きますが、お渡しするチケットは必ず連番のチケットをお渡しします。
チケット受け取り後は、その場で受け取り評価お願い致します。
座席に関するクレームは一切受付できません。
会場内、電波が悪い可能性ございますので電話番号を交換していただく場合があります。
公演中止の際のみ、手数料を差し引いた金額返金いたします。体調不良、ランダムエラー等、公演中止以外での返金は一切できませんので予めご了承ください。
トラブル防止の為、日本人女性のみでお願い致します。",True
5xrlesu3vi,1781090258553,are-you-red-y,2026-06-28,15:00,京セラドーム大阪,electronic,female,公演2日前にログイン情報共有,もち,5.0,,QR,2026-06-10 11:17:38,2026-06-21 20:01:03,,listing,2,13800,"QR毎/下3桁提示可/有効期限内/該当名義/前回前々回スタンド2連続名義
※訳あり名義です※
下記全てお読みいただきご理解いただける方のみご購入ください。
発送物戻り名義、表示ありです。
本人確認の可能性がございますので、相場よりお安くしております。
重複でのお譲りがないことを証明するため、同行者登録は買い手様でお願いいたします。
そのため、当日のQR表示が出来ないなどの不具合、ランダムエラー、本人確認など、いかなる場合も返金不可です。
※前回までランダムエラー、本人確認が生じたことはございません。
入場後の本人確認、座席のクレームに関しましても当方は一切の責任を負いかねます。
ご理解いただけた方のみご購入をお願いいたします。",True
55azndb8pm,1780676908853,are-you-red-y,2026-06-28,15:00,京セラドーム大阪,paper,female,当日手渡し,🎀🎶,5.0,,ランダム,2026-06-05 16:28:28,2026-06-21 20:01:03,,listing,1,2500,"・複数名義所持のため、同時入場後にチケットを一度お預かりします。当方の座席選択後に再度ご連絡し、チケットをお渡しいたします。
・開演20分前にはお渡しいたします。当日の上乗せで早渡しが可能です。
・当日の集合は会場30分前を予定しています。間に合う方、かつ迅速なご連絡が可能な方のみのご購入をお願いいたします。
・成人しており、日本語での会話が問題ない方のみとさせていただきます。",True
24jc3tgfps,1781011131641,are-you-red-y,2026-06-28,15:00,京セラドーム大阪,electronic,none,同行,R,5.0,,番手,2026-06-09 13:18:51,2026-06-21 20:01:03,,listing,1,10000,"3名義中3番手/初期当選/該当名義/すり替えなし/下3桁提示可能
公演当日会場付近にて、会場15分前に待ち合わせをしてもらいます。
待ち合わせに関しましては、当日連絡ボードにて連絡させていただきます。
入場の際に、QR表示の為端末をお借りする場合がございます。
お取引決定後のキャンセルや座席に関するクレーム等一切お受けできません。
本人確認・ランダムエラー・メンバー又は購入者様の体調不良等の理由で入場できない場合も返金致しかねますのでご了承ください。また、その際も受け取り評価をして頂きます。公演中止の場合のみ返金させていただきます。",True
